User Type,Username,Date,Text
,w2207,2007-11-18T10:09Z,"Oh, thank you so very much!!!"
,w2207,2007-11-20T10:16Z,Are you able to upload the new boots aswell? I really would like to hear Suede and Mountain live :) Thank you!!
,digitalghost666,2007-11-27T23:21Z,"I don't know why but the new shows are not getting added to the search engine.  Here are the links to Clearwater, Ft. Meyers and Houston

http://thepiratebay.org/user/digitalghost666/"
,torimanka,2009-05-05T19:22Z,Thank you so much!I love Mother Revolution!
