User Type,Username,Date,Text
,DrKoks,2007-10-27T11:57Z,"Thanks man for a great up ,,,"
,denidanny,2007-10-27T13:35Z,continue the good work
[V],velvetfog,2007-10-28T21:46Z,Please seed. Everyone is stuck at 70%
,tronicman,2007-10-30T23:14Z,"Like velvetfog is saying, seed... come on people!! We have to finish this!!"
,Juel92,2009-03-16T17:17Z,Seed please! I'm stuck at 71%. I tried to preview watch it but that only worked halfass but I could see that the quality is good so again...please seed!
