User Type,Username,Date,Text
,luger,2005-04-28T07:06Z,Riktiga gammla klassiker! Tack.
,gabbe_88,2005-04-28T17:41Z,Tack för att du la upp dem!
,Bullenjullen,2005-04-30T17:12Z,I love You :)
,LasseLiten,2006-10-27T18:53Z,seeda tack 
,lovemillis,2006-12-23T11:55Z,helt underbart.har precis fått ner den...tack så mkt...
,Inkorrekt,2007-09-14T21:46Z,Seeda tack! Skön som fan...
,pitbullfarm88,2007-11-17T16:29Z,Håller på att ladda ner dem... tycker inte man kan tröttna på dem....
,red_laces,2007-11-23T22:47Z,"ville bara påpeka att dom stavade sitt namn ""agent bulldogg""."
,harvey666,2008-01-14T15:45Z,tack så mycket  :)...
,The_Devil_Himself,2008-02-23T14:37Z,Fuck yeah
,SkinheadKiruna,2008-02-25T16:14Z,Svensk Oi! när den är som bäst!
,ktmfille,2008-03-18T20:57Z,skulle vara snällt om du kunde seeda blev av med allt när hård disken kraschade :(
,saintof,2008-05-24T12:46Z,Så jävla gott. Tack som fan för att folk fortfarande seedar oxå!
,Eratoc,2008-06-16T22:06Z,"Ingen som har deras singlar? typ Backstreet Boys, Vi är tillbaka, Clockwork Orange?"
,svensk_huvudverk,2008-06-27T22:23Z,man får nästan ha ett 6-pack folk öl till detta=) tack för UL.......
,eoxz,2009-04-07T16:45Z,"Tack för UL, men det vore bra om någon seedade"
,evilcandybag,2010-03-09T12:06Z,Härligt! Kommer seeda detta så länge jag kan!
