User Type,Username,Date,Text
,alvaro,2004-09-20T22:50Z,thank you realy nice!!!
,exstac,2004-10-01T17:54Z,super
,biggan46,2004-10-25T18:41Z,Vore sn채llt om n책gon kunde seeda
,Fornic8R,2005-06-12T12:00Z,"Why are'nt these all ripped at 192kbps or better? 128kbps sounds terrible on some of them - play a 192kbps version and THEN listen to the 128kbps version... BAD BAD BAD. Not that I do not appreciate the download, but 128kbps is terrible quality..."
,maxo127,2005-06-18T00:58Z,help! I don''t get how I can download the song :(
,dissycream,2007-03-24T10:18Z,thank you so much....nice collection you got...good work!
,hasch_gurra,2008-04-04T00:12Z,"PLEASE SEED
This is the only torrent i've been able find with Jungle Love by the TIME

plz seed"
,pukkalover,2009-03-30T22:30Z,I know this torrent is yonks old but can somebody seed please or take the upload limit off...6 seeds connected and its going at 3 kb/s  cheers
,YpsiFrog,2009-04-08T01:49Z,Thanks gave my wife & I something to share with our daughter
