User Type,Username,Date,Text
,JoakimLj,2007-07-22T19:31Z,:O
,bones88,2007-07-22T20:15Z,varför tanka upp ett torrent program när man kan tanka de från andra sidor=//
,unkdd,2007-07-22T20:28Z,"
not sure if it affects this but you may want to check it out first....

There have been reports of utorrent 1.7 sending private info outside the tracker

The client version 1.7 will not be allowed at ***** because of this problem 

we understand the need for a utorrent version to be available to you 

please feel free to download utorrent 1.6.1 

we are sorry for the troubles our utorrent members have faced due to these bugs"
