User Type,Username,Date,Text
[T],silvia-,2007-06-02T21:56Z,Full DVD5
,Majty,2007-06-02T23:33Z,"Ah! I´ve been thinking about this movie for years! I didnt know the name of it but when I red about it on imdb I recognized it. I remember someone trying to have sex with a chick but ended up having it with some berries that made him fall asleep instead!

http://www.imdb.com/title/tt0082146/"
,Uncle_Fucker,2007-06-08T02:36Z,"This movie is well worth the download.
If you like seeing stupid-funny at its best, then this is great.

Smoke something nice while watching and you might laugh yourself to death."
,Mythos47,2007-09-16T15:51Z,"Can someone turn up the speed and seed pleace, it will take me 3 weks to download"
,muzikphan,2007-11-28T08:24Z,Many thanks for this.
,Hambonehawk,2008-04-01T00:06Z,"My DivX version that works.
http://thepiratebay.org/tor/4107981/Caveman.DivX
I also have a converter for DVD."
,orosas,2008-11-28T03:32Z,"Many Thanks  (in advance)
Excelent movie.... hard to find!
"
