User Type,Username,Date,Text
,AssMaster,2006-06-08T20:22Z,"Helt okej, bra text ^^"
,Kaif__,2006-06-08T20:37Z,Tackar. Mycket bra låt!
,venta,2006-06-11T18:10Z,yess bra låt! sprid sprid!!
,ReSoiL,2006-06-30T18:50Z,Men seeda då vafan
,Karlstadbootboy,2006-07-07T14:21Z,Ni som inte visste det så är Titania ett vit makt band. Deras demo skiva finns här på TPB. Titania - vägen tillbaka heter den:)
,Eax___,2007-04-19T15:16Z,"Titania, rasisterna ?! o.O"
,Eax___,2007-04-19T15:18Z,palla shara rasistmaterial
