User Type,Username,Date,Text
,EuroMartin,2006-10-12T19:19Z,Thanks for sharing! Works great! :)
,thebiochemist,2006-10-15T17:36Z,"Hi, works great... But cant find the license code to prevent it stopping every 5mins or so. Could anyone help? Thanx a lot."
,seanam132004,2007-01-06T04:52Z,"not to make you feel stupid, but if it works great it wouldn't be stopping every 5 mins... -.- "
,spida,2007-01-26T08:42Z,"yeah very nice, it comes with an empty archive . =)"
,alikaffe,2007-03-30T21:37Z,seed please
