User Type,Username,Date,Text
,My_largeone,2004-04-16T21:21Z,era såna här klipp...verkligen suveränt! ;-)
,malboroman,2004-04-22T13:29Z,håller med  totalt  helt underbart med lite äldre tjejer som vet vad de vill
,xxxUltraZxxx,2004-06-27T18:56Z,Fixa (cracka) ett account till www.myfrienshotmom.com så kan ni tanka alla  myfrienshotmomfilmer som finns + de som kommer.. 
,MajoneN,2004-07-13T01:49Z,kan nån fixa eller cracka ett account då? messa mig account + pass plz
,mixus,2005-01-04T22:47Z,Hur crackar man ett account där? berätta plz.. vore grymt med alla dom filmerna :P
,galvanize,2005-01-24T18:59Z,how do you crack an account there?
,Elias_elle,2006-07-05T01:16Z,älskar verkligen dessa movies asså !
,Citrusloka,2006-08-14T16:34Z,"Någon som crackat, kan ni skicka account + pass till mig oxå...vore suveränt"
