User Type,Username,Date,Text
,Jallarhorn,2005-05-18T14:32Z,vet hvem det er =)
,MacKeke2,2005-07-07T13:10Z,"Whats the song playing in the back? I just listen the music, not watch the video."
,ehagglun,2006-09-10T20:57Z,What the fuck... pointless girl-on-girl.... dressed and with a candle. how the hell did it survive this long...
,Gaijen,2007-06-22T09:04Z,"   Agreed, the music is good.  Both of these websites are always yawners (ALL of the content), I figure the seeder must work for the site, heh.

Overall, boring video, tell us the name of the song and replace this torrent with an MP3!"
,Suspiria_Aradia,2008-08-02T16:07Z,Very short and boring. Is this a promo or the whole thing? Skip it.
