User Type,Username,Date,Text
,old_upploader,2007-07-10T20:01Z,Du har inte den nya bra version istället för denna. 
,death_star,2007-07-10T20:54Z,"Stephen Kings nya? om inte , skicka en imdb länk till den nya då :)"
,old_upploader,2007-07-11T07:07Z,http://www.imdb.com/title/tt0118460/  Released in dubbleVHS tapes
,Kreese,2007-07-12T04:27Z,"Håll er till originalet. Den nya versionen är
bara seg och lång. Helt misslyckad"
,kizz_11,2007-09-03T17:35Z,"asså jävligt bra....såg den på vhs 1980

skit bra kvalite och ljud


TACK"
,u_l_o,2007-12-30T18:35Z,"Ja, orginalet är bra mycket bättre! Å andra sidan ska den nya filmen vara mycket mer lik boken, fast tyvärr blev jag besviken, för en gång skull är faktiskt filmen bättre, alltså den hedrliga från 1980
"
,mathx,2008-07-31T03:17Z,"den nya bra versionen ? bullshit. den här äger den nya som du säger från 1997 antar jag att du syftar på. den är bara en serie uppdelad i 3 delar.
och skådespelarna är värdelösa i den. jämfört mot denna.

den här är läskigare än serien oxå dessutom. 
tro mig har båda."
,Calmanius,2008-11-13T14:37Z,seed 
,H3r05,2008-12-18T20:54Z,"stephen kings the shining suger så jävla hårt, finns ingen sämre film!"
