User Type,Username,Date,Text
,Hanibal,2005-08-07T15:41Z,"Thanks alot, been looking for this.
Have you got the Swedish subs to??"
,Spanko,2005-08-07T22:49Z,"No Swedish subs, sorry."
,Toriatrix,2006-01-29T04:55Z,Nice Torrent.. Hope you seed long enough for more ppl to download.  Hope the Video Quality and sound is ok..
,Toriatrix,2006-01-29T04:56Z,DOH!.. just noticed that it's only the subs.. lol.. 
,mr.liljedahl,2007-03-21T17:28Z,and this subs aint working anyway!!!!!!!
,mr.liljedahl,2007-03-21T17:39Z,sorry my bad.. they did =P
,Triarity,2007-04-05T22:05Z,How I can get then to work? Step-to-step.
