User Type,Username,Date,Text
,meigi,2007-03-06T14:35Z,Thanks for the great uploaded
[T],cdomeij,2007-03-06T16:41Z,TALADE SPRÅKET ÄR TYSKA OCH INTE HOLLÄNDSKA SOM ANGIVITS !
,FERRARI4LIFE,2007-03-07T18:15Z,TACK
,Jopher,2007-10-26T09:55Z,"Åååh...jag vill så gärna ha denna!!! Finns det nån därute som kan seeda? Vi är ett helt gäng som är fast på 55%

Tack på förhand!"
,badlands,2008-08-15T14:39Z,"Lägg ned tankar på nedladdning - uppskattatd till mellan 3-6 veckor och det går med 0,5-11,5 i hastighet. Fullkomligt värdelöst. Trist nog har filmerna utgått ur sortimentet, men man vill ju få hem det innan pensionsåldern. Eftersom användaren inte är inne så ofta heller försämras möjligheten än mer. Bry er därför om detta och bespar er frustrationen."
