User Type,Username,Date,Text
,paisley1970,2007-09-08T19:38Z,"1941. Slaget om Stalingrad är förlorat och tyskarna är på reträtt. Djupt inne i de ryska skogarna har det 27:e pansarregementet förskansat sig, ett manskap bestående av f.d straffångar och annat slödder som används vid självmordsuppdrag. De är beslutna att offra allt för att ta slå sig tillbaka till den ryska fronten - inklusive sina liv. De är ändå inte värda någonting!
"
,Dinos,2007-09-08T22:52Z,Super att du lägger ut en kanon film men Lär dig lägga den i rätt kategori nästa gång........ ;)  
,paisley1970,2007-09-08T23:14Z,ja ser nu vad du menar  sry  sry 
,R2/D2,2007-09-09T18:47Z,"Vad menar Du, Dinos? På vilket sätt skulle det vara fel kategori? Jag bara undrar..."
,digweed69,2009-10-27T22:23Z,Fel kategori?
,linkon666,2011-07-02T03:42Z,Snälla Sedda den någon !!!
