User Type,Username,Date,Text
,Dusta,2005-04-18T12:10Z,"Fan va rörd man blir, inte ett öga är torrt.
Tack tack :)"
,blyfotad,2005-04-18T20:12Z,"Jag blev förvånad att den inte fanns på PB, jag har haft den ett halvår säkert .. men det är ju en kultfilm.. Aslan är grymmast! =)"
,Syusuke-chan,2005-05-05T03:27Z,"I'd do anything for actual background music from this. From the soundtrack that is, not ripped from the film. If anyone has it, please upload it.

---------------------------

Jag skulle göra vad som helst för bakgrundsmusiken från den här. Från soundtracket alltså, inte rippat från filmen. Om någon har det, snälla lägg upp det."
,Drood,2005-07-22T13:27Z,"En given kultrulle, speciellt med tanke på att den stora filmen kommer slå biovärlden med häpnad i vinter. Hoppas de spelar in hela serien... :D"
,cementera,2006-12-01T21:02Z,"I have 98,4 %  - could someonr plz seed a bit!"
