User Type,Username,Date,Text
,lokan,2006-02-10T17:36Z,Ljuvligt! Tack ska 'ru ha!
,JadunÃ¥nstansskamanbo,2006-02-11T17:17Z,Du gör det igen Dumburken!! Tack för att du gör min helg till en fotbollsfest!
,Dumburken,2006-02-12T14:27Z,Kan inte folk hjälpa till och seeda lite efter da slangat hem den? 
,djblomqvist,2006-02-15T17:11Z,du e grym dumburken :D du råkar inte ha em92 =) skulle va grymt kul att se:D:D
,ozzy_jonas,2006-03-30T22:54Z,Du har inte em 92????
,boerjelundin,2006-12-20T21:07Z,"""och när han ska ta returen, så är Roland Nilsson där och fäller honom i luften så att säga""...vilka minnen!"
,jockebra_93,2007-06-29T22:32Z,kan ngn seeda? skulle var tacksam bar precis sett 00-krönika. Den var grymmt bra. Tack för den!:D
,jockebra_93,2007-07-10T11:23Z,"den funkar inte för mig, den fryser bilden efter 30 sek typ:("
,Krullhead,2009-07-09T19:45Z,Någon som har VM-krönikorna 82 eller 86? vet att de legat uppe här tidigare men inte nu längre..
