User Type,Username,Date,Text
,rajisuju,2007-10-23T21:04Z,"How do I open these files, what software do I need?  I love this show, and thanks panda for getting them up here for us. :)"
,marcusk,2008-01-01T01:33Z,"Ty for this one!
rajisuju, u can burn these files with CopytoDvd."
,BenTrein,2008-10-08T01:42Z,"Is there a DVD 6 for season 5? I guess not, but need to be sure.
Perhaps a suggestion for future multi-dvd uploads: DVD 1/6..."
,BenTrein,2008-12-06T07:07Z,"Having reinstalled my system, I will now seed this again till the end of February 2009, as much as I can."
