User Type,Username,Date,Text
,Dog_Snob,2007-07-16T17:49Z,Please can someone seed the whole thing.  There's loads of us stuck on 73.7% thanks.
,Dog_Snob,2007-07-16T17:50Z,Please can someone seed the complete thing.  There's loads of us stuck on 73.7%
,Rimpuli,2008-01-02T18:13Z,Tietääkö kukaa mistä sais LOTR ensimmäiseen osaan subit...
,Rimpuli,2008-01-03T14:49Z,"Löyty jo , thx for seeding"
,Nicho00,2010-01-01T17:50Z,SOMEONE SEED!!!!!!
,Nicho00,2010-01-01T17:53Z,"I'll seed it when my download is ready, but it will take a thousand years since my downloadspeed is 20 kbps, while my connection can 1 MBps"
,ussr1912,2012-04-02T04:57Z,"Great stuff! Thank you. But please seed, stuck at 97%!"
