User Type,Username,Date,Text
,magwamagwa,2004-11-19T19:21Z,"Vem läste mina tankar? Jag har dessa på vinyl och tänkte köpa dem på CD. Tackar!
Ge oss bara ett seed!"
,Grabi,2004-11-19T20:18Z,"Fantastiskt må jag då bara säga, nu e helgen räddad!"
,afholstein,2004-11-19T20:44Z,"Suuuper....Tackar tackar:)
Håller med föregående talare:)"
,No_Way,2004-11-27T23:37Z,Underbart! Tack så mycket...Om du har annan bra gothmusik som t ex London after midnight och liknande så vore det underbart att få upp ^-^. Tack för de underbara skivorna! 
,Grabi,2005-01-26T00:07Z,"Gulligt! Om nån har videon till ""Under The Gun"" så..."
,lister2004,2005-05-08T02:38Z,jede mögliche Wahrscheinlichkeit von a reseed bitte
,pfaff,2005-08-15T22:43Z,Can someone please reseed Some Boys Wander By Mistake? There's a dozen peers with only 1% of it to finish! PLEASE!
,Fixie,2007-06-03T16:59Z,Has anybody got the password for this?
