User Type,Username,Date,Text
,phreakker,2007-09-20T17:25Z,"Hi. Do I have any chance of converting this into a regular DVD? I do not own a HD-DVD writer, and I would like to watch this.
Is there any software that can do this (for Mac)?

Thanks"
,keeplayer,2007-12-03T20:55Z,"How on earth do you play video with eAC3/DD+ audio??
I've broken my neck trying to search for an appropriate codec."
,xqwztis,2008-02-25T12:54Z,"Can you please reseed the torrent?
It is currently available only up to about 50%...

Thanks"
,kenhag,2008-04-24T15:10Z,"Reseed please! I'm currently stuck at 95%...

Thanks in advance!"
,God-of-Metal,2008-06-11T22:07Z,"Seed Plz, I'm at 97%!!! I only need 211MB dude!"
,xqwztis,2008-06-28T00:28Z,"same here, stuck at 97.4%. 
help, please!"
,Byr0nic,2008-12-18T08:06Z,Hi guys - sorry to be another... but Im stuck at 97% too... I can see a seeder on the list but cant connect to them... any ideas?
