User Type,Username,Date,Text
,eusuntsiva,2007-10-23T18:21Z,Please seed!!! 
,eusuntsiva,2007-10-23T18:24Z,I see a lot of guys who have 34.1%. Is there somebody who has the full 100% to seed? Please!
,eusuntsiva,2007-10-23T19:10Z,Yup I'm stuck too at 34.1%. Please someone seed!
,eusuntsiva,2007-10-24T12:19Z,"There is no seeder. I'll post a message if someone is seeding this torrent. Until then do not download because you will be stuck at 34,1% like all of us."
,Conformist,2007-11-13T00:48Z,"""Time Elapsed: 2w and 4 days.""
That's too long to be at only 34.1 percent!!
Seed this bitches!
I've uploaded more than I've downloaded!"
,saie88,2008-11-27T16:29Z,"thats nice versions are old, try new ones"
