User Type,Username,Date,Text
,erfo1,2006-01-30T23:23Z,"Great! This really works!
Are yoy planning to make a Keygen for Premiere 2.0??"
,icoico,2006-01-31T01:25Z,"tee hee hee, ha ha ha, woo whoo whoo, eehyuhh!"
,frankute,2006-01-31T22:58Z,So sweet! You guys are awesome.
,Agathon,2006-02-01T03:27Z,Fuckig Hell with this SSE2 Instruction Set.Cant install on my Athlon 2400 XP+.Same with Premiere 2.Fuck.
,edgardrummer,2006-02-01T06:59Z,worked like a charm! THX! and making one like this but for premier 2.0 would be AWESOME!!
,javadata,2006-02-06T22:57Z,"Adobe Premiere 2.0 Full + Keygen

http://thepiratebay.org/details.php?id=3438687"
,deeepocean1,2007-03-28T00:50Z,"sweet!

thanks"
,Singuila,2007-04-29T18:14Z,My penis is large.
,Mooncat-UK,2008-04-03T11:41Z,pity its stuck on your forehead
,drrezzin,2010-08-17T06:03Z,"To X-FORCE, how does the request code work?
I generated a serial fine, but I haven't aclue as to how to get the activation code.

This is related to your Encore 2.0 download from another site."
