User Type,Username,Date,Text
,Punkjaevel,2007-07-09T01:43Z,Seed?
,Dick Jerkins,2007-10-30T10:05Z,We can't read that stuff. Don't you know English?
,felham2006,2007-12-14T21:42Z,The text was written on a Swedish radio station's web site. You could use some online translation service if you have to read it. Or you can just listen to the music!
,norths,2008-05-21T17:34Z,"Purified in Blood has started yet again, and will be playing at Hovefestivalen in Arendal, Norway this summer!!"
,TheLutVeror,2008-09-14T01:41Z,"If you like this, check out The Love and Terror Cult.

http://thepiratebay.org/torrent/4391539/The_Love_and_Terror_Cult_-_The_Love_and_Terror_Cult"
