User Type,Username,Date,Text
,teenagefreedomfighter,2008-10-23T03:31Z,Black flag in high quality flac??? Why??? They recorded it in like a closet size studio with equipment considered primitive at the time lol.
,w4st3d,2009-07-09T03:56Z,because it's better than 128kbps.  dumb.  shit.
,teenagefreedomfighter,2009-07-12T02:14Z,"Black Flag... Flac??? LOL! 

It was originally recorded on like 8 track tape lol. The static is constant on the original even."
,doomy242,2011-08-09T18:56Z,"thank you!! Henry Rollins is an audiophile, btw... probably not when this was recorded but it's good it's in FLAC"
