User Type,Username,Date,Text
[V],kulbamse,2006-05-20T10:07Z,"Va kul om mann fått ner denna.:)
Men tydligen så finns det ingen som seedar ;("
,Mac E,2006-05-20T17:11Z,tycker jag med! snälla seeda! lovar ja ska seeda länge sen!
,kinna,2006-05-21T09:15Z,Snälla är det ingen som kan seeda lite. Tack
,__GK__,2007-03-24T13:15Z,seeda snälla!
,bandit1200,2007-07-17T13:32Z,"såna här torrents som är ""gammla"" och folk inte seedar längre,  kan man inte plocka bort dom eller skapa nt slags register så att man requesta dom hos de som har tillgång till hela?
Please...seeeddd."
,bandit1200,2007-07-17T14:14Z,Tack för hjälpen ni där ute  :-)
