User Type,Username,Date,Text
,Mr. X [NOR],2006-01-07T06:22Z,"Finally!, now the first peers have reached 100%.
Hope you all like the dvd.
And keep up the great seeding!"
,Emulantie,2006-01-08T00:52Z,Finally !! Hugs and kisses to the Uploader ;) ...
,Mr. X [NOR],2006-01-08T02:55Z,You welcome :)
,tsah,2006-01-19T10:25Z,"Can someone seed please, tia!!"
,viuh,2006-02-17T05:12Z,how can I see this? i don´t know what to do
,Mr. X [NOR],2006-02-17T10:43Z,"There are two ways to watch it.
One way is to burn it to a dvd with a burning software like Nero, and play it on your stand alone dvd player.

Another way is to mount it with a virtual drive like ""Virtual CloneDrive"" or ""Daemon Tools"", to watch it on your PC. 

To play it on your PC you will need a DVD player software like ""PowerDVD"" or ""WinDVD""."
,marcinpol,2006-03-04T06:12Z,jak ktos posiada to dvd to chetnie wymienie sie na inne dvd muzyczne moj mail djmarcin2@poczta.fm
,marcinpol,2006-03-04T16:36Z,"Do You Have DVD ""Blumchen - Best Of DVD"" write me i need this dvd.a have many others music dvd. E-mail : djmarcin2@poczta.fm.Marcin Form Poland"
,vargvikernas,2006-07-13T10:06Z,Hey seeders... where are you...don't run away
,zdwbd102,2006-12-11T05:22Z,please seed
,dftye,2007-01-04T02:03Z,"Please seed this for a few hours. I am stuck at 97%.

Thanks"
,Flojper,2007-01-04T13:26Z,Can somebody please seed?
,vafanedethar,2007-01-06T14:21Z,Yea! It would be most appreciated if somebody could jump in and seed!
,Mr. X [NOR],2007-01-09T13:26Z,"Ok im seeding again.

Now, if everyone uplaod what they have downloaded the torrent should never die.
That goes for any torrent though."
,vafanedethar,2007-01-09T15:44Z,Thank you so much Mr. X!!! : D
,Mr. X [NOR],2007-01-09T16:10Z,"Hehe, glad i could help :)"
,FoxyCleopatra,2007-07-02T18:57Z,yay! gettin nostalgic.. haha... thanx! i hope someone is seeding...
,ninjasource,2008-04-18T10:28Z,"WONDERFUL!
thank u so VERY much!!!

is the original dvd also 4.7 GB's in size, or is the original made to fit a 8.5 GB dvd?"
,Mr. X [NOR],2008-05-14T22:49Z,"The original dvd is aslo 3.86 gb, so nothing is removed, or shrinked to fit on a 4.7gb dvd :)"
