User Type,Username,Date,Text
,Jazz Jackrabbit,2006-12-19T20:25Z,"ill be joining soon, but downloading is taking longer then axpected:("
,CAN3D,2006-12-20T13:55Z,"i no wot u mean lol, someone seed please"
,dyngapa,2007-01-24T01:05Z,"i´d like in, but doesn´t use DC only bit torrent, any myspace or anyother group, an FTP i gladly join up for exchange movies"
,henu_1993,2009-11-25T18:36Z,well this'll be an lovely thing to download...no seeders OR leechers
,henu_1993,2009-11-25T18:39Z,im gona download i hope someone will seed
,DeReX2,2009-12-10T16:54Z,im in :D
