User Type,Username,Date,Text
,Cempa,2005-05-07T20:03Z,jag seedar förfult :D
,Rusty_Nails,2005-05-07T22:43Z,*ler piratkopierar er film*
,Cempa,2005-05-07T22:55Z,"åhhnej, gör inte det :)



blir bara glad om ni sprider denna film :D "
,kroch,2005-05-08T03:30Z,Hehe ska bli kul att se... verkade ju spännande när man läser texten i alla fall ;)
,Cempa,2005-05-08T21:42Z,jasså:D vilka känner du i den? 
,eterna111,2005-05-11T02:26Z,"Denne var virkelig ussel. :)

Jeg hentet ned traileren deres, og det var noe av det dårligste jeg har sett på flere år. Absolutt ALT var elendig, både teknisk kvalitet, skuespill og filming.

Håper dere lager mye mye bedre film i fremtiden, for denne DV-skiten her ville jeg ikke sett om jeg hadde fått betalt for det. :D"
,silferlod,2005-08-01T14:49Z,"Jag sitter fast på 93,4% nu.. vore schysst med lite seeding"
