User Type,Username,Date,Text
,Lilleput,2005-07-28T21:11Z,Stay away! its nasty!
,LinShark,2005-07-28T21:45Z,"That's Barbie, she's no amateur."
,fissultan,2005-07-29T12:19Z,what is it?
,laponist,2005-07-30T14:27Z,"It´s crap not worth the download

not homemade but gonzo.

Tag dig sammen mand. Find dog en so der er værd at glo på"
,just me,2005-07-30T15:57Z,NOT homemade its PRO
,pserios,2006-02-23T20:01Z,passordet fungerte desverre ikke til meg.noen som kan hjelpe?
,o0Gizmo0o,2007-02-22T00:21Z,"Haha! Den her er seriøst et grineflip..
Hun snakker vildt mærkeligt, og ""martin"" er mega optaget af sit nye kamera.

Tjek den ud!"
