User Type,Username,Date,Text
,Julleb,2006-11-29T22:03Z,"OK...
man kan ju alltid testa...
OM det funkar.... så TACK!"
,Jacconelly,2006-12-06T17:22Z,umh how do you lay in this crack without make it wrong wih the other crack cant run it now so plz help if you can...
,Offshoree,2006-12-14T21:53Z,replace the old file o with the new crack file
,*piratechick*,2006-12-29T12:57Z,Thanks nystrand! I recommend this torrent! The building problem is gone and you need no CD to play.
,Up&Go,2007-05-06T16:51Z,seed!!! :P
,Thebrainman,2007-08-12T10:20Z,Hmm när jag ska starta spelet så står det bara ''Stoppa i rätt DVD-skiva. Tryck OK för att starta om programmet.'' Varför? Hur får jag det att funka? Om det funkar så tack iaf! Hade Gött!
,Razer2k4,2007-10-12T20:10Z,seed plz
,Dennis_93,2008-01-01T04:08Z,det funkar inte för mig står pricis som man har utan crack
,Bigallman,2008-08-08T11:16Z,är Du Dum i huvet eller bara störd?
