User Type,Username,Date,Text
,darknessv,2007-02-22T13:40Z,woho! I saw them live two times last year...roxx!
,stinger839,2008-02-19T20:55Z,"I am a ""forever seed"" on this file, so if the tracker says 0 seeds, it is not hopeless. I usually have it running, but if I don't and you've been waiting a bit, email me: stinger839 at gmail"
,steve394,2008-10-02T07:19Z,what is the .mkv format?
,Bubba91,2009-04-22T23:50Z,gotta seed this!
,Den0306,2009-05-24T02:46Z,"Thanks a lot for this video!
This tracker is the only I've found it on!"
,gr1ndfr34k,2009-08-03T01:49Z,"star trek porn, dont wast your time downloading this shit"
