User Type,Username,Date,Text
,rretarded,2007-07-07T19:02Z,Nice!
,SquidlyDiddly,2008-03-25T12:01Z,"Many thanks for the prog, as was said earlier works perfectly"
,jaqknive,2008-10-06T01:28Z,"downloaded fast, nice and clean, but i dont understand on how to crack it?
can u add a readme?"
,dtuzgiihkhgkcxkiidikgdhk,2008-12-29T20:22Z,seed please
,k1llerteddybear,2010-09-28T07:49Z,Where is the Directory? 
,k1llerteddybear,2010-09-28T07:56Z,"Please help. Where exactly is the directory for RM? I have tried going straight to program files -> Rm and adding it to well...where ever I can, in hopes for to work. "
