User Type,Username,Date,Text
,mrpsanter,2008-03-05T07:21Z,"Can someone upload the ""Through the eyes of a pro - Nikon Edition"" in two DVDs?"
,koelleballong,2008-04-09T01:09Z,only getting the sound here.. what am I doing wrong?
,BuddyGooodness,2008-04-19T18:23Z,thanks!
,marla_rochester,2009-02-23T04:58Z,let's see) thank you!
,aletheaj,2009-07-13T21:50Z,"dsm wtow gelt thjat tlorrent  sulper fafst   usitng thiis   
jq pur. gosipmathereda. W c W o W m 
ukxso takie abovve ajnd pastle in browsenr alnd deltete  alvl  W  avnd sjpaces   hahia "
,DMANSR,2009-07-22T22:34Z,Good video on how to use the camera. Too bad it isn't complete. Any chance you missed some? I'd like to watch the whole thing.
,hcase,2011-08-20T09:18Z,Thanx alot!
