User Type,Username,Date,Text
,Audioslaver,2006-02-20T22:45Z,Hope this really works m8
,kzz,2006-07-04T20:24Z,SEED PLZ SEED i will 2 when  got this one
,kenewayne,2006-11-13T15:40Z,Still only the TRIAL version. How do I get the FULL thing to work?
,Deamospasser,2006-11-26T10:27Z,"Seed pls..
i need that program!"
,nigella40,2007-05-18T18:10Z,do this work  is it full or trail please tell 
,jacob_e14,2007-06-22T17:42Z,"read the text..
he wrote: The serialnumber is in the file ""serialnumber.txt""
then its not a trail version (:"
