User Type,Username,Date,Text
,kukacjani,2007-07-22T11:52Z,please upload fifa street for pc please please
[V],Subzero!,2007-07-29T22:54Z,"iam a fifa hater, and a proevolutionsoccer fan... there wont be anything concerning the fifa series... buuuut there is a huge update of pes6 in work, with alot of great things included... watch out for this!...

"
,fig455,2009-03-06T01:03Z,Thanks a lot!!! I appreciate the upload.
,pran1702,2011-03-17T21:12Z,"Not DVDRIP, but watchable. Thanks."
,POPfan,2012-07-18T14:42Z,Please seed.I want to play this game.
