User Type,Username,Date,Text
,elijah666,2006-03-01T16:28Z,"Maybe not such a good idea to reveal the results in the information....
But thanks for the seed anyway."
,ZenInAction,2006-09-04T12:01Z,"Pleace seed after you have download this torrent. How?? Just leave open in your download program after you have downloaded it. Then you SEED so other can get it. The more seeders there is the FASTER it get SHARD!
Now we are alot of folks stuck at 98% so pleace ceep it comming. Thanks!!"
,ZenInAction,2006-09-06T15:48Z,Pleace SEED!!! We are a bunch who is stuck on 98%......ceep it coming.
,ZenInAction,2006-09-08T20:48Z,I think this torrent is dead.....ive bin stuck on 98.5% for a veck now.....thats sucks...i realy wanted this one.
