User Type,Username,Date,Text
,bodillo,2007-06-20T00:37Z,Thx
,RagingBill,2008-05-21T08:39Z,"Many thanks for this torrent! But I would like someone to seed this, please. It´s too slow."
,RagingBill,2008-05-22T01:33Z,"Please, could someone seed a liitle more? At this stage, I´m afraid that the download of the second part of this movie will take many weeks. Thanks"
,RagingBill,2008-05-30T09:31Z,"Well, one week has passed since my last comment and I´ve downloaded only 35%! Please, seed this!!!"
,Lover_forever_6,2008-08-12T23:06Z,thanks
,flynndownunder,2011-05-22T17:17Z,Worth the download. You'll need to d/l Disc 1 of course.
