User Type,Username,Date,Text
,zekealthor,2005-01-14T13:19Z,Seeda mer 채n 10 minuter please
,b-man,2005-01-20T22:33Z,Kolla hur gamal torrenten 채r :)
,purple_potato,2008-03-01T04:37Z,"Please re-seed! I REALLY need a video demonstration! Please help me!! 

If I can download it all, I will then be able to seed it on my school's T1 connection, probably indefinately!  Please re-seed!"
,b-man,2008-05-18T23:27Z,"here it comes .

i hope you keep your promise stevigeshag and seed forever :)
"
,chillakis,2008-06-08T16:27Z,Seed me the last 2% please?
[T],KnifemakerC,2008-07-05T14:14Z,"Seems to be stuck at 99.7 % 
HELP !"
