User Type,Username,Date,Text
,BencoXX,2011-05-15T21:13Z,"I loved this programming language, this is what I learned in programming. I'm very sorry that it is not further developed. Was small and simple, game development was appropriate. Constantly looking for something like that.
I like those who think the same way as I do.

How do I go from here? I think I found the solution. The name ""LĂ&#x192;â&#x20AC;&#x201C;VE"".
Very friendly programming framework, just like the ""YABASIC"" was perhaps even better than him. Try it, believe me you will not be disappointed in him.

the initial page: http://love2d.org/

I wish you many happy time for him.

BencoXX a dreamer programmer"
