User Type,Username,Date,Text
,downlow66,2006-03-22T08:44Z,"This is a terrific document of Wyatt 's talents in a live setting. THANKS for the effort!
--downlow66"
,GirlWithFarawayEyes,2006-12-12T16:28Z,"This looks amazing, but I've been stuck on 592 MB since,,, god knows when. So PLEASE,guthlac2  reseed! I was looking for this stuff for so long. "
,GirlWithFarawayEyes,2006-12-15T04:24Z,Did I say 592 MB? lol I meant 253 MB! :( It's been weeks now! 
,Ivo62,2007-02-11T19:36Z,"Can someone please seed?
Thanks in advance."
,dick_head101,2008-08-18T12:25Z,A reseed is still needed for this; there are four or five people stuck at 47%.
,knutsel-2008,2008-11-02T01:09Z,"Please reseed the rest. I'm stuk at 42,7 percent as well. Tia."
,icon57,2010-03-30T15:37Z,can someone please seed...?
