User Type,Username,Date,Text
,ice-torrentz,2007-12-15T13:16Z,please seed after download. also see other ice-torrentz at www.piratebay.org/user/drice27
,The_Wizard_99,2007-12-15T21:40Z,"how about seeding it so we can download it...

then we may be able to seed it after we download it..."
,ice-torrentz,2007-12-16T10:36Z,"sorry i couldnt seed so much yesterday, but i seed alot know. im not always here to seed and i look for seeders to ice-torrentz. please answer if interest"
,itjh,2008-06-06T01:04Z,Please seed! Will seed after finished
