User Type,Username,Date,Text
,Ogel Bond,2006-10-13T04:43Z,"For those running windows or already have the file, here is the code and instructions.


Name: Barbara Kloeppel
Serial: 249E-S93G-WRJ2
Set Date To: October 15 2004
Use version 1.0.8

Unplug internet, register EV Nova, then launch while holding the alt key. Set to ""run nova in a window"" and play for around 10 minutes. Quit and restart computer. Change the date back to what it really is and make EV Nova fullscreen. You now have a fully functioning copy of EV Nova!

Do not upgrade the version of EV Nova. That may make your version invalid."
,Kholdstare,2006-10-14T19:14Z,"Works perfectly. Thx!
One thing though, make sure you turn your internet off and change the date BEFORE you open the registration window. it will not work otherwise."
,Sunal,2006-10-18T05:53Z,"Alright... Im playin the game and I had the Vis Arrow, died, and now dont have its weapon anymore.  Anyone know what to do?"
,aquastorm,2006-10-21T16:03Z,I cant registrer. It says your license code has expired. What should I do?
,gandalf95,2006-10-21T17:02Z,i got it all registered but when i launched the game it said invalid cd-key
,Kholdstare,2006-10-21T21:31Z,"wow. i registered everything and it worked, but it still says i need to register. And now Capt. Hector kicks the crap out of me every time i see him. think he knows i 'stole' the game?"
,Ogel Bond,2006-10-21T23:24Z,"If you have trouble registering, try following the instructions. Remember to set date to October 15th, 2004. The date can be accessed in the ""Date & Time"" section of your control panel. Make sure you unplugged the internet (or are using Lil' Snitch to stop it from running home to mothership Ambrosia).

The bit about the ""Run Nova in a window"" is because Nova tends to lock up when launching for the first time being registered with the Barb code. This may or may not be neccasary.

Also, if you didn't download from the torrent, then check your version.

If something went wrong, then maybe you need to reinstall EV: Nova to get it working again. If you've been a responsible pirate, you should still have the zip for seeding purposes. Right? ;)"
,Flagrum,2006-10-23T19:06Z,does someone know a HP were i can download 1.0.8 ´cause my download doesnt load
,gandalf95,2006-10-23T19:54Z,"i downloaded the game but when i open the zip file it says: Unable to unarchive EV Nova 1.0.8.zip into Desktop
(error 1 - operation not permitet.)

anyone knows what i should do?"
,Flagrum,2006-10-25T16:32Z,you need StuffIt 10.0 to unzip the .zip file
,General_Beef,2006-11-19T03:22Z,"Ambrosia is clever with their registering, try using Little Snitch to prevent the game calling home."
,Blackninja729,2006-11-20T01:02Z,"Hey, does anyone know of a site where I can find the PC version of 1.0.8? Really enjoy the game and I'd love to have it finally un-locked.
(having Hector stop raping me would be cool too)"
,titandawn,2006-12-20T08:35Z,you are teh awesome. i wanna give u 10 bucks if u have paypall and if it works
,titandawn,2006-12-20T08:50Z,also i cant find the register area. can someone help?
,titandawn,2006-12-20T09:10Z,"now i find out that i have version .10, does anyone have version .08?"
,titandawn,2006-12-20T10:04Z,I FOUND THE VERSION but dont remember the site. but i do have the file.!!!!
,Rebel Grunt,2006-12-30T01:37Z,"The torrent download link isn't working and I cannot find version 1.0.8 anywhere, help?"
,general_assclown,2006-12-30T12:55Z,Can anyone please seed. I'm stuck at 95%
,titandawn,2007-01-07T06:06Z,"wuzzup, u can message me on aim if u want to get it through that. sn is nostalgic utopia, and ill try to be on more often, just message me."
,Darth_Poopi,2008-02-06T22:59Z,oh WOW this game is addicting
,VileCore,2008-06-19T13:59Z,Ooo. Didn't notice this one until just now ;)
,GS618,2008-08-05T16:58Z,sweet
,DylanJGreen,2009-02-18T13:26Z,SEED PLEASE
,LordNadir,2010-01-20T13:36Z,"Seed Please :3, will seed for a good time after this"
,Dudenator223,2010-02-26T15:06Z,"I downloaded, and played for 10 days and i havent registered. so i went to register entered all the stuff  changed the date and it says invalid name or license code What do i do?"
,idonotexist42,2011-08-12T21:38Z,I dont suppose anyone has a functional code for the updated version that runs on OSX? I can't use the old version that this works for on my new computer
,eggit,2012-08-05T20:33Z,SEED PLEASE!! No one else is seeding anywhere
,eggit,2012-08-06T00:18Z,thx for seeding every1. ill seed for awhile now
