User Type,Username,Date,Text
,superkette,2005-03-04T04:54Z,"Nice. You rock Toba. you don't happen to have 'The Yakuza Papers, Battles without honor and humanity'. thanks again"
,negativeions,2005-03-08T20:23Z,I vote Toba for god.
,RashaRasha,2005-07-01T17:32Z,Hey... can we get any seeders on this please?
,lovegren,2005-08-06T13:16Z,Seeda nu är ni snälla! Är på 98 % 
,Nervegas,2006-06-22T17:06Z,"Kan någon vara snäll att re-seeda? Jag sitter på 99,8%. "
,muchacho6666,2008-03-22T11:57Z,Can you seed please? I've been 95% now for over a week
