User Type,Username,Date,Text
,ct!,2007-10-01T23:39Z,"If you seed this, I will."
,Morgrym,2008-01-07T23:29Z,"Getting a ""No input file specified."" page when you click do DL.  Any idea why this occurs?"
,F4R207,2008-04-11T00:47Z,"Excellent! Thank you. You don't have any Paizo (Pathfinder, Runelords and so on) d20, D&D stuff to seed?"
,Sunderas,2008-06-16T03:16Z,TY!!!!!!!!!!
,allmatthewdickens,2008-07-31T18:22Z,"Oh my God!!!  A nerd's dream come true...

Thank you, so much!"
,thtoneguy,2009-05-26T03:54Z,"yay finally i can bookmark somewhere to download new books
great idea and great amounts of books"
