User Type,Username,Date,Text
,nesagwa,2006-04-18T14:18Z,"Can someone please seed this, its stuck at 88.1% "
,davebo,2007-06-03T21:14Z,"Some please seed, stuck at 98%"
,xp4r4n014x,2007-09-22T23:30Z,"SEED THIS
i need to rip my bong to this"
,SlumLord301,2008-03-16T03:43Z,Any chance of you putting the Dino Boy episodes into a toorent?
,anomie,2009-01-15T02:06Z,If as described -- Thank you very much! 
,anomie,2009-01-17T03:05Z,This is great! Thank you very much!
,el_vj,2009-09-28T06:22Z,"this is great!!
but why God why there arent anywhere...
space ghost coast2coast episodes!!!
like he would say: i would give every hair in my body for it!!!"
,fleetkid,2010-02-21T06:11Z,"Awesome. Thanks a lot :)

Makes me remember the good old times of cartoon network... 

A - 10
V - 10 (for an old TV video)"
,fleetkid,2010-02-21T15:46Z,Seeding for a while. Will seed for two more days.
,finisher489,2011-11-02T21:15Z,terrible quality
,semontrax,2012-01-13T16:51Z,"Here's a link to a 91 episode Space Ghost Coast to Coast set:

http://thepiratebay.org/torrent/6953027"
