User Type,Username,Date,Text
,DrYes,2005-02-13T18:05Z,"Personligen tycker jag att du borde ta titeln på allvar. Gå och dö så att vi slipper dig, den här skiten kan vi vara utan."
,Aurelius,2005-02-13T18:34Z,"det är precis sådana inlägg som du precis skrev som gör att man fortsätter lägga upp ultima thule etc. Sluta skriv, så kanske jag slutar lägga upp.."
,Bluesman1984,2005-02-13T18:59Z,"Sug kuk i röven på en huvudrakad identitetskris från skåne med en svastika av plåt i röven och en skinnrock lindad runt arslet på er uppblåsbara barbara med hitlermustasch av tuschpenna under den sönderpullade gumminäsan.

RÖVHÅL! Anusmusik är detta, sug röv era slemproppar."
,balalajka,2005-02-13T22:26Z,Det är som sagt vetenskapligt bevisat att nynazister är helt dumma i huvet.
,Teaflax,2005-02-13T22:58Z,"Starka människor behöver inte en ideologi som nazismen. Det säger sig självt.

De flesta skins och nassar har extremt taskig självbild och allt som oftast en djupt störd fadersrelation.

Annars har man inte sånt hävdelsebehov. Q.E.D, muthahfuckas."
,Teaflax,2005-02-14T01:03Z,"Man har liksom inte behov av en vålds- och maktideologi om man är normalt funtad. Att medvetet välja en rörelse som - även om man inte kallar sig nationalsocialist - har en tydligt intimiderande effekt på omvärlden är bara ett så självklart tecken på att man har det svårt.

Visst, hela skinskulturen är inte hats- och våldsinriktad, men i Sverige finns det försvinnande få undantag från den generella regeln.

Och kanske är det så att dagens skins är mycket snällare och mer normalt funtade än de var på 80-talet, då jag senast hade att göra med särskilt många av dem.

Men på den tiden, då stämde det klockrent, och jag har inte sett några som helst bevis för att situationen har förändrats nämnvärt.

När sen UT faktiskt *har* nazistiska fans, så borde de ju fundera en liten aning på vilka signaler de skickar ut. Om man visar sig attrahera sådan töntar och inte gör nåt åt det annat än att säga att man inte själv är sån, så låter det på nåt vis ganska ihåligt.

""Vi kan inte hjälpa att nazister gillar oss"" är bland det mest skrattretande jag har hört - näst efter UT:s ytterst taffliga musik, förstås."
,Bluesman1984,2005-02-14T19:18Z,"Nationalsocialist, och nationalist är två vitt skilda saker.

Vet ni vem som var ledare i det ""Nationalsozialistische Deutsche Arbeiterpartei""? Nationalsocialistiska, så om man säger att man är nationalsocialist men inte nazist, så har man luckor i kunskapsförrådet.

(och mellan hjärncellerna). Sen kan väl ni ""starka människor"" lära er edert egna lands grammatiska regler och skriva SVENSKA och inte något slags ""bilsports""-mål.

Warlord pratar om starka människor som har större rätt att öppna munnen och verbalt uttrycka sig än de svaga människorna. Sådan socialdarwinism behöver vi inte i ""fosterlandet"" eller annorstädes..

Sedan att lyssna på nationalsången med distade kvintackord i någon slags målbrottskväkande ölburkstakt roar en del, det kan man inte ändra på..

sug min karamell///bluesman"
,mangemangan,2005-03-17T18:16Z,"vad är det för jäkla puckon som klagar på musiken som läggs ut på piratebay, borde man inte vara emot censur om man hänger på denna sida? och för övrigt(även om detta egentligen inte har med saken att göra) så har ultima thule ALDRIG i någon text uttalat något som nån kan anse som stötande eller hotfullt mot invandrare, men i detta land så räcker det tydligen med att sjunga om sitt lands historia och kungar etc för att klassas som rasist"
,trilian,2005-04-16T18:29Z,"Att ut är nå halv naziband är iallafall för mig klockrent, finns inte utrymme för diskusion om det MEN låt dom lägga upp det samt liknande här, bättra att det sprids fritt än att låta upphovsmännen få en krona för skiten, vilket tydligen inte grabbarna i det rosa laget har fattat än. "
,alizzz,2005-04-28T12:23Z,Sluta lägg upp rap då..det e också rasistiskt..dom sjönger om sinna jävla getton UT sjönger om Sverige..va e skillnaden?
,zerblatt,2005-05-14T12:08Z,"det heter sjunga, inte ""sjönga"". Lär dig ditt eget lands språk om du nu tycker det är så jävla kul att springa omkring och kalla sig ""patriot""."
,zerblatt,2005-05-14T12:08Z,"dessutom heter det ""sina"" och ""vad är skillnaden"""
,gabbe_88,2005-06-18T02:13Z,"Visste att jag skulle få se ett inlägg från Zerblatt här. Jag tycker verkligen synd om den killen. Han har varit inne å skrivigt grejer på varenda nationell torrent. Han måste verkligen ha ett innehållslöst liv när han roar sig med detta. Jag tycker att vi borde starta en fond åt honom så att han kan få en roligare tillvaro. Istället för att han ska sitta och rätta folks stavfel kunde vi anmäla honom till en frimärksförening eller något sådant. Om du vill hjälpa till att ge Zerblatt ett värdigt liv sätt in pengar på postgiro nr 123 445. Tack för din gåva! 
"
,thepirater,2005-07-13T20:34Z,Tackar för denna och ni som tycker att ultima thule är ett nasseband kan dra åt helvete.
,Albihno,2005-08-08T17:26Z,"Vad jag vet är själva musiken inte rasisitisk, men jag har inte hört den men det är det som ALLA säger. 
Men det som ALLA också säger är att pengarna som Ultima Thule får in går till något nazistparti, och det är ju inte något bra. 
Så jag tycker att det är bra att musiken går att tanka, sålänge som nazister inte får några pengar. Köper man skivor med dem får de ju pengar, annars inte. 

Eftersom att jag vill skaffa mig en egen åsikt om texterna kör vi kommentaren som verkar vara standard på TBP:

SEEDA FFS!!"
,wessslan,2006-04-14T01:41Z,seeda.. vill ha lite musik att sova till....
,snazze,2006-07-07T23:50Z,"Ni djävla nötter som inte gillar Thule och deras
texter stick för fan och lämna sidan.
Extremister finns i alla läger.
Vad har Thule med nazism och rasism att göra.
Läs lite historia någon gång fåntrattar.
Låt vanligt folk lyssna på vad de vill.
Letar ni extremister här så har ni noll koll."
,00Bengtsson,2006-08-07T21:51Z,"http://www.youtube.com/watch?v=2tQ2FKsmRVk
Bevis på att dom inte är nasister!"
,Killertz_91,2006-09-19T23:42Z,Ni som påstår att Ultima Thule är nazi musik vill jag gärna att ni förklarar för mig var det nertryckande mot en annan ras finns i att älska sitt fosterland?
,drwarrant,2006-11-08T22:07Z,"Superbra musik.

Får mig att tänka på vår svenskhet som numera alltid ska plågas av vänsterextremister och annat liknande obildat pack.

Tackar och bugar Aurelius.  Jag har redan köpt många av dessa skivor jag vet bara inte vad jag har dem."
,ondsvensk,2006-11-14T18:24Z,tackar ul för denna.
,ironfist22se,2006-12-08T14:47Z,"thanks!

Thule rules"
,Wannabe_freak,2007-01-07T17:44Z,seeda
,MalinMaalin,2007-01-16T15:56Z,"Omg. Det är så jävla skrattretande att sitta och läsa vad alla skriver. 
Nazist band eller ej? vad fan spelar det för roll? Man lyssnar väll för fan på musiken man gillar! varför kasta bort en massa tid på att kommentera musik man inte ens gillar? Bara ett tecken på jävligt dålig fantasi!!!
/ Stolt och SVENSK! "
,TLD,2007-04-21T15:47Z,Kom igen och seeda nudå!
,svensk_varg,2008-07-16T20:34Z,seeda :P
