User Type,Username,Date,Text
[V],hertwig,2006-04-08T22:04Z,"Well, buddy. Thx for the upload. BUT, it would be nice of you to at least try writing in  english as the most of us have no clue when it comes to Latin"
,WarVade,2006-04-10T14:53Z,is it pal?
,datsura,2006-04-10T19:31Z,"Multi 5 = European language = PAL

Im not certain though.. But I would bet my money on it if I could ;D"
,nikoltjev,2006-04-13T13:49Z,"yeah I think Multi5 is german, french, spanish, italian and english"
,vinny,2006-04-14T18:36Z,italian?
,marcobrum,2006-04-23T19:31Z,Como faço para colocar em espanhol?
,T&B,2006-05-08T01:28Z,"I think there is a bug. After the 6 city when you meet a monster the game frequently stop and you?.Please give me a reponse.

Dopo le prime città a me da problemi quando faccio le battaglie casuali. Si blocca spesso. A cominciato a farlo quando mi stavo dirigendo nella città di yangus. Speriamo sia solo un mio prob:( postate cosi al max lo riprendo forse è solo un mio prob. Ciauz gente"
,tpphysique,2009-05-02T23:17Z,Please seed this great game
