User Type,Username,Date,Text
[V],markienne,2006-03-20T17:55Z,Kung! Tack snälla AloeVera! :)
,Epoz,2007-03-09T11:56Z,Tackar för denna ;)
,myrgrot,2008-04-22T15:26Z,"Tack snälla AloeVera för den här.
Men nu måste jag be alla intresserade att seeda efter er! Nu har jag seedat den här till 77 pers under några månaders tid, men alla bara drar direkt efter nedladdning. Hur tror ni att det här systemet skulle funka om jag också bara drog? Skärpning."
,papparegor,2008-06-20T19:46Z,Går den ner helt?
,papparegor,2008-07-24T20:49Z,Är dett denna som är fel på?
,cmiller99,2009-11-16T17:06Z,jag ?r fast p? 99.9% med m?nga andra. kan n?gon med full version seeda lite tack
