User Type,Username,Date,Text
,titanstorm,2008-12-27T19:11Z,Awesome up!  Any chance of seeding?? :(
,Taotoad,2009-11-13T04:05Z,"Is there anyone with a full seed? We're all stuck at 82.2%.. I will stay to seed afterwards, I promise!"
,BenisonQPS1,2010-09-28T08:48Z,"WORLDCOAST** PLEASE reseed, I've been trying to download this torrent for a month now and have only downloaded 5Mb.  I'm a true Canadian and would love to shar this material."
,kaminski0,2010-11-13T15:49Z,"desperately seeking this torrent - been trying for about 3 months now....

can anyone with this one please seed! "
