User Type,Username,Date,Text
,Shizz Kebab,2006-02-08T16:45Z,Wrong category?
,Tomat-Ulf,2006-02-12T22:07Z,Hope so. If its not. Ithink ill have to download it.
,turdusmerula,2006-02-13T01:43Z,Are you supposed to be horny before you solve a Sudoku puzzle? Because i found this in the porn section. 
,triple,2006-02-15T21:14Z,Maybe not...but it is adictive...as is sex! Just try it anyway...(after you are done with your wanking! HAHAHA)
,CooLVick$,2006-03-07T04:05Z,"Wrong Section! 
Anyways Thx for Upload :)"
,david1,2006-03-07T20:41Z,Porn sudoku?  So you can work your brain and dick at the same time? :)
,SoundWall,2006-07-24T15:30Z,Maybe it's one of those games were you get to see a nude girl after completing each level... :D
,FishyJap,2006-07-28T08:20Z,This is porn?!
