User Type,Username,Date,Text
[V],Submachine,2004-08-21T11:08Z,"ÅÅÅÅÅÅÅÅÅÅÅÅÅÅÅÅÅÅÅÅÅH GÜNTHER VAD HÅRT


(tack så mkt :))"
,VNV,2004-08-21T11:25Z,"trodde väl det skulle uppskattas. :) 

:band:"
,apilator,2004-08-21T14:09Z,skall även påpekas att Dulce Liquido och Cenobita ligger ganska nära ;>
,borelee,2004-08-21T20:49Z,"Tack!

Vi behöver faktiskt mer industrial/ebm här..."
,stakker,2004-08-22T12:32Z,och mer orginal releaser *HOST*
,zamurai,2004-11-27T22:42Z,och lite fler seeders! o=)
,HippieTom,2006-01-09T23:00Z,Trodde De Var Tyske jeg
,nastypiece2,2006-06-18T17:12Z,Dulce Liquido är ett sidoprojekt med en av grabbarna från Hocico. Minns inte vilken dock. :) Tack för ul:en. :)
