User Type,Username,Date,Text
,snatchii,2004-12-17T22:46Z,http://www.imdb.com/title/tt0307987/
[T],damnation,2004-12-17T23:54Z,finns redan uppe: http://www.piratebay.org/torrents-details.php?id=3262971&hit=1
,abarn,2004-12-18T00:42Z,den andra var utan menyer... har dom lagt till det på denna?
,Linnet001,2004-12-18T04:12Z,"haha....vilken kanonrulle.....en sån tomte skulle man vilja få besök av på juafton, ner pissad o dan...hö he hö...=)"
,Skywalkah,2004-12-18T09:03Z,Lite liten för en Dvd-r eller?? inget 5.1 ljud? någon??
,DJ_SEVEN_70,2004-12-20T09:41Z,Öh nä det är Mono och Svartvit bild . . . )()(
,pantherman,2004-12-30T20:54Z,Can someone seed please????
,Volvo740,2005-01-25T15:47Z,seeda tack
,Sturm10,2005-02-02T07:30Z,vissa här är fortfarande fast på 99.4:crazy:
