User Type,Username,Date,Text
,gummisko,2006-07-02T20:16Z,ojsan s책 fel de blev...denna fanns ju redan h채r
,gummisko,2006-07-02T20:17Z,ska jag sluta seeda denna?...o hj채lpa seeda den andra???
,smoke.js,2007-01-08T01:50Z,seed pls :)
,jaxman,2007-02-07T04:34Z,plz seed - gotta cable line so 'f i got it you got it
,_insanity_,2008-02-06T20:53Z,can all of you who already downloaded this start uploading it so the rest of us can get it too?! plz...thanks
,Jincheonkid,2008-11-13T16:29Z,"Thanks. Long time, no see."
,sliptv,2011-03-04T06:01Z,"Here's the version without canned laughter

http://thepiratebay.org/torrent/6214907/MASH_Season_8_-_No_Canned_Laughter_-_h.264_aac_HQ_[SlipTV]"
