User Type,Username,Date,Text
,Tnnk,2007-12-02T01:41Z,please upload again.  stuck at 92.1%
,Accessless,2007-12-21T15:16Z,"Could you either Seed your Red Dwarf or tell everyone that this was all a time waster joke please. I'd be happy to hear either at this point...

Btw these aren?t brilliant quality; they look like analogue video recordings, Season 7 & 8 not too bad though."
,tommyt1979,2008-03-19T11:15Z,"Can someone with 100% please seed this, there are 12 people stuck on 96.3%, "
,tommyt1979,2008-03-27T20:00Z,"Seriously, don't bother with this torrent, no-one has 100% you'll never finish downloading it. Honestly I don't know why people bother creating torrents when they don't look after them."
,ILNFE,2009-02-03T02:28Z,"Hello I am downloading seasons 5,6,7,8  all are above 82%  I dont want to give up ~ Greger2dsfdsf if you are out there help me to finish & I will seed this wonderful Series for a long time.  People are uplaoding from me so I know people want this torrent.  PLEASE HOOK US UP- THNKS"
