User Type,Username,Date,Text
,fabi83,2006-12-19T19:42Z,Full Windows XP game.
,_Whoopy_,2006-12-19T19:53Z,"wooooaaaah this was the game i always played when i was on the primary schooooool!!!!
(its a great game when ur a 10 years old kid)
and it still is :D"
,pether,2006-12-19T20:55Z,"Its one of the greated games... errr.... demos in history.

Too bad it never was released."
,avatar1969,2006-12-20T01:19Z,If you like this game get SIMUTRANS. Its a totally brilliant FREE transport manager and it is really good. You can download it for free at www.simutrans.com
,avatar1969,2006-12-20T01:20Z,http://www.simutrans.com or http://wwwsimutrans.de
,Funron,2007-02-08T20:48Z,"What is this kind of langues?

Its not english or any normal speaking langues!!!"
,Greyhackers,2007-03-30T20:55Z,Could anyone please seed?
,Chrille_22,2007-09-06T01:29Z,"UNDERBART! kom ihåg när jag spelade detta när jag var 9-10 år och det är fortfarande lika kul! och på svenska dessutom!

About the laguage, just jo to the ""lang"" map and delete all the laguages you dont want!

Thank you for a great torrent!"
