User Type,Username,Date,Text
,DJ_SEVEN,2006-11-23T10:37Z,"Hit Give me a break man!

Anna the bot was one thing.

if you want good Basshunter stuff, dl his other records with real trance and not this euro sheit!

/S"
,mikael91,2006-11-23T10:44Z,this song sucks man give me a brake
,thunderdoome,2006-11-23T18:12Z,"What!
This song is great, big thanks for the upload, hope he does more christmas songs"
,Oldie06,2006-11-23T20:27Z,"Hahahhahahha vad dålig!!

Boten och dota var väl bra, men det här är ju bara skit hahahahha"
,fuzzynoise,2006-11-24T20:19Z,"This One Great, think i send it to al my friends. 
;-)"
[V],Make_My_Day,2006-12-23T17:28Z,Den är ju skön : )
,markro123,2008-11-15T17:31Z,please seed :P
