User Type,Username,Date,Text
,Saiyajin_Seraphim,2006-05-02T09:41Z,Thanks I guess... Now if only you got Emmanuelle 2000 series...
,Addehelgered,2006-07-04T18:27Z,Seed pls. :/
,HELMSMN,2008-04-26T06:00Z,"i have been lookng for months, zodathon since you seem to be finding these quite easily, WILL YOU PLEASE FIND EMMANUELLE VS. DRACULA in avi format PLLLLLZZZZZ "
,bauer24,2008-09-09T14:58Z,"anyone found this one:

Emmanuelle, Queen of the Galaxy"
,immirocks,2008-10-24T10:30Z,"I just uploaded its first part i.e. 01 First Contact
http://thepiratebay.org/torrent/4464291/Emmanuelle_-_01_First_Contact"
,immirocks,2008-10-24T10:50Z,"The link i posted is incorrect. The correct link is below:
http://thepiratebay.org/torrent/4464308/Emmanuelle_-_01_First_Contact"
,immirocks,2008-12-10T05:50Z,"The complete Collection of this series
http://thepiratebay.org/torrent/4566275/"
