User Type,Username,Date,Text
,BhagdadBob,2006-01-14T13:34Z,"Svinbra jobbat! Mer sånt här, så vi stackars studenter har råd med ketchup till nudlarna!"
,noirehtagemot,2008-05-14T22:30Z,"Min bäste herre, jag är för evigt tacksam!

Se nu till att seeda bara, allihop!"
,natizen,2009-07-28T23:21Z,"Visst, de är en gammal torrent, men kan någon vara snäll och hjälpa en tjej i nöd genom att seeda eller? Annars skicka via mail eller msn om de passar bättre för er, men jag vill ha denna bok! Snälla rara."
,Stenelo,2009-08-03T12:45Z,Kan nån maila mig denna??? Alternativt seeda. Snällaaaaa!
