User Type,Username,Date,Text
,copyrightsux,2006-06-15T09:21Z,Och vad är lösenordet till denna då???
,copyrightsux,2006-06-15T09:38Z,"Mitt fel, Tittade på fel torrent. Ursäkta en förvirrad morgontrött människa."
,frozenmega man,2006-07-14T17:53Z,yes thank u i agree with Paitor nice this is here anyway i notied theres only 1 seeder plz keep seeding for just a little while longer atleast ill seed when im done thanks once again!
,Mutchy,2007-06-14T23:30Z,"You're the man, thanks!"
,Guija,2009-12-27T19:17Z,"Thanks for the upload. Average quality, though."
,bentrom,2010-01-05T03:47Z,"thank for upload, quality to my liking, nice decent download speed, two thumbs up"
