User Type,Username,Date,Text
,Uffe38,2006-11-30T21:38Z,"Wonderful. Haven't listened to this in 15 years, great memories. Thanks!"
,aurturia,2008-09-27T23:01Z,I still have a sick TAD/ Sub pop T-shirt from the late 80s
,italianPlumber,2009-01-25T05:46Z,"Thanks! 

Suggestion:  Put the album titles in the torrent title or your description.  It would make this torrent easier to find. "
,SATURNIANTITAN,2010-11-22T16:16Z,"Thanks!
Really wanted 'Jinx' more than anything"
,Stonebender,2011-07-08T04:28Z,"Thanks!  This is hard to find anywhere else.

Anyone have Inhaler?  I had that CD ripped off years ago."
,SwedishBaron,2011-07-10T01:21Z,"This is fuckin amazing!
Thank you! Grunge rock!"
