User Type,Username,Date,Text
,PopArt,2005-08-17T19:57Z,"After download, I will take a look at this. Did the crack.exe not work on this one?"
,Sherwin0b0,2005-08-17T21:01Z,"no go it, i sent u a msg"
,nilesair,2006-01-09T14:28Z,Where is the crack then because i really want to fly with this beautifull thing only he is so expensive!
,jabbaru,2006-01-15T18:26Z,why not put it out when you got the crack ??..
,kre8iv,2006-01-23T12:06Z,Can someone please upload the crack for this ?
,barnabe,2006-02-13T14:59Z,"Couls someone reseed it, please."
,Karsten_xxl,2006-04-11T07:40Z,"hey guys,

any crack out there for this ??

Thanks"
,dzaccai,2006-04-18T16:07Z,"Does anyone has a crack or serial for this beautiful plane? 

thx"
,me dad,2006-04-22T11:19Z,"Hi.

How fare have PopArt come with a crack? and are someone seeding?"
,mikeppp,2006-05-21T06:38Z,"hi! Have you find a crack for Ariane 737-400 BBJ ? I find this one since a week, but i really can't find... write me to p_mikep@hotmail.com i you have something please !
I'll pay you if you have a fonctional crack, bye bye !

michael"
,mikeppp,2006-05-21T06:38Z,"hi! Have you find a crack for Ariane 737-400 BBJ ? I search this one since a week, but i really can't find... write me to p_mikep@hotmail.com i you have something please !
I'll pay you if you have a fonctional crack, bye bye !

michael"
,BA331,2006-07-14T19:23Z,"Does anyone have a crack??
PLS email me at 
William7wou@hotmail.com"
,pablo75,2006-10-08T05:51Z,plaesa download Ariene Boeing 737
,pablosilveira,2006-10-08T06:15Z,EU ESTOU PEDINDO DOWNLOAD ARIENE 737
,PilotForLife,2006-10-15T05:07Z,"This file wont be updated, no activation will be made available, as the stupid nigger (Sherwin) who uploaded it did not have permission... OUTCAST HIM!  It was a private release, sorry fellas"
,jetplane1123,2008-09-20T04:04Z,"SEEDDD!!!! whats the sense of putting up a download, if no one is going to seed. Seed or I leech!"
