User Type,Username,Date,Text
,Gucci83,2007-06-16T20:28Z,Fuck u att det e DVDRip... mer en simpel VHSRip om ens det... ljudet brusar ju ihjäl mig... Kasst kasst kassssssssst
,[]M[]o[]W[]h[]O[]w[],2007-06-20T23:40Z,"har alltid velat se denna filmen,hoppas att det e bra ljud o bild på den!!"
,Ositoman,2007-07-09T20:07Z,"Warning! This is TS-quality, source is probably a cam insida a cinema. Normal TS-quality but no DVD-rip at all."
,Laminat,2008-08-10T15:06Z,Undvik denna upload. Kvaliteten är urusel.
,Wicktarr,2009-01-05T12:14Z,"Detta är det en VHSrip eller något liknande..
Hittar ingen torrent med bättre kvalle heller tyvärr /:"
