User Type,Username,Date,Text
,drama_cydal,2007-09-06T07:37Z,Good shit Godfather....thnx for the upload youre the man...i'll seed for a bit since i DLed his within 10 min
,drama_cydal,2007-09-06T08:01Z,i take that shit back^^^^why is this CLEAN when it says DIRTY!
,supdave23,2007-09-06T17:47Z,chamillionaire said he was gonna watch what he said in his raps and keep it cleaner proving that u dont have to curse to have tight ass songs 50 cent called him a pussy
,supdave23,2007-09-06T17:50Z,ay g still waitin for that gorilla zoe album
,drama_cydal,2007-09-07T10:04Z,"i know chamillionaire/will smith is keepin cleaner, but this is still the censored version even though it says DIRTY!

waiting for that gorrilla zoe also...hes pretty sick"
,supdave23,2007-09-08T03:20Z,"shit who else is coming out i heard dr. dre coming out with a album soon, he had to push it back cuz of 50's album"
,supdave23,2007-09-08T10:04Z,gucci mane trap a thon
,ninja_n_pirate,2008-07-03T20:20Z,thanks man... I seeded .. for a little while
