User Type,Username,Date,Text
,svullne,2005-03-20T19:09Z,ha ha ha skit coolt!!!!
,svullne,2005-03-20T19:09Z,ja bara ge den!!!!
,jdaniels,2005-03-20T19:38Z,coolt men den ser lite slö ut ;)
,ec_crew,2005-03-20T19:46Z,"Hehe, vad gav ni för den? "
,CyberGuy.,2005-03-20T19:48Z,"Den är ganska slö ja. 0 - 50 på ca 40 Sec ;)
Men den ska trimmas, vi har även funderat på att sätta på en 80 cc motor från en cross."
,CyberGuy.,2005-03-20T20:13Z,Just den på filmen går på 5500:-
,Eggby,2005-04-08T11:16Z,Jag hjälper till att seeda denna för älskar såna här filmer! 
,L_i_n_u_s_,2005-04-08T22:54Z,kan ingen seeda?????????
