User Type,Username,Date,Text
,Anatol_Popow,2007-12-18T19:23Z,THANKS man! you're the best.
,Anatol_Popow,2007-12-18T19:26Z,do you have also Nemeth Design Mi-2 ?
[T],supaturtle,2007-12-18T20:02Z,"hohoho, because it's xmas time: http://thepiratebay.org/tor/3938919/FS2004_Nemeth_Design_Mi-2"
,Anatol_Popow,2007-12-19T14:24Z,awesome.... Can anyone seed or reseed dodosim bell 206 realstart
[T],supaturtle,2007-12-20T10:49Z,http://thepiratebay.org/tor/3940176/FS2004_-_Dodosim_Realstart_206
,Anatol_Popow,2007-12-22T11:14Z,REQ: CLS Piper Arrow and Dreamfleet/Flight1 Piper Dakota
