User Type,Username,Date,Text
,winchester87,2007-09-01T15:29Z,"the ww1 subsimulator??   Thx man!  I`m a  Silent Hunter player,  I`d like to check this out before I buy it, keep at it :D"
,tate_worm,2007-09-01T17:54Z,"I could use some help seeding BTW, I'm running between 35-50kbps upload."
,anal-fissure,2007-09-02T04:12Z,"gee zamorak1, your enthusiasm is contagious"
,kwakdoos,2007-10-04T20:28Z,Nice game works perfectly thnkx
,Lusen2,2007-12-10T18:15Z,its going real slow...
,kapusta99,2012-03-07T17:50Z,Can i have seed for this game  1914 Shells of Fury  please.. is it a game or crack or samething??? 
,kapusta99,2012-03-07T17:53Z,CAn i have seed for this game???
