User Type,Username,Date,Text
,solapola,2006-11-22T13:48Z,"seeda, please!!!!"
,Dexxus,2007-01-10T07:20Z,Please seed this fukkin' torrent.. everyone is strucked at 60% 
,mrtnls,2008-08-26T22:28Z,"Please seed this S**T! Stuck on 60.6.!!
Jeg er Norsk:)"
,deig,2008-10-25T10:01Z,Seed da! sitter fast p책 60%....
,henry76,2009-06-02T03:24Z,"Come on boys and girl please seeds this fantastic norwegian rock band from trondheim norway :D, Thanks zipfil ;)"
,n0xy,2009-06-27T21:05Z,"Seed plz!!!
I really love this album!!!"
