User Type,Username,Date,Text
,ThobbE69,2006-11-17T00:26Z,alla borde seeda denna 
,tobbe--92,2006-11-29T13:16Z,ååhh längtar tiss den e klar :D är det bra kvalite?
,marinola,2006-12-02T23:46Z,tack så jättemycket!!!
,suqa,2006-12-17T13:12Z,"Hur är kvalitèn?
Skulle vara Nice med lite seed!.."
,mini-bam,2007-01-08T16:13Z,han är ju bara för coool  tjoocka katten :P:P  tackar för den här:D
,kimman_96,2007-04-30T13:46Z,snälla seeda vill jätte gärna ha denna i klar i dag jag seedar när jag fått hem den så var snälla och seeda!!
