User Type,Username,Date,Text
,altavek,2007-03-30T05:37Z,"I love how 3 different people have uploaded the same torrent from PDTV.... ahhh well, naturally, I'm going with the one that lists the most seeds. ;)

btw, according to TV.com
http://www.tv.com/family-guy/no-meals-on-wheels/episode/904195/summary.html?tag=ep_list;ep_title;13"
,HooglyBoogly,2007-04-11T04:34Z,Excellent. Thank you coretorrents. You are definitely one of the best TV Show uploaders on this site. Keep up the good work.
,mynameisvan,2007-04-11T22:48Z,damnit! where's the 15th episode? on www.familyguy.com it's said that the new one has been shown on Fox at 9th of April...
,themage66,2007-04-12T02:48Z,"Dude, go to wikipedia its much better
http://en.wikipedia.org/wiki/List_of_Family_Guy_episodes#Season_5:_2006-2007"
,userone666,2007-04-13T19:26Z,When are the new episodes coming???
,Truepsycho,2007-04-21T17:29Z,Kommer det aldrig något nytt Family guy avsnitt eller??????
,shelby67,2007-04-24T22:31Z,"de kommer ett nytt avsnitt söndagen den 29:e april, så ta de lugnt bara"
,bmnrocks,2007-07-16T13:59Z,"Thanks for this, so glad that it's not in an RAR like the other retards do it.  At least with this I can watch it and keep seeding without having to have two copies."
,natanaelcd,2008-03-21T09:18Z,fAKE!!!!!!!!!!!!!!!!!!
