User Type,Username,Date,Text
,thelemite,2005-02-12T13:45Z,Den kommer ändå snabbare ner direkt från deras hemsida.
,Pestilence,2005-02-25T01:49Z,"Ingenting emot dig zero9 .. men jag tankar hellre från deras hemsida än med BT ... får ungefär 600-700kb/s från sidan, så jag sliter nog hellre därifrån... tyvärr men sant

men tack för en bra torrent"
,Jackass_boy_,2005-07-07T13:24Z,HUR FAN LÄGGER MAN IN FILMER
,d3x,2005-07-31T11:47Z,ÄG!
,zero9,2006-03-07T15:01Z,"seedar nu filmerna igen!
+ att ett par nya filmer kommer komma upp!"
