User Type,Username,Date,Text
,alfredo_666,2006-06-14T23:23Z,is it good? i dont trust in 1.63 mb
[T],crane_man,2007-02-01T14:56Z,"I ran this and yes it done work you just got to follow the dirrections that he told ya in his note pad in director   

T H A N K S     G R E A T   J O B   

No virus at all   wonderful   works great"
,simon-26,2007-07-20T03:08Z,its a tryout version. can only convert 1/3 of a dvd. registery is needed to convert complete dvd..
,Doctec,2007-09-27T04:47Z,ffs im sick of this. does the fucking thing work or not
,a.squirrel,2008-01-18T08:10Z,"Yes, it works.  Just copy the patch to the directory in which you've installed the program.  Like, C://Program Files/MagicDVDRipper... then run it and you're done!

I'll keep seeding for ya."
,monkey1125,2008-03-12T01:15Z,"Hi,

Is this torrent still active?
Seed please? =)

Thanks!"
,gsr092,2009-11-20T22:54Z,"mpg conversion works, now to try divx"
,gsr092,2009-11-21T05:53Z,"divx also works, but the image quality is poor
I can't seem to do anything to change it from 416 frame width.
any hints from anyone???"
