User Type,Username,Date,Text
,irontowngeek,2007-05-28T01:49Z,"I'm beginning to find you everywhere.
At least it will keep you outta' da nudie section.
(ha!)
I have this in my bucket,so I'll seed it.

Regards"
[T],wacko506,2007-05-28T02:24Z,no good m8 my computer crashed well the partititon that was seeding this and i cant get acces  to it so this torrent is depleted
[T],wacko506,2007-05-28T17:30Z,okwere back up and running at full steam enjoy everyone
[T],wacko506,2007-06-29T14:55Z,if anyone has any requests or need help just email me at wackdoc@hotmail.co.uk.
,Mr Complete,2007-10-16T15:46Z,"I have downloaded this torrent, but how do I install it? I have burnt it to a CD, but it doesn't work, please help me!!"
