User Type,Username,Date,Text
,chihuahua,2005-01-13T11:27Z,He he! Jag gillar det inom parantesen!!!! Mera MAC program vill vi ha!!!!
,Damien,2005-01-13T13:30Z,hehe me like. mac äger! min dual g5 rockar fett. hade varit kul å få en mac kategori här på pb. men de tar la fem år innan sverige fattar att mac gäller(om man inte vill spela c.s typ).
,Calavera,2005-01-13T14:48Z,"2004? 2005? Är det förra årets eller den som nyligen gick? Såg inte förra årets, men den ""one more thing"" vet man ju vid det här laget. Årets blev ju lite seg emellanåt men man var ju inte precis ensam om att vilja se."
,finskyminsky,2005-01-14T07:04Z,"Ursäkta mig... det var 2005 !!  Jag fortsättar att skriva 2004 på brever..
"
,deanjames,2005-01-17T14:03Z,"önskar jag hade en fin powerbook men dom kostar många mynt, mer än vad som finns i min ficka, jag skäms över min pc"
