User Type,Username,Date,Text
,T3HSAME,2007-08-13T15:40Z,Maybe you should seed if u upload a torrent :P
,JoakimLj,2007-08-13T16:11Z,kvaliten då?
,woodis,2007-08-16T02:32Z,"sååå, 167 downloads, 1 seed? wow..."
,cecilia2,2007-08-17T20:37Z,"seeda fan, jag är MYCKET imponerad av att det går så snabbt som 0 b/s... -.-'"
,Monkiii,2007-08-18T00:39Z,"271 downloads, 1seed -.-"
,Agoogo,2007-08-18T11:22Z,Is it good quality?
,Fireblader86,2007-08-25T00:51Z,"Seed for a while...
Then I will seed when I'm done.
Will keep seeding every night (all day but not the evenings)"
,Politisk_Soldat,2007-09-02T12:04Z,SEEDA PLZ!
