User Type,Username,Date,Text
,robinux108,2004-12-03T08:17Z,Använde den på Luzifear Versionen Funka lika fint Tack :D Entligen är man tillbaka i spelet
,Scooby-Doo,2004-12-03T17:31Z,"min bt client e cp, kan inte tanka nåt längre, lampan lyser bara svart hela tiden, har prövat att installera om, hjälperr ej :/  nån som kan hjälpa mig :'("
,Xillion,2004-12-03T17:51Z,"samma sak som scooby-doo händer för mig. Vad är fel?
Tacksam för svar."
,Xillion,2004-12-03T18:49Z,"NU FUNKAR DET. Det går bara på 10 kb/s
men det är bättre än 0. Seeda nån mer så det kanske går snabbare"
,micho,2004-12-08T01:20Z,Couldnt listen - unable to forward port bla bla bla.. samma sak på alla torrents
,micho,2004-12-08T01:22Z,laddade bara ner den andra torrent klienten så funkade det
,STWLiMpAn,2004-12-16T21:41Z,nån som kan hjälpa mig här
,Rapt0r,2004-12-31T01:57Z,VA FAN ÄR DETTA EN TORRENT SOM DRIVER MED MIG :S??? Jag är på 98 så går den ner till 90 sen går den upp och ner hela tiden :S ... vad är felet
,sullan,2005-02-27T11:41Z,:cool:
