User Type,Username,Date,Text
,Nexus665,2006-06-09T22:53Z,"Dude, you're *on* the best public torrent site. 'nuff said."
,Gnub,2006-06-10T02:40Z,yeah why would you be here if toorentdouche was the bast? long liove TPB!
,rainking-1,2006-06-10T05:10Z,"that torrentdouche site is LAME !!!!
1 seeder for all torrents and no more than 3 leechers...just plain lame there 00..they dont call you 00 for nothing....spread your crap elsewhere"
,scunky,2006-06-11T12:37Z,"Twat!!... you Can't blame the site for 0 seeders
i mean look at all the 0 seeders on TPB. "
,gomzi,2006-06-18T03:28Z,"man are u sh*tting, 1 seeder, 3 leecher?
man thats like waste of resources and time and just lame.
well TPB is the best, as it gives u the freedom.
If it was nt for TPB i wud nt be able to share my files with my friends here.

^:)^ long live TPB, the unchallenged king of kings"
,milboy,2006-10-29T06:55Z,SHIT!!!!
