User Type,Username,Date,Text
,Axe,2004-09-23T09:29Z,du har inte möjligen pinnacle impression-dvd pro också? det skulle uppskattas!
,ratbike,2004-09-23T23:38Z,"När du lägger upp ett program, så måste du seeda Å !!"
,mirre20,2006-01-22T20:08Z,Kom igen nu! Snälla seeda!
,Zeroskate,2006-06-20T17:12Z,vd fan e seda?
,Larnym,2006-11-20T18:05Z,please seed
,Jokkmokk___,2007-12-07T18:36Z,"haha, vad tror du?? När du laddat ner måste du ladda upp och vara en källa till andra som laddar ner annars går det ju inte så PLEASE SEED!!!"
,Jokkmokk___,2007-12-07T18:37Z,kom igeeeen!! snälla
,rasmusx15,2008-04-08T17:05Z,wtf???
,DjJojje,2010-02-03T14:21Z,Jag seedar fullt iallafall... har snabb lina... goo goo gooo!!!
