User Type,Username,Date,Text
,loooney,2006-09-27T14:57Z,"I'm stuck now on 99%. Please seed a little longer, and I will help you with the rest..."
,Fnykis,2006-09-27T18:35Z,"Stuck at 99,1%. Pls seed some more. I'll seed at least 5:1 ratio."
,pruftu,2006-09-27T18:49Z,Sorry. My computer is reserved for other purposes during the day. Seeding now. :)
,robmck,2008-06-23T20:42Z,"I was patient and downloaded . only to find that the vids were corrupted.. unplayable. Any chance they could be checked and re-seeded. 
thanks RM"
,Jocax,2008-11-03T20:57Z,"robmck says that the files are corrupted, but i downloaded some of the episodes (1th and 4th, so far) and found everything alright."
,framtiden3,2010-03-15T23:16Z,"Svensk text eller vad ????
Yxa - skriv om det är texat på nått språk."
,ernstgustaf,2011-06-13T13:14Z,"Framtid3?
Inte är det väl framtiden att skriva på svenska till uppenbart engelskspråkiga användare. Yxan må du nog använda på ditt eget huvud."
