User Type,Username,Date,Text
,pbsyp,2007-11-15T23:36Z,HD? you stupid shit this is nothing close to hd you fucking moron lol this shit vid is small as fuck and low quality and this fucking retard calls it HD
,JasonLIVE,2007-12-07T21:29Z,"Well, it made you download it, didnt it?

Retard."
,pingoomaxer,2008-02-19T12:54Z,this movie stink men HD.... omg 
,lolomgwtf20067,2008-02-22T21:49Z,well if u thought this was HD you are obviously retarded. LOOK AT THE FECKING FILE SIZE
,jbdverdi,2009-04-13T08:18Z,"Anja is so hot!!! Thanks
Do you have more of her?
I hope"
