User Type,Username,Date,Text
,Darth Keane,2006-12-06T15:05Z,"Somehow the demonoid.txt file F$""#$""#$""ed me up!! It changed my percentage to %99.99. when i'm the main seeder... 

try not downloading the txt file... 
It it stops downloading at %99.99... you may assume it's complete, try opening the video with VirtualDub, 

Sorry dudes, first time I upload in demonoid.. let's hope it's not he last one
"
,Darth Keane,2006-12-06T15:06Z,"Somehow the demonoid.txt file F$""#$""#$""ed me up!! It changed my percentage to %99.99. when i'm the main seeder... 

try not downloading the txt file... 
It it stops downloading at %99.99... you may assume it's complete, try opening the video with VirtualDub, 

Sorry dudes, first time I upload in demonoid.. let's hope it's not he last one"
,Darth Keane,2006-12-07T05:07Z,"[color=red]Erase your torrent, but do not erase what you've downloaded... 

then, download again the torrent and this time do not chek the hash: 
""Omit hash check"" must be on.[/color]
"
