User Type,Username,Date,Text
[V],iggy.stooge,2006-12-18T23:10Z,TAck. En av de bästa torrents som lagts upp någonsin här!
,skogsgubbe,2006-12-18T23:26Z,Stort tack! Dey här är riktig musik!!
,franzoskar,2006-12-19T06:25Z,Tack så mycket!
,h3ikki,2006-12-19T16:30Z,Underbart! Tack sabot! Det här har jag väntat på länge! God Jul.
,sabot,2006-12-19T16:38Z,"God Jul på er!

Kul att ni gillar det! :D"
,husk666,2006-12-20T19:16Z,En djup bock och ett stort tack!!
,eric88,2007-01-04T14:07Z,TACK!
,crazychester,2007-02-20T20:34Z,skitbra
,_apan_,2007-09-07T16:32Z,En helt fantastisk samling! Tack!
,Norrut,2007-10-31T07:29Z,Tackskaduha.
,Libidus,2008-01-04T23:46Z,Satan så bra! Den tackar man och bockar för.
,angeskog,2008-02-26T00:53Z,Detta är guld värt!! Tack sabot!
,FitMic,2008-04-13T19:12Z,Stort tack!
,zekev,2008-05-23T21:11Z,"Snälla, seeda denna."
,kidnero,2008-07-05T08:42Z,Tack ifrån mig! Blev jätteglad när jag hittade allt detta.
[T],Nadjas,2008-08-12T17:44Z,Stort tack!
,hatecoreSS,2008-08-17T18:46Z,awesome upload. tack så mycket. :D
,banksoncrack,2008-12-21T15:17Z,tack för denna tidiga julklapp!
,assegoblin,2009-05-15T00:58Z,om bara någon liten människa skull vilja seeda så skulle jag bli jätteglad...
,SirJoaCim,2009-06-27T00:49Z,Vore coolt om någon/några kunde seeda efter sig!
,Arcilius,2009-12-17T13:21Z,Vore som sakt kul om nån kunde vaar snäll o seeda... !!!!!!!!!!!!!!! 
