User Type,Username,Date,Text
,Axe,2005-01-09T23:22Z,Thanks! Looking forward to the upcoming seasons! One pack or small chunks doesn't really matter to me... Keep up the good work!
,Vasu,2005-02-10T05:30Z,"Ditto, thanks so much for this!"
,addiman,2005-05-06T00:46Z,"Thanks for the west wing !!!

I do prefer to get them in six parts due to discspace... "
,Berro,2005-06-19T13:04Z,"Where can i find subs swedish/english for these episodes of the west wing season 1?

Anyone got them already?"
,blajeans,2005-08-17T12:13Z,Kan du vara snäll och dela upp de andra west wing sesångerna i små packet också så skulle det vara mycket uppskattat.
,cretin1234,2009-11-30T18:30Z,Someone please seeds! I will keep seeding after! PLEASE!
,captainmarveljt,2012-07-02T17:40Z,thank you!
