User Type,Username,Date,Text
,Todde@Swe,2008-04-17T19:53Z,"How to use this.... DL the RELOADED release 1.00.59 version and trying to apply this new 1.03 patch but i wont work. Even after a reinstall, so now i'm trying to use the 1.02 patch first and THEN 1.03 or how can i make it work?"
,skeith574,2008-05-14T11:58Z,can anyone please post a cd-key here i dont have one yet pls..
,ghostWolf,2008-05-31T14:51Z,warning ! contain trojan
,Zamorak1,2008-07-17T14:11Z,Trojan!
,DamienHell,2008-07-21T16:29Z,"This for Vegas 1! It was linked on vegas 2 for some reason, this will not work with vegas 2"
,rchartrand1,2008-08-05T03:13Z,Is there a way to have bogus torrents removed from Piratebay??
