User Type,Username,Date,Text
,PaddenJunior,2007-07-09T00:29Z,how do I seed? 
,PaddenJunior,2007-07-09T00:29Z,I have zcero can I drag the files into that folder instead of source folder?
,Jontey,2007-08-21T17:17Z,"http://thepiratebay.org/tor/3779378/PacSteam
(PACSTEAM)download this so can u play what ever you want  just do that it stands in info .. u download the games at steam owne servers .. its work very good i have test it by my self and its perfect allt the games on steam u can download too not jst counter strike its about 300 games or something ^^"
,fukendi,2008-07-16T19:45Z,i will seed if som1 tells me how
