User Type,Username,Date,Text
,afterglow88,2006-12-07T19:11Z,Antal mappar: 61*
,afterglow88,2006-12-07T19:57Z,Glöm inte att seeda:) Dont forget to seed:)
,Robert98,2006-12-10T16:23Z,seeda alla sitter fast 58.1%
,afterglow88,2006-12-10T22:07Z,Jag seedar men tyvärr sitter jag med 0.5 mbit uppkoppling så tyvärr så tar de ett tag.
,floa,2007-05-13T20:23Z,"read it online or download it directly from

http://anip.homeunix.com:81/onlinereading/?path=Samurai%20[X]%20Kenshin%20Complete/"
,Myuigon,2007-05-20T15:31Z,"Seed goddamit, wants to read... :P"
