User Type,Username,Date,Text
,Hinken29,2006-12-10T00:15Z,"härligt galfisk! ser fram mot släpp fångarne loss, som jag för övrigt tjatat om på halva nätet =)"
,GalFisk,2006-12-10T00:56Z,"Fint, om gknot inte är konstigt igen kommer den upp imorgon."
,Hinken29,2006-12-10T01:30Z,tackar vi för! blir en bra söndagsrulle att bota hangovern med. bra jobbat
,adorkin,2006-12-10T12:24Z,"Rötmånad, någon??"
,Lemberg,2008-08-12T03:39Z,"En jävla underbar film. ""Mannen som slutade röka"" fick mig att köpa båda Hasse & Tage DVD boxarna och jag ångrar inte en sekund ifrån nån av de 8 filmerna. Köp lådorna - där finns en dokumentärfilm och kommentarspår med bl.a. Stellan Skärsgård, Gösta Ekman och Hans Alfredsson..."
