User Type,Username,Date,Text
,zalem,2007-03-06T13:03Z,tackar på förhand..undrar hur många delar serien är på totalt?? har för mig att det var en hel del..
[T],cdomeij,2007-03-06T16:40Z,"TALADE SPRÅKET ÄR TYSKA OCH INTE HOLLÄNDSKA SOM ANGIVITS !

12 Delar Totalt"
,FERRARI4LIFE,2007-03-07T18:22Z,TACK
,evert johansson,2007-03-07T22:07Z,"Är denna också omöjlig att få fram svenskt tal på, precis som med Goebbels?"
,bruno1991,2008-01-21T21:01Z,"Men bra seed era suphuven ! 
Snabba på lite förfan..."
,TaxiTitan,2008-01-30T13:58Z,"En livsnjutare som hällre lekte med tåg, välltrade sig i konfekt, jagade eller tog morfin istället för att ägna sig åt nazismen, samt framgångsrik & verbal.
Kanske borde han ha funderat på the American dream istället.
Mångsidig man. se den"
,badlands,2008-08-15T14:39Z,"Lägg ned tankar på nedladdning - uppskattatd till mellan 3-6 veckor och det går med 0,5-11,5 i hastighet. Fullkomligt värdelöst. Trist nog har filmerna utgått ur sortimentet, men man vill ju få hem det innan pensionsåldern. Eftersom användaren inte är inne så ofta heller försämras möjligheten än mer. Bry er därför om detta och bespar er frustrationen."
,papparegor,2009-01-04T15:37Z,"Var är alla seeders?
Tack för torrenten"
