User Type,Username,Date,Text
,fickpingis,2007-03-03T16:57Z,"Not a Rammstein song, see http://herzeleid.com/forums/viewtopic.php?p=652678 . Vampire is actually Die Krupps - The Vampire Strikes Back."
,wolfmannen,2007-03-03T17:04Z,"http://www.requestlyrics.com/read.php?1,628068,628068,quote=1

Hi out there ... well, is this Rammstein or is not?
why don´t go look here and find out?

Rammstein is gr8, that´s that."
,sutmin@,2007-03-04T10:48Z,"Has never been and never will be Rammstein, it sounds like crap....

@"
,bumletog,2007-03-28T15:59Z,"Saying Rammstein are nazi's are a big laugh - the lead singer of gay and the ultra thin keyboard player is jewish....can't get much more anti nazi than that, I think?!?"
,Axtin,2007-04-27T20:01Z,"I'm not really sure if it's true that Till Lindemann (the lead singer) is gay. I've heard that he has a spanish talking girlfriend who has helped him to write the text to ""Te Quiero Puta!""."
