User Type,Username,Date,Text
,Kadaverbenkt,2008-01-22T00:48Z,Can someone please seed? I'll seed it for bloody ages if (when) i get it done. This is wonderful. ;)
,PreLoaderMan,2008-02-05T14:22Z,"I will, this is a nice video live, sadly, MAIN SEEDER is always offline :("
,BK92SI,2008-07-18T01:36Z,OMG whats up with the seeding of this thing? I can't seed any more than I have !
,marklar2u,2009-12-04T20:48Z,"Just found I.H. a few days ago - and this was such a treat.  She is so talented.

What a delight to see her in an informal atmosphere creating her beautiful music.

Audio and Video quality are excellent."
