User Type,Username,Date,Text
,Knl_Kilgore,2007-07-02T18:33Z,"There are four files. I scanned these files before uploading and they are def trojan free.

The original torrent i got them from had 7 files of which 3 where trojans i just deleted the shite and reseeded"
,Gothma,2007-07-13T16:42Z,"Hi Knl_Kilgore

All of these scan fine with the latest version of AVG

Thanks for the Torrent"
,musicaldudette,2007-09-26T14:28Z,@knl_kilgore your either a liar or you have a bad virusscan because my kaspersky detected 3 trojans in it. if photoshop wasn't so dang expensive i would have bought it already.
,Friendsxix,2008-01-02T22:54Z,"musicaldudette , what version of photo shop do you want to register?"
