User Type,Username,Date,Text
,coverdinfish,2005-03-01T12:42Z,Du e lika skön som ett varmt skumbad (kanske inte luktar lika gott men vadå).
,ge5239,2005-03-01T12:50Z,"buffy är värt att köpa, så köp! 
cd-wow.net och play.com har billigt med gratis frakt, köp EJ i sverige.. "
,leza,2005-03-01T14:02Z,"Åh Tack :)
kommer du lägga upp säsong 6 med????"
,Anderss08,2005-03-01T15:32Z,"ge5239
På play.com kostar säsong 5 ca 530sek.
På cd-wow ca 450sek.
Leveransen tar över en vecka.

På discshop kostar säsong 5   479sek med levereans dagen därpå.

Varför inte köpa i Sverige?
"
,MrSandman,2005-03-01T21:53Z,"Varför inte ladda hem från Internet? =P

// MrSandman"
,Anderss08,2005-03-02T07:42Z,"Jo, det är ju det bästa:-))"
,coverdinfish,2005-03-03T17:40Z,Har inte lyckats komma in på piratbyrån på ett tag. Är det hos mig eller dem det e fel?
,Anderss08,2005-03-03T18:55Z,Jag har också försökt komma in för att hitta lite info om det nollfungerande nya söksystemet men de verkar funka lika bra.........
,coverdinfish,2005-03-03T19:42Z,"Ok. å inte har jag fått trökorna jag skicka efter heller, aja, kommer väl snart."
