User Type,Username,Date,Text
,rci,2005-05-07T05:02Z,"Sci-Fi - Tagline: Every man its prisoner... every woman its slave!

Plot Summary: One of several remaining members of its race, an alien from Venus is guided to Earth by disgruntled scientist Tom Anderson... (more)

User Comments: A mixed bag, but a lot of fun ..."
,berno,2005-05-07T10:11Z,"hm... I wonder where you got this one from Mr.T ;) 
/btd"
,snaggvovve,2005-05-07T12:18Z,This movie rocks!
[T],Knaster,2005-05-07T14:33Z,Hmmm sounds interesting could be cool
,zarath,2005-05-07T23:30Z,"thanks for this! any dvd artwork available?

k"
,Mambo Bananapatch,2008-06-09T23:08Z,"This is the movie which inspired Zappa's ""Cheepnis"", on the Roxy & Elsewhere album. I've always wanted to see it, thanks for posting it."
,smartskallen,2008-06-18T02:44Z,"""Cheepnis."" Let me tell you something, do you like monster movies? Anybody? I LOVE monster movies, I simply adore monster movies, and the cheaper they are, the better they are. And cheepnis in the case of a monster movie has nothing to do with the budget of the film, although it helps, but true cheepnis is exemplified by visible nylon strings attached to the jaw of a giant spider . . . I'll tell you, a good one that I saw one time, I think the name of the film was ""IT CONQUERED THE WORLD,"" and the . . . Did you ever see that one? The monster looks sort of like an inverted ice-cream cone with teeth around the bottom. It looks like a (phew!), like a teepee or . . . sort of a rounded off pup-tent affair, and, uh, it's got fangs on the base of it, I don't know why but it's a very threatening sight, and then he's got a frown and, you know, ugly mouth and everything, and there's this one scene where the, uh, monster is coming out of a cave, see? There's always a scene where they come out of a cave, at least once, and the rest of the cast . . . it musta been made around the 1950's, the lapels are about like that wide, the ties are about that wide and about this short, and they always have a little revolver that they're gonna shoot the monster with, and there is always a girl who falls down and twists her ankle . . . heh-hey! Of course there is! You know how they are, the weaker sex and everything, twisting their ankle on behalf of the little ice-cream cone. Well in this particular scene, in this scene, folks, they, uh, they didn't wanna re-take it 'cause it musta been so good they wanted to keep it, but they . . . when the monster came out of the cave, just over on the left hand side of the screen you can see about this much two-by-four attached to the bottom of the Thing as the guy is pushing it out, and then obviously off-camera somebody's goin': ""NO! GET IT BACK!"" And they drag it back just a little bit as the guy is goin': ""KCH! KCH!"" Now that's cheepnis. Awright. And this is ""Cheepnis"" here. One two three four . . .

I ate a hot dog
It tasted real good
Then I watched a movie
From Hollywood

I ate a hot dog
It tasted real good
(Yum-yum yummy-yummy-yum
Yum-yum yummy-yummy-yum)
Then I watched a movie
From Hollywood
(Dum-dum dummy-dummy-dum
Dum-dum dummy-dummy-dum)"
,unholm,2008-09-19T23:47Z,"THANK YOU FOR SEEDING!!!
This piece of Art was not only one of the Favourite Sci-Fi B-Movies of the late FRANK ZAPPA but also one of mine !!!
Thanx SMARTSKALLEN for the effort of writing down the famous FZ-Intoduction on ROXY & ELSEWHERE for Cheepnis.
And of Course THANX CHARVA for uploading this great entertainment...
Helmut from Germany"
,rayslap999,2008-12-22T18:07Z,"This movie is really entertaining, thanks to the seeders and a nod to Zappa, we miss him:)"
,thingf1sh,2009-07-08T21:16Z,"I don't believe it I finally found it. The monster movie Frank talked about. Charva I luv ya.

I see more Zappa freaks are pleased by this upload too. Hiya dudes keep the music alive"
,thingf1sh,2009-07-10T21:33Z,any chance someone could seed
,jab5450,2011-04-06T07:36Z,"Please guys we need more seeders!!

Thx"
,Klatu666,2012-08-04T12:43Z,"i have downloaded this movie twice, but there is something wrong with the file. It just won´t play on my mac. no error or anything."
