User Type,Username,Date,Text
,freddee_89,2008-02-03T17:42Z,more speed !!!!  =)
,Kreutzfeld,2008-05-28T04:07Z,Which videoes does this download contain?
,PlayaPlaya19,2008-06-15T00:29Z,The fact that she doesn't take off her clothes makes me want her even more. :)
,BobbyLaurel,2008-08-16T15:40Z,Thank you very much.
,JMobile,2008-10-03T10:18Z,Very good torrent. It is so much on HD that her tits nearly hit my face...=]
,rickcain,2010-02-09T06:04Z,"You should see the ones in 3D

(kidding)"
,drpower,2012-02-27T17:05Z,rar file
,captainsmee,2012-04-13T01:22Z,"Thanks for sharing, your time and efforts are highly appreciated."
