User Type,Username,Date,Text
,spiit,2007-03-09T18:49Z,"think its just a type error masseur, maybe missed a "
,spiit,2007-03-09T18:51Z,char in the link
,SBC,2007-03-10T00:19Z,Is this really a dvd rip?
,G. Land,2007-03-10T20:16Z,how is the quality???
,JesusEatsBabies,2007-03-10T21:36Z,great quality
,Tony73,2007-03-11T15:59Z,"Any subs site?
need Swe sub?"
,DooDoo Butter,2007-03-11T20:29Z,Is this supposed to be The Hitcher? not the hitchhiker?
,heman69,2007-08-10T20:23Z,"could someone seed please?!
thanxs"
