User Type,Username,Date,Text
,orgpunk,2004-12-23T05:30Z,http://www.imdb.com/title/tt0059183/?fr=c2l0ZT1kZnxteD0yMHxzZz0xfGxtPTIwMHx0dD1vbnxwbj0wfHE9RmxpZ2h0IG9mIHRoZSBQaGVvbml4fGh0bWw9MXxubT1vbg__;fc=1;ft=5;fm=1
,cmd,2004-12-23T16:58Z,"finns det n책n seeder ute tro,, ;D"
,serepticous,2004-12-23T17:44Z,unfortunately I do not speak  other than bad english but  hopefully u said thks  thks here to to u guys and evryone  who enjoys a hobby .. :)
,kebek,2004-12-29T18:22Z,"This is NOT the 1965 classic as indicated in the imdb-link above, but the (crappy) 2004 remake!"
,serepticous,2004-12-30T01:44Z,i did not throw that link in to movie i try to put link in but is first time ive upped this site ... in details it does say what it is which is a repack not a dvd ..   but  there yaa goo  u r absolutely correct i didnt put link there and   am confused by so much swedish  hope your new year improves 
,x7dude,2005-01-10T09:10Z,"hey, I can't play this file... what codec is it???"
,colinwatson1,2005-03-10T14:05Z,http://www.free-codecs.com/Video_Codecs.htm
,badassmother,2005-03-22T21:08Z,"this movie is not in divx or dvd quality....it is recorded in
a movie theatre......the quality is okay....use nemo codec pack or theoretica divx drivers.........................

it works for me"
