User Type,Username,Date,Text
,Schmitkovic,2006-02-08T12:12Z,"Does this have This Present Darkness on it? if so, could you re-upload it alone? it will get a load of dwnloads"
,livewire195,2006-02-24T23:46Z,"Awesome torrent, Seeding for like a week."
,Conpon,2007-07-03T12:37Z,"@Schmitkovic

Learn to torrent. If you use a good torrent-client (i.e. ÂľTorrent), you are able to select what files to download, and which not to. Read the FAQ on their site for how.

Thank me later (by seeding). "
,n3v3rkn0w,2008-11-08T14:45Z,damn i wish i didn't have dial-up i love this band 
,wtfluke,2009-01-21T12:59Z,you are missing this present darkness ep which is their best work in my opinion
,kevinsantoyo,2009-06-05T06:13Z,good torrent will seed forever
,xxLYNCHxx,2010-03-29T09:19Z,Wonderful upload metal_moses. Everything I needed in one torrent. Props 
