User Type,Username,Date,Text
,thecult,2006-12-21T17:14Z,If anyone wants to help me with the releasing of these files please drop me a email on tom_Price2000@hotmail.com
,iva90,2007-10-25T21:57Z,"Great tv show ,he was something......rest in pease.
does any one have more episodes?
Thanks"
[T],spotswood,2009-09-24T01:07Z,i absolutely loooooooooooove sleeping to these!!!!
,mangomush,2009-09-27T04:47Z,"hell yeah

these are great. thank you!"
,infini1,2010-01-15T14:59Z,Thank you so much. It's so hard to find these. I have been looking around for hrs!
,Varinia,2010-01-24T08:12Z,thank you very much
,dimodetis,2010-01-26T11:28Z,good!!!!!!
,Midas718,2012-03-10T07:26Z,Thanks much!
