User Type,Username,Date,Text
,krutok,2006-04-26T01:10Z,"Damn I started downloading this, mistook it for porno. Atleast I stopped the madness at 40% :/"
,Big.O,2006-12-26T22:15Z,"please seed, thanks!"
,izoldanna,2007-08-06T19:20Z,"Beware, this is the SECOND PART! Not the one with Julia Stiles."
,Ronjen,2008-05-12T14:56Z,Is this porn?
,huvudverk,2011-03-02T20:21Z,If its not porn you should put a warning label on it.
,iva7LOVE,2011-04-29T19:20Z,this is not porn and it is not a movie... -.-''' 
,iva7LOVE,2011-04-29T19:22Z,it is not porn and it is not movie -.-'''
