User Type,Username,Date,Text
,jgabriel,2007-12-08T10:28Z,http://www.imdb.com/title/tt0118062/
,stass,2007-12-08T17:03Z,"Kan du seeda eller ladda upp den igen.. ? har letat fler år efter denna filmen! Snälla!

Can you pleas seed this movie...
i have looking for it long time..
"
,dlf10,2007-12-11T11:39Z,ledsen för att det tar tid! jag har haft super strul med mid torrent client.. nu säger den att jag seedar och porten är öppen... men jag vet inte om jag måste fixa en ny torrent eller om TPB uppdateras snart... ha tålamod :) tack!
,Sajjmen,2007-12-12T14:04Z,"Har åxå letat i flera år efter denna rullen! Grymt bra film, tusen tack! Hur lång tid det än  tar(="
,dlf10,2007-12-12T16:59Z,jag är bedrövligt ledsen att det går så långsamt!! jag har bra lina och seedar full bandwidth och ändå så ser jag att det kopplar ifrån hela tiden. vet inte vad jag ska göra. andra filer seedar fint... :p jag jobbar på en kvalittets 700mb dvdrip också... kommer snart... 
,dlf10,2007-12-14T16:59Z,now there is a 700mb AVI version available .. search on Vackert Väder again. cheers /
