User Type,Username,Date,Text
,woody111,2006-04-01T10:09Z,anything really funny
,Seferine,2006-04-29T00:20Z,"I know it is free, but this is definitely NOT funny. "
,sigve1000,2006-06-29T01:11Z,Not funny at all man..
,Waldobaby,2006-10-21T05:42Z,"Where did he say ""funny""?"
,Conan2000,2006-12-08T14:36Z,terrible...
,wizeguy1,2007-09-26T19:34Z,someone wanna seed this? i have to see what makes this video so not funny.
,firbanky,2008-06-30T20:19Z,"dont bother it really is not funny, the out takes are really long and the gag is rubbish, e.g. a prop in the background falls"
