User Type,Username,Date,Text
,Dougfrank,2007-08-04T21:51Z,"Thanks for the upload, and I seeded it for days......

BUT, it's British.

It has a lot of good info, but none of it can help me get a job for Union Pacific or Norfolk Southern here in the US.  In the UK, that might be another matter."
,ep1centre,2008-01-31T18:09Z,Please can someone seed this!!!!!!!!!!!!!!!!
,scotskitten,2008-03-17T16:36Z,Hi mate can you seed please :D
,mccaffertys04,2011-08-27T15:20Z,please can someone seed this im begging you people im on my knees begging please seed for about 5 hours straight and in turn i will continue to seed for a further 24 hours together we can keep files alive :-D
,billybob007,2012-01-26T23:32Z,Any chace of a seed
,billybob007,2012-03-28T02:30Z,"seed please
pretty please"
