User Type,Username,Date,Text
,Staple,2006-09-12T21:36Z,Härligt. Finns dom andra programmen också.
,gfish,2006-09-14T11:48Z,Skulle offra min lilltå (vänster fot) för de tidigare avsnitten.
,RickePuff,2006-10-05T14:27Z,Är beredd att ge min vänstra nöt för resterande avsnitt.
,Slane_Shame,2006-11-27T17:07Z,"Grymt stort tack! Vore kanon om dom andra avsnitten kom upp också! Dom går i repris på SVT24 onsdagar nu kl 22.00. Har dock inget att spela in dom på!

TAAACK!"
,knumgar,2008-03-24T16:07Z,men seeda för i helvete
,CiXz,2010-05-24T18:15Z,Seed Plzz
,sense_net,2011-04-06T11:10Z,Såg att det går på Kunskapskanalen nu men jag har själv ingen TV-antenn och det finns inte på SVT Play :(
