User Type,Username,Date,Text
,woody,2005-06-16T20:06Z,"Btw: The movie is in divx format and if ya like the song, you can download the whole album from www.mcchris.com Some feedback would be nice too, as long as it doesn't look like: LoL i own you at stunting, I'm quate famous (i know it's spelled quite), 'cause even with pro standards i get some BIG airs here, and many stunts are original. MANY."
,Nicke_91,2005-06-18T23:18Z,I can do it but you must seed
,_nightmare_,2005-06-19T01:56Z,how do u seed
,woody,2005-06-19T11:24Z,"I do seed, every day. But i have to turn off the computer at nights."
,rebby2,2005-06-24T13:37Z,hva heter den sangen du brukte i filmen?????
,rebby2,2005-06-24T13:37Z,what's the name of the song used in the movie????
,woody,2005-06-25T08:10Z,"Hehe.. The song is called ""Fett's Vette"" From the ""Life's a bitch and I'm her pimp"" album. "
,rebby2,2005-06-29T15:14Z,thanks
