User Type,Username,Date,Text
,meer.station,2006-11-26T12:29Z,OMG SEED
,zeroVirus,2006-12-02T12:36Z,"Oh...
Sorry, no one seeding my torrent
I will seed it for a week, I hope after that someone will do...!!!"
,BlahzayBlah,2007-06-12T23:02Z,"Excellent, dude! Fucking excellent! Got the other album as well? That would be great! Anybody else got the other album?"
,groovaxtc,2009-07-12T03:19Z,Thanks for seeding
,North Nitro,2010-04-11T21:52Z,"Electric City, fuck yeah!"
,Thinyman,2010-05-04T01:49Z,"yaa , i've been looking for this for a long time :) 

thanks dude :)) ill seed for a week "
,gf_portal,2011-12-27T12:41Z,Thank you very much.I was really stucked.I couldnt find they`r album free.Thank you thank you thank you...
