User Type,Username,Date,Text
,velourkungen,2007-11-25T20:30Z,what zapp u cunt is it 2 hard 2 fucking google it? just open the fucking browser write the ten imdb in the fucking search box and hit fucking enter and youll find it u retarded fucknut
[V],He0n,2007-11-26T00:02Z,"http://www.imdb.com/title/tt0811106/
big diffrent this !!!!"
,Latiino,2007-11-26T07:30Z,wow tpb is full of noobs O_o
,hsekum,2007-11-27T05:41Z,i geta error message o da 13th .rar file its corrupted help me mod o neone y is it so????????
,jankerr,2007-11-27T09:43Z,Where I can find serbian subtitles for this movie?Quality audio and video are vey good.Thanks
