User Type,Username,Date,Text
,-zag-,2006-12-24T11:53Z,"Thx byggo! Really nice, enjoying it as I write! :)
I will have my eyes open for more torrents from u.. thnx ag mate! And a merry, merry christmas to u!"
,m_tornis,2006-12-30T15:03Z,please seed =)
,xenu dot net,2006-12-30T21:53Z,"thanks byggo...will be nice to play on tomorrow's party before the big party
"
,Matrozz,2007-03-13T16:14Z,"Hell yea! thx again byggo..
much great music, love it (you)!!! :P i hope you will share more and more :D:D"
,vanity_eleven,2008-04-10T15:30Z,"Seed people, seed !"
