User Type,Username,Date,Text
,mowglironja,2006-07-20T09:23Z,have you front covers
,apelsin123,2006-12-12T18:49Z,Rikigt bra skiva med sköna gamla låtar :D
,Candyman76,2006-12-19T00:56Z,"Jävele...det är ju en massa sköna låtar här!
Tackar för denna sköna ul."
,s4rsb4r,2007-04-16T07:33Z,"IT'S RAININ' MEN!

Hallelujah it's rrrainin' men--amen!

I'm gonna go out... and get mahself... absolutely SOAKIN' WEEEEEEET!!!!

Something about this song just gets me in a singin' kind of mood... thanks, geezen! :D"
,swedishApa,2007-04-20T22:30Z,"Tack så jävla mycket!!!

har letat överallt efter I'm so exited med pointer sisters, har äntligen hittat den!
det är nåt specielt med den låten, vet ej vad ^^"
,resonator,2007-06-15T20:58Z,"This is the album ""Absolute Music - Absolute 80's"" from 2003."
,nonickname,2008-05-10T12:24Z,"Nästan ett år sedan förra komentaren, hoppas nån seedar fortfarande, tack för UL och tack för det glada 80talet!!"
