User Type,Username,Date,Text
,harmonica_,2007-08-19T19:03Z,it does not work for me..i don't know what i'm doing wrong. I can use it for 30 days but then i need a serialnumber to keep it..please help!
,ourbobby,2008-05-13T14:00Z,You have to put vwray.dll in two directories Rhino and ASGvis
,lonegro69,2008-12-08T21:32Z,"just load deafult materials.
doesn´t work"
,jeminnovations,2009-12-06T18:11Z,Can anyone help me find vray 1.5 for Cinema4D can`t find it anywhere? Also looking for Evermotion archinteriors in a format that C4D can work with. All i can find is Max Files. Any help someone can give me will be greatly appreciated. Thanks so much 
,sertam,2010-01-02T00:59Z,HELLO !! where are thoose two directories in WINDOWS 7 ?? (to copy the *.dll in) PLEASE HELP :-) 
,crzy4bmw,2011-02-15T16:48Z,When I search vray.dll on my computer it only comes up in one location. And when I search ASGvis it does not come up at all. Where is the folder?
,uhanam,2011-12-16T15:39Z,"Didn't work for me. When I try to load the plugin in Rhino it says: ""Unable to load VRayForRhino.rhp plug-in: Dependent DLL is out of date"""
,yesterdays_pirate,2012-04-25T03:51Z,I don't understand why you guys are having trouble installing this. Is EASY and it WORKS. Just run the .exe and replace the dll file with the one in the crack. 
,mk318,2012-08-29T03:32Z,"Hi! I have windows7 64bit. vray got installed on it, but some features such as 'get view aspect' didn't get installed. does any1 else have a similar problem? is there a solution for this? Thanks!"
