User Type,Username,Date,Text
,rpok,2006-01-05T11:40Z,English??? 
,charles1870,2006-01-23T00:27Z,"no french
!"
,Liero,2006-02-02T07:57Z,if this is not english then can u give me site to any then ?
,mantere,2006-02-16T22:35Z,"Shittttt!!!! whata bad game man!!! cant play it!!!!!
cant you do games that people can play???"
,Gangztaa_,2007-04-01T22:14Z,Hoppas att den funkar iallafall.
,Lord Voldemort (Tom),2007-06-08T19:35Z,how do i creat an account at www.bitcomet.com ????????????????
,felipel0,2012-01-02T23:39Z,"Stop talking crap guys.

Subs and write is spanish. Sound is english.

if you can't figure out what the options are just google translate it.

The game is awsome, thanks."
,puchtomos,2012-08-31T16:57Z,"Its in french, but why is then multi3? I cant find english language!!!!"
