User Type,Username,Date,Text
,jiehaa,2008-01-19T12:33Z,is this for symbian phones???  (tomtom mobile)
,poolcze,2008-01-19T14:06Z,"only Tomtom One xx, Go xx  firm.ver. 7.xxx"
,poolcze,2008-01-19T14:10Z,"crack map -  "" Easyusetools_for Keygen and Mapcheck"" or ""tt7_patch"" "
,stykerdk,2008-01-23T21:29Z,"which name shall the map directory have
"
,Wilhelmus,2008-01-27T18:53Z,"Central_and_Eastern_Europe ,
just a wild guess ..."
,Pipo_de_Clown,2008-07-10T11:08Z,When generating an activation code or unlock-code or meta file: ALWAYS LEAVE THE SPACE OUT of your unique device-ID 
,martinmz,2011-10-02T10:39Z,"Hello do I need activate code for this map? 
Or how can I make it run on my TT one (30 series)
If yes please could someone write it, my device code is AKSHG ASC5J
Thank you very much"
