User Type,Username,Date,Text
,the.pirate,2006-12-04T23:09Z,"jag kan riktig magi faktist de er inte på skoj jag kan trolla jag lovar jag bor en litten hudda ut mot skogen av södermanland jag utövar naturiska konster och lever i harmoni vill ni veta mer om magi och troll konster skriv till mig på allankatz_@hotmail.com

OBS: jag utövar ej svartmagi konst."
,the.pirate,2006-12-04T23:12Z,"tuvär har vi ju förlorat en till person på dena grymma och våldsamma värld ernst en man som gillade att snickra gå barfota och säga det här tänder jag på vart brutalt nerbankad av hans egna konstruktion som föll pladask på hans kranium vilket ledde att han fick alvarliga hjärnskador och fick åka raskt upp till akuten men det var försent.
ska vi låta barnen leva io en sådan fruktansvärd  "
,the.pirate,2006-12-04T23:12Z,"värld? det måste vi ta och ändra på inte ska nån få ha det så grymmt i detta livs gåvas jaa.

OBS: jag kan riktig magi faktist de er inte på skoj jag kan trolla jag lovar jag bor en litten hudda ut mot skogen av södermanland jag utövar naturiska konster och lever i harmoni vill ni veta mer om magi och troll konster skriv till mig på allankatz_@hotmail.com

OBS: jag utövar ej svartmagi konst."
,rasmusnorin,2006-12-13T16:57Z,"den är så himla bra.. roligt gjord också.. amatörmässig video men härlig rap.. den får 4,2/5 av mig :)"
