User Type,Username,Date,Text
,affekopp,2006-12-21T10:35Z,"Thank, thanks, thanks again."
,majtymicke,2006-12-21T19:14Z,Great uploads! Are there any link where I can see more info on these cds? I´vee Googled but only found your torrents.
,majtymicke,2006-12-21T19:22Z,"I was going to get all the volumes right now but the search function is down, cant find anything at all no matter what I search for. Only able to find this since it was under ""New torrents""

Oh well, It will be back later on so Im gonna go for it then. Thank you, thank you very much ;-)  (Someone had to write it, hehe)"
,gammelmupp,2006-12-30T23:06Z,"Thanks, very good job!"
,andersonjr90,2008-06-17T19:56Z,"my downloud is going up to 90%, you can correct that!!!! thank you"
