User Type,Username,Date,Text
,zx24db,2006-03-05T10:04Z,Please seed this torrent
,zx24db,2006-03-05T10:06Z,Please seed this torrent !
,Felicienne,2008-04-11T00:15Z,"Bez nasiona piawki stoja glodne na 91.2%.
Prosimy usilnie "" Please seed, we want to finish our intake ! ""
Dziekujemy slicznie."
,Felicienne,2008-04-17T21:46Z,"Hi Celerion !
A week after. You had 11 leeches, 9 from Poland. You lost them all. If you don't know how to seed, just ask in here. Choice of Polish, French and English, take your pick."
