User Type,Username,Date,Text
,marieomorgan,2007-06-30T18:36Z,Kan du fixa den med Dildon Sven? .Tackar För denna!!
,1# Rokkan,2007-06-30T18:43Z,Joo visst kan jag de marieomorgan =) Det va så lite
,fredrik188,2007-07-02T09:07Z,fan va nice =)...mer sånt här vill vi se (A) bra jobbat(Y)
,tixyt,2007-07-12T17:41Z,"jag har fassnat på 74,8% seeda snälla någon"
,tixyt,2007-07-13T13:57Z,"snälla seeda har stannat på 74,8%"
,DJChief,2007-07-28T01:37Z,"vilket skit, ladda INTE ner :)"
,gabbe12345,2007-08-25T19:43Z,jag älskar bayramband och jag har dildon sven
,Ludvig97,2008-07-15T23:59Z,Paaaartyyyy
,564,2008-08-03T13:54Z,Varför funkar det inte att ladda ner?
