User Type,Username,Date,Text
[V],velvetfog,2004-10-22T03:17Z,http://www.imdb.com/title/tt0340855/
,vargpojke,2004-10-22T12:16Z,"well.. that's just great. har försökt få ned den här filmen i veckor nu, men alla slutar seeda innan jag är klar. snälla?!"
,Data-Danne,2004-10-22T19:57Z,"Allvarligt talat. Seeda. 
Det var någon som gjorde det för en timme sen, och det var härligt, men man skall alltså fortsätta tills någon annan kan göra det. För fan."
,crd,2004-10-24T00:19Z,Lite seedning hade ju inte skadat.
,d3ciph3r,2005-05-12T03:19Z,"Does anyone have a full copy, and is anyone seeding?"
,hobnob,2005-05-12T16:47Z,"ja, det är väl fan, fyra st fast på 97,9"
