User Type,Username,Date,Text
,K.NPeter,2004-10-07T19:38Z,"Det här är nånting för mig..
Riktigt skön rock!!!"
,daddycool,2004-10-07T19:39Z,Nice! Ingen som har några gamla band med avsnitt av radioprogrammet Rock Box också? :D
,evil_ed,2004-10-07T20:18Z,"Härligt, nu slipper man slita på vinylen.

De har ett häftigt omslag med en flying-V som ges dropp :D"
,eltojo,2006-07-06T20:48Z,"kan du seeda igen, tak?"
,knorrhane0,2006-09-10T20:01Z,"Har du ""disillusion"" oxå? Tror den stavas så. Jvlgt bra!!!!"
,EricB,2007-08-12T13:48Z,Can someone seed this one please?
,-MegatroN-,2007-10-09T15:10Z,"asså har Loudness gjort nån låt som heter ""Break the Chains"" eller typ sjunger nått i stil med ""come on lets break these chains"" iaf... letar en grupp som har gjort en låt som går så i början e det bara sång med nått i stil med "" We are the rippels, we are the fools, come on lets break the chains"" nått sånt sjunger han i början sen repeterar han det andra gången fasst med musik med... sen en annanlåt sjunger han om nån ""Dynamite""

dom e vell från 80talet nångång iaf...

hoppas nån har hört detta...
e så jävla desperat och vill ha denna grupp och alla deras låtar...
"
,rahlovely43,2007-10-18T20:01Z,"Please seed!!!!
A Blast from the Past. Saw them a couple of times live in the eighties. Akira was the best then. "
,leberse,2007-11-12T22:30Z,Ååååå... ingen som har Risky woman med Loudness. Den är ju så j**la grymt bra...
