User Type,Username,Date,Text
,ecsisbest,2007-05-08T17:14Z,Please seed. We have been stuck at 80% for days.
,qukez,2007-07-18T17:40Z,Seed.. We're all stuck at 82%
,aljinn99,2007-07-28T15:48Z,I am also stuck at 82.6%
,Discohydra,2007-12-08T03:09Z,"Uhhhmm...Whould you please seed, i've been checking the peer lists, they're barely even reaching 50KB/s. and im uploading the best i can. but im not sure i have the right pieces..."
,masta_p,2008-02-10T21:24Z,"Will someone seed this please? I'm stuck at 82%! 

Thanks,

Deako"
