User Type,Username,Date,Text
,marc87,2006-12-30T19:01Z,ARE YOU STUPID IS NOT FAKE
,marc87,2006-12-30T19:02Z,"NotYourGrandMaaa :2006-12-30 18:56 GMT: 
and the torrent come up 18:55:06
his a laijer"
,GaNjaMaaN,2006-12-30T19:17Z,Nothing New!!!
,chickaboomboom,2006-12-30T19:21Z,This is the video of just having the rope around his neck.  You can watch this same one at cnn.com without downloading it.
,millie1072,2006-12-30T19:27Z,they should hang the fucker who put this on here
[V],vire90,2006-12-30T19:31Z,we want to see all...
,Thomseh,2006-12-30T19:53Z,This is the video of just having the rope around his neck. You can watch this same one at cnn.com without downloading it.
,Alex x,2006-12-31T01:08Z,http://pandachute.com/videos/leaked_saddam_being_hung_video
,beemerlad,2006-12-31T05:58Z,"Well i for what its worth think what he got was to good for him , i men do you think he thought twice bout the way he abused women and children? Did he fuck,thats why i am looking foward to watching the evil & twisted dictator get what he deserved. I a right up for watching a bit of sadams sorry asse swinging in the breeze on a new years eve. I will add tho in my eyes a certain Mr G Bush & Mr T Blair are no betterto some degree but at least a positive start has been made to start 2007 off in the knowledge that Mr Hussien the dictator, the coward, and the playground bully can't and will not be able to fulfill any more of his hanous cries against humanity. Feel free to throw whatever abuse you want to in my direction but to be frank after yesterdays good news i really don't give a fuck."
