User Type,Username,Date,Text
,zploek,2008-01-22T22:29Z,"I made this torrent because there was no good sized original english version, only spanish dubbed ones and ridiculously large others.
I was pissed, what can I say?
Oh, and morons who get stuck at 99.1 procent, because of the effING .NFO FILE .... deserve all the wasted time they wasted ...."
,zploek,2008-03-09T16:47Z,"Wait, 10 seeders, 5 leechers and only one comment? What does a girl have to do to get a bit of attention around here?"
,17POP,2008-05-01T07:20Z,Hello Thanxs for the upload i watch this movie like a year ago and couldn't find it anywhere so thanxs!!!!
,dreamergirl88,2008-06-17T22:21Z,"My god, this cant be true... i watched this movie, long ago, and literally changed my life, i remember the rush!... of feeling, alive, i want to share this!! thanks 4 uploading. god bless you =)"
,emsef,2008-07-02T20:42Z,Thanks for this
,zploek,2008-07-11T04:08Z,"dreamergirl, yer most welcome ! :)

Blame it on Sarah P. She rocks my world so much!!
"
,PGonzalo,2009-07-26T17:14Z,Thanks for sharing. This is a great movie!
,spoilbrat,2012-06-30T01:43Z,can someone plz increase their upload speed.....
