User Type,Username,Date,Text
,backinblack,2006-12-10T19:02Z,this torrent sucks. wheres the one with the realistic engine and tab database??
,hkyu,2006-12-18T09:52Z,Nice and very useful
,electroacoustic,2007-08-10T10:49Z,"backinblack, RSE is included in this one:
http://thepiratebay.org/tor/3768546/Guitar_Pro_5.2_with_RSE"
,mas111,2010-03-25T15:52Z,it doesn't suck. it's very useful! thanks!
,ANDiTKO,2010-12-13T15:26Z,"Thank you very Much! The RSE sucks. No need for virtual crap instuments when you have a real guitar. I just needed the program to open tabs and export to midi. This is very useful. Thank you.

Btw. I dont like the new Guitar pro 6. So i will be using this one."
