User Type,Username,Date,Text
,stemimannen,2006-01-29T21:52Z,"how do i unzipp the small ""rar and r"" files?
All i get is a large ""rar"" file that can not be opened.
Hur öppnas filerna så jag får en iso-fil?"
,gustav_soeder,2007-04-05T14:10Z,"Please seed, am stuck on 96,8%, have been there for about a week. Will keep reseeding after I´m done. But keep seeding please."
,hogrod,2009-01-03T22:51Z,"Please Seed, everyone is stuck at 63.4%"
,film101,2009-04-17T19:07Z,"Hey what up Scirocco53:

Would it be possible to reseed this file please?
Thanks in advance."
