User Type,Username,Date,Text
,tmontana100,2007-07-04T09:02Z,"i will seed this as long as i can, hope you enjoy"
,tmontana100,2007-07-13T08:13Z,"also forgot to  say that when you 1st insert the dvd to play, the screen will be read for a few seconds and then the dvd starts, sorry about this but this is my 1st time to upload :)"
,garence,2008-11-14T04:30Z,please sum1 seed theres 5 of us all on 99.6%  its pretty tight.
,gthyuj,2009-04-26T11:18Z,seed seed seed seed 
,CelticPat1888,2009-06-10T02:15Z,"STUCK ON 99.6% please seed, i will seed for as long as possible once it's downloaded. thanks:D"
,CelticPat1888,2009-07-02T14:04Z,So is nobody gonna seed this?!
,stephenheathen83,2010-01-13T04:34Z,"Hi, could someone seed please? Been looking for this for ages!"
,stephenheathen83,2010-01-22T15:37Z,"Hi, could someone seed this again please."
