User Type,Username,Date,Text
,tuzz01,2007-10-23T22:35Z,"This is Wonderful!
I want more :)"
,Zwoozer,2008-02-28T16:08Z,omg seed please. i have 0.3kb/sec...
,dadlarofikon,2008-02-28T22:34Z,awsome thanks 
,anasarcomera,2008-07-16T06:45Z,"what did use to convert them?
GREAT Job btw"
,gigo556,2008-08-01T21:36Z,"yay, this works on PSP"
,TorrentSAMU,2008-08-31T10:33Z,does this work to mp4
,SeanFalloy,2008-09-14T06:16Z,nice work. good quality. standard mp4 format. 
,bertnum,2008-09-18T19:10Z,"Wow, this goes pretty fast, like 2 h maximum for me :D I will use it or my ipod touch"
