User Type,Username,Date,Text
,daddyo57,2006-11-28T23:31Z,"This one looks to be a real hoot!  LOL!!
And thanks for the ""no pop-up"" preview. :-)"
,3d recon,2006-11-30T13:23Z,ye man i cant wait to get my orgasm over this lol
,3d recon,2006-12-01T10:54Z,shame its not in english kinda takes the excitment out of it.. foreigners do anything like russians an shit...they fuk each other like a hobby
,laponist,2006-12-01T12:45Z,cant get uglier...damnnnnnn
,dixiebullfrog,2007-06-04T00:30Z,"Good News: the teen is hot, big boobs, and very energetic. Don't know how much they paid her, but she is worth every penny. Grandpa has obviously OD'ed on Viagra as he pretty much keeps it up the entire time. To help him maintain his woody, she eats and licks his asshole like a pro.
Bad News: Grandpa almost dies when she sits on his face as her big butt blocks off the air to his nose and mouth. The fake ejaculation goes back to the 70's as she dribbles out a mouth full of cooking oil.
From ""teens-love-oldmen.com"" --- something for all age groups, I guess."
