User Type,Username,Date,Text
,shmoo,2006-08-14T16:33Z,"Can anyone seed this file? ty 
Shmoo"
,Zurr0,2007-04-06T22:00Z,"I seem to be the only seeder as of April 06,2007
and when I dled this torrent I never got 100% so I'm not gonna seed this for much longer, there's no point. I have 5 of the 8 songs and it's 99.0% done like forever now....so whoever originally seeded this is a dick."
,hotti,2007-05-01T18:32Z,Someone please seed this.
,laca77,2010-05-20T18:48Z,[url=http://thepiratebay.org/torrent/5572602/Shiva_Chandra-Change_of_air]shiva chandra[/url]
