User Type,Username,Date,Text
,The Jellyfish,2006-02-08T00:05Z,SUPER!!!!! TACK!! =) Lägg gärna upp mer.
,Rickard112,2006-02-08T00:19Z,Va så lite så.. jopp det kan jag ta och göra i morrgon bitti.. så kommer det lite fler.
,Mr.Greta,2006-02-08T00:45Z,"Nice, addar du mig på msn Richard?"
,Mr.Greta,2006-02-08T00:46Z,Seedar här jag också :)
,Sooderstroom,2006-02-08T18:20Z,Tack Tack Tack Tack :)
,Bkitty,2006-03-07T22:33Z,åå snälla seeda!
,fjordor6,2007-04-28T01:46Z,Har någon lusta att slänga upp den här igen ?
,r0mario,2007-06-17T15:29Z,"kan någon lägga upp avsnittet, helst hela säsongen också :)"
