User Type,Username,Date,Text
,uggenabben,2005-05-22T00:01Z,Hm... trist... inte en enda kommentar... Tack!!!
,joxi71,2005-06-05T07:55Z,"Är det nån som kan seeda fastnat på 81%???????
Är den bra?"
,metodmannen,2005-06-08T01:24Z,Boken e jävligt bra!
,gubbgalen,2006-07-29T15:59Z,"0,9%...Ingen som seedar??
snyft..."
,DavidGGG,2007-05-06T20:56Z,Den här fick pris som årets bästa kriminalroman 2003: http://sv.wikipedia.org/wiki/Svenska_Deckarakademin
,KarlOlofRagnar,2007-06-10T14:28Z,snälla seeda. Jättebra bok.
,zipup,2008-09-05T12:10Z,"Tja.. jag har fått ner den.. Hoppas den är bättre en den innan. ""Mellan sommarens.... osv osv"" -Men jag har ett problem! 
När jag flyttar över den (och vissa andra talböcker jag laddar hem) till mobilen..  så är det lögn i h-ete att få de att spelas i ordning..  jag har provat namn andrat, flyttat runt på minneskortet osv.. men inget hjälper..  Har div nya Sonyericsson..  -Tips mottages tacksamt  email: talbok@email.nu"
