User Type,Username,Date,Text
,BILLABONGGG,2007-10-21T20:30Z,Nickelback iza coksuker
,sam_1421,2007-11-03T17:37Z,Respect the other's tastes ...
,saucon,2007-11-12T05:20Z,"Great fkn song and film clip... d/l now hope this is good quality like it says it is!

Thx dude.... will be back to tell u what I think of your great upload."
,piratedodge,2007-11-19T02:01Z,It skips a little at 1:56 :(
,Yottab,2008-09-14T04:24Z,"Skips at 1.56 because this is 'Clean version' so 'ass' in the sentence 'dress my ass in the latest fashion' is too dirty for the FCC.

Censorship makes me a sad panda :,("
,puttepotter,2008-09-15T18:23Z,Fuck FCC.... americans are strange....
