User Type,Username,Date,Text
,raiden23,2006-09-21T06:37Z,"Awesome upload, thanks!  Someone should upload Grants run on Doom Patrol - my favorite series ever (im missing the last 10 issues or so).  Anyway - u rawk."
,raiden23,2006-09-21T08:57Z,O i see now - You already uploaded it!!  THX:)
,lamuella,2008-08-13T01:04Z,there's about five things here I've been looking for for ages.  Many thanks!
,cenotaphium,2010-02-02T20:15Z,Here's hoping it still has some life in it after 5 years..
,zibzow,2010-12-22T03:26Z,Nice torrent Algrid.
,vas_burda,2012-03-12T18:20Z,Does anyone know where I can find The Mystery Play? It's a graphic novel by Morrison.
