User Type,Username,Date,Text
,OrionStar,2006-07-11T05:48Z,Works great ~ Thank you Skurtsy!!
,splintaz,2006-07-18T23:56Z,"something wrong with the crack. and the program's way annoying, it's like a macro maker for people who don't know how to use computers. "
,ManassasRalph,2006-07-27T15:58Z,"Sorry, I am slow.

How do you use/apply the crack?"
,madwex,2006-11-10T16:15Z,seed please
,gandson,2006-12-15T22:49Z,is it possible to make an tibia cavebot with this program? i really hope so :D
,hird_,2007-07-04T10:50Z,please seed=)
,danny876,2009-01-20T21:41Z,How do you use the crack? Doesn't seem to work. I need to register to creat a mouse macro i think. Please help
