User Type,Username,Date,Text
,ecliptica3,2007-08-20T22:09Z,http://www.imdb.com/title/tt0093966/
,Almarenan,2007-08-20T22:16Z,http://www.imdb.com/title/tt0093966/
,Xuxaki,2007-10-13T22:57Z,is this the directors cut?
,gerent,2009-05-08T07:07Z,Thank you for this. I haven't seen this since I was a kid. It's just one of those films movie shops don't carry any more.
,nmkostic,2009-11-09T16:09Z,"Aspect ratio: 4:3 and it doesn't need to be... :( There is an edited version, that has this fixed..."
