User Type,Username,Date,Text
,puzomatc,2006-10-22T17:48Z,Lots of seeds and quality songs.  Good job and thanks!
,boss in 408,2007-04-13T07:35Z,hey how can i upload it
,DocJOnes200,2007-04-14T11:36Z,"Such a pleasure with all the seeders.. Wish it was this way all the time.. 
Cool med. from the Doc"
,dclau,2008-07-26T13:46Z,"Wonderful material, but seed this, please."
,yardbirds,2009-05-27T09:06Z,"i'm stuck at 99.7% with just 256 kb left;
someone please seed this;
help to keep this alive"
