User Type,Username,Date,Text
,hagglof,2006-04-10T22:01Z,"Vad är det fråga om? Filen är 364.43 MB. Azureus har laddat ner 364,7 och ändå är det 99,8%?"
,hagglof,2006-04-10T22:04Z,"Nu ordnade det sig. Stort tack för detta mästerverk i en form för rörlig ""läsning""."
,BuckRogers,2006-04-24T12:04Z,Snälla seeda! Har fastnat på 98.7%! Please!
,xarvidx,2006-05-27T17:35Z,seeda nån?
,mgeie02,2006-05-30T22:20Z,"how about some leeching and some more seeding? tired of 99,8 %... but thanks Kladdeman"
,Monkeymadness,2006-07-11T01:07Z,"Det vore nice om du pallade att seeda, bra initiativ"
[V],bjovel,2006-11-23T21:37Z,Kan ingen seeda denna??
,Hoglinowie,2007-01-11T18:54Z,"Synd att ingen seedar för jag hade gärna laddat ner och lyssnat.

Så nära men ändå så långt borta."
,myulk666,2007-08-31T16:29Z,"Snälla seeda. Hade precis fått hem denna och börjat lyssna när Windows krascha, och allt på hårddisk C försvann. Måste får se (höra) hur det går. Kommer seeda i minst ett halvår om jag får hem denna."
