User Type,Username,Date,Text
,jazzzbear,2007-05-31T05:42Z,"Tackar! Har du fler Loe, de är jättesvåra att få tag i som ""pappersböcker""!"
,kyger,2007-05-31T15:04Z,"Instämmer jazzbjörnen. Och då hemskt gärna ""naiv super"". Ändock, tack för upl, artandsoul!"
,artandsoul,2007-05-31T21:41Z,"tackar! jag hade en till som nu finns på

http://thepiratebay.org/tor/3702128

snubblar jag över nån mer så lägger jag upp det."
,zoozi,2007-06-01T13:01Z,Låter kul. Tackar! :-)
,illeP,2009-03-17T19:37Z,Kan någon vara en väldigt vänlig själ och seeda på denna?
