User Type,Username,Date,Text
,Staple,2006-09-10T11:21Z,"Verkar fett, tack så mycket."
,benfrede,2007-01-20T19:31Z,Og hvorfor kan jeg så ik lige decode denne torrent???? shit
,commited,2007-04-12T00:22Z,Nationalskat! Tak fra Østdanmark!
,PowerAmp,2008-12-12T06:45Z,fedt album. men tager en krig at downloade!
,Netnajs,2009-03-18T15:33Z,"PowerAmp: Det er en fantastisc torrent som jeg seeder selvom min forbindelse er 255 kb upload, fordi at det her ikke må gå i glemmebogen :O Hvis du ikke er tilfreds med download tiden på torrenten, så hjælp med at seede den =)"
