User Type,Username,Date,Text
,cartmanx,2004-11-19T20:03Z,Är det svensk text?
,fgher,2004-11-20T13:40Z,Lite mera information kanske? En länk till imdb?
,fgher,2004-11-20T13:43Z,Den här? http://www.imdb.com/title/tt0377432/
,fgher,2004-11-20T13:44Z,"""Nihilistic film, poor acting.."""
,cartmanx,2004-11-22T21:23Z,Kan någon lägga upp svensk text till denna.
,sexpistols,2006-05-26T01:31Z,"Attention Svenskar & Finnar, för att få stopp på Danskockupanterna och som ett led i kampen för att återfå den Danskockuperade delen (sk norge) av Sverige, ta alltid bort norsk & Dansk sub innan ni seedar...."
