User Type,Username,Date,Text
,horvnandi,2006-11-09T08:54Z,is this project gotham racing 1 or 2 or 3?
,Andreasvb,2006-11-09T10:35Z,"Does it say 2 or 3? PGR3 is only for Xbox 360.
It's PGR1, I made the torrent ;)"
,*namaste*,2006-11-10T22:35Z,"been looking for this for a while now, thx for the up. :)"
,Izzy,2006-11-12T01:54Z,No problem. Have had hard time finding this game myself actually...
,Chaaap,2006-11-13T19:52Z,"Plz! Could someone seed Knockout to xbox, im stuck att 99,9 and everyone of you know how much that sucks! :)

Please!"
,jimmiejimmiejimmie,2006-11-14T22:09Z,seed please :( downloading in 7kb :(
,rzangel,2008-03-10T16:10Z,"i burn this on dvd i copy to the hdd of my xbox and its still not working.i also tru it whith pal and nts
can anyone tell me how to get it work (i have a moded xbox"
