User Type,Username,Date,Text
,QuAnTifY,2004-12-26T13:36Z,Dette Må jeg lære meg :)
,Hmmkk,2004-12-26T14:45Z,"Jo, nog blir man inspirerad och nyfiken allt=) Han är verkligen otroligt begåvad. Finns ingen utom de, som säger sig kunna tala med döda som gör liknande saker/trick i tv. Så han är ju över det vanliga."
,Hubako,2004-12-27T15:54Z,"visst är han begåvad med sitt fotografiska minne, jag är väldigt fashinerad av vad han kan, men jag tror man själv kan lära sig en hel del trick... jag rekomenderar även folk som gilla filmen att ladda ner mind control"
,Hmmkk,2004-12-27T17:57Z,"Mjo, tycker det jag med. Jo, det e klart att det går att lära sig, han var nog inte född med alla sina talanger/förmågor. Att lära sig det där med korten, att komma ihåg vilka ""dealern"" har delat ut osv, det går ju att lära sig. Att lära sig känna folk, och att se vad de tänker på i princip, eller få dem att tänka på något, är ganska lätt det med, men det krävs ju några års övning på folk förmodligen, hur han nu har lyckats med det? Han kan väl inte gått runt på gatorna och misslyckats i åratal tills han lärt sig det ordentligt? Har han läst några böcker för att lära sig det han kan? Det är frågor jag skulle vilja ha reda på."
,scream_h,2005-01-11T05:15Z,Någon som har text till denna?
,Alzmeister,2006-10-25T15:44Z,Can someone seed please?/ Kan någon vara snäll och seeda? Tack.
,jugo_runner666,2006-12-12T03:40Z,han er en legende!!!
,jugo_runner666,2006-12-12T03:43Z,SEED PLS!!!!
,dosan_smile@hotmail.com,2007-09-08T13:56Z,"I recognize techniques that Mr. Brown are using from the field of NLP.  Swedish NLP-article on
http://sv.wikipedia.org/wiki/NLP. And I recon that it would take some years to aquire his skills, but it sure is doable. Good luck ;)"
