User Type,Username,Date,Text
,ripper_gonzales,2006-06-11T22:36Z,arnold1965: you forgot to mention that you'll have to pay money at your posted website. PB is free and that's worth a lot more than your piss site. Why don't you just crawl up your own rectum and disappear.
,pale face,2006-06-11T23:07Z,"Re: spam you: It would be nice to have that software to get rid of some of these clowns, but again where would we be without ASSHOLES:)"
,XTZGZoReX,2006-12-14T20:04Z,I don't get it... What has this guy done?
,drfunk1o1,2007-01-21T04:07Z,"You relize NO ONE is going to suscribe to your site.

So I'll give you some cool points if you just give me the license.

Please dude, I need this for college. I totally do not have the 300 to get a 1 year license for it.

Spread the love."
,The Crow_666,2007-02-12T18:00Z,"gah :< 


i dont get how u crack it -.-´ the readme is really confusing.. i relly need it >< :( could some1 write a tutorial here? =) plzzzz?
i made it 2 step 4.. installed xsi.. then i dont understand anymore -.- help plz >< =)"
