User Type,Username,Date,Text
,anre5180,2006-08-16T20:43Z,I am trying to download to seed since i have 30/2 mbps connection so i can seed it but can't connect.
,devil201984,2006-08-16T21:15Z,sweet cheers raster  i also foud it at www.torrent-hackers.co.uk and i was getting 349Kb's
,atom1962,2006-08-17T00:54Z,just few questions..how do you burn 7.5 gig.?is the 360 modded?...been waiting to learn when 360 could be modded....thanks ..just tryin to learn
,dufusg,2006-08-17T03:34Z,"You use a dual-layer DVD to get 7.5 GB written.
Team Xecuter and others (http://www.team-xecuter.com/) have the DVD firmware mods that allow copied games to play."
,fanoxo,2006-08-28T20:19Z,"thanks/tackar, bra jobbat :=)"
,snacky,2006-09-01T19:12Z,thanks
,peranas,2006-10-01T11:06Z,do i have to flash any firmware?
,styret,2006-12-18T22:13Z,thanks
,filip_xb95,2007-01-24T14:10Z,"hi only one question.
is it only to burn this game and play
or do i need to do something with the xbox360?"
