User Type,Username,Date,Text
[V],markienne,2006-11-21T15:53Z,massa mera tack! :)
,e_xx,2006-11-21T16:42Z,Tack så mycket.
,Modesty46,2006-11-21T17:02Z,TACK FÖR ALLA BRA BÖCKER !!!!!!
[V],Benson,2006-11-23T18:15Z,"Tack för boken! Hoppas den går att få ner också stannade på 83,2% vänligen Benson"
,Bris01,2006-11-27T19:42Z,"Hej
Kan någon seeda fast på 83,2. 
Tack alla för fina uppladdningar"
,Zaak,2006-11-30T20:06Z,Denna bok går inte att få ner. Är inte komplett utlagd. Undrar vad det är för ide att lägga ut en bok som inte är komplett. Bokmalen=Bodström?
