User Type,Username,Date,Text
,skruven,2005-01-18T21:01Z,Ăr det ngn som har mer med Vanessa Chase?
,violentcop5,2007-01-17T02:48Z,someone donna seed this shit?
,trueblu8,2008-06-21T10:31Z,Damn it.  I want this.
,trueblu8,2008-06-25T17:07Z,Please seed.
,skyninja,2009-09-13T23:16Z,"somebody has got to seed this - Anna malle is so fucking nasty in this ,she rocks"
,coughcool72,2011-01-25T05:25Z,"c'mon seed please, the uploader has take the time and effort to originally seed, do the right thing and share with others. can't find this download in this quality anywhere else, please seed!!!"
,coughcool72,2011-01-26T17:40Z,"SEED CUNTS, STUCK AT 9.7%"
,pirateYoho,2011-04-11T20:11Z,i wrote a message to the uploader but he hasnt posted since 2005!! guys i am trying to find another copy i will post it here.. pls if you find a better copy please let us know!  27 people waiting !
