User Type,Username,Date,Text
,kristoffer3x,2006-12-31T14:27Z,dette er bare subtitles ikke film
[V],Jag92,2006-12-31T14:36Z,KONGE! Tusen takk :) hvilken versjon passer den til?
,kristoffer3x,2006-12-31T14:37Z,det husker jeg ikke den passer vel til alle tror jeg
[V],Jag92,2007-01-02T10:43Z,"hvis dette er BEEF sin oversetting, s책 er den utrolig d책rlig""!"""
,_- shcmeck - _,2007-01-17T19:21Z,er det bra teksta eller?
,kristoffer3x,2007-01-22T00:07Z,ja.. :)
,suprasupra,2007-02-04T12:49Z,hvordan legger jeg senne til filmen?
,suprasupra,2007-02-04T12:49Z,denne*
