User Type,Username,Date,Text
,Star1,2006-01-23T21:21Z,Vart ska jag l채gga PSIKey.dll? Filen som ligger i Crack mappen?
,lothar_zzz,2006-09-29T21:36Z,how do I install this program. I cannot open this file
,avengedliam,2007-06-24T02:43Z,What is the serial so i can use this damn software????
,m1lkm4n,2007-08-16T16:51Z,"No serial needed, install as test-version. 
After first start close the program and copy the PSIkey.dll from the Crack folder into the Progam folder of Corel Designer 12. The nag-screen goes away then."
