User Type,Username,Date,Text
[T],mm3_hellraiser,2007-11-07T03:53Z,"Please Seed everybody! 

I will seed for as long as possible; but I can't seed Forever! 
"
,90daystogo,2007-11-26T01:36Z,yea...hellraiser up....whats this I guess I will google it.
,90daystogo,2007-11-26T01:39Z,oh..cool good one hellraiser
,Dyno_Might,2008-01-21T21:33Z,Its a trial version most of the applications are shaded 
,GROWEED,2008-11-15T08:56Z,Can some one post a generated key? I run Linux and im using Crossover Office Pro to run Dreamweaver MX but I can't get the keyget to run with emulation. I would really appreciate the help :-)
,doublefudge,2009-03-10T23:03Z,Have you tried using WineHQ or is that what you're using now?
