User Type,Username,Date,Text
,davidwa,2007-10-21T20:57Z,do u need a crack for this or is it already done?
,davidwa,2007-10-22T11:30Z,you need to crack this for it 2 work and i got it to work on my pc and laptop works fine
,davidwa,2007-10-22T11:30Z,ps. just download the crack below this torrent  it works fine
,Anton_norton,2007-11-09T16:47Z,"""Format: .iso"" it says, but its in .mdf

kinda different for mac-users...."
,wiskeyinthejar,2008-02-01T18:52Z,Please seed..! Thanks :)
,MaceMan,2008-09-14T10:16Z,"Anyone care to give a quick instruction how 
to install and get going with this one =)
Please"
