User Type,Username,Date,Text
,Giga-Nova,2006-08-01T17:49Z,"Pardon, mais pourquoi avoir marqué 02/08/06 alors ques nous sommes le 01/08/06 ?

Ensuite un trailer de 800 mo je n'en ait jamais vu, tu pourrais au moin mettre plus d'info si évidement ce n'est pas un fake.

--------------------------------------------------

For English users [Translation]

Sorry but why have you written a future date
Can you give me (us) more infomation about your file.

Best Regards ;) 
Giga-Nova"
,RAWER,2006-08-02T22:15Z,please write in english so mutch u can not everybody can speak freanch and i´m bad in english..:S
,RAWER,2006-08-02T22:15Z,but i understand it more.. please..!!!
,tuppen2000,2006-08-04T20:21Z,How about Frensh people and the Soap...I heard the the best place to hide money is under the Soap...
