User Type,Username,Date,Text
,NurEinTier,2007-10-19T22:14Z,"Wtf, this thing is still alive.
For a public tracker not bad."
,sonicalchemy,2007-12-15T14:36Z,"Shure thing NurEinTieryou are welcome and I can upload you the .srt files if you'd like but first I'd like to ask you a question in how to perform this operation I am very curious to learn how to do this, take care sonicalchemy"
,christian1200,2008-01-22T14:52Z,"@nureintier ... kannst du vielleicht... bei ""In den Tag hinein"" helfen?"
,johnnytheboy,2010-11-09T19:35Z,thanx dude
