User Type,Username,Date,Text
,jessikabites,2007-07-23T17:59Z,"Great torrent Elq !!
Would be more than happy if you could Reseed IT BITES-LIVE
Been lookin for it for a decade !!"
[T],Elq,2007-07-25T13:07Z,"jessikabites, 
a new It Bites torrent is up
http://thepiratebay.org/tor/3752353/It_Bites_-_Live"
,t30j,2008-10-08T20:01Z,st채ng ner om ingen seedar!
,goodman08,2009-04-17T04:00Z,"I have downloaded this video 3 times, and It's all ended on 99.7% ?  why"
,goodman08,2009-04-17T23:41Z,"4 times I have try to downloaded, but stops on 99.7%........."
,banbon,2009-08-18T16:52Z,"Same problem, stuck at 99,7%."
