User Type,Username,Date,Text
,Rockman,2006-04-03T19:47Z,"Lysande ""sabbe"" ser verkligen fram emot denna. Om du skulle lägga upp en uppdelad version med förbättrat ljud (som du själv nämner) skulle jag vara den första att jubla i glädjetårar :) Tack så väldigt mycket för denna så länge..."
,0.5mbit sabbe,2006-04-03T21:56Z,"Den kommer, men har några andra projekt före i listan!"
,swed70,2006-04-07T18:43Z,"Tack
Väntar med glädje på förbättringen.."
,svantisch,2006-04-19T21:36Z,"Den här versionen av ""Hon gör mej galen""+försnacket är läskigt bra!"
,InSilenzi,2006-12-02T05:37Z,Grymt grymt! Tackas för uploaden... seddar nåra dar efter nedtankning... Konfunderad över att Amiralen ännu lever... Nåja.. Thx iaf!! 
,Happyjohan,2007-01-08T18:10Z,Snälla ni kan väl seeda! Det här var ju en grym konsert men jag får inte hem mer än 78%. 
,Rebali007,2012-08-22T08:02Z,Seed pleaze / Seeda snälla
