User Type,Username,Date,Text
,massaker,2005-05-19T20:25Z,thx för att någon äntligen har lite känlsa för kvalitet! jag menar vem kan leva med sig själv å lyssna på sämre än 192kb/s
,ThaBanan,2006-02-14T14:16Z,"i do not have 1 kb/s, i don't think you got it up in 193 kb/s"
,Gringoburrito,2008-06-15T22:27Z,good quality but has some blatant interruptions and errors on a couple songs.
,yulatheterror,2008-06-29T04:35Z,thanks
,alen12,2009-06-12T14:39Z,thanks its good.but i have a 1 kb/s i have no time
