User Type,Username,Date,Text
,davva2,2004-10-02T17:22Z,"tack så j*vla mycket!!!
men asså dom andra versionerna funkar ju inte...! 
men hoppas denna funkar!!! såna osm du ska det vara fler som...:P"
,davva2,2004-10-02T17:54Z,"du!!! vart är ceacken??
svara fort eller säg vilken cd-key det är!!"
,Troublemaker,2004-10-02T18:47Z,"Behövs inget, det är bara att tuta och köra :P Läs .nfo-filen ordentligt"
,davva2,2004-10-02T22:47Z,"har redan gjort... men asså vilken av dom är cracken då?? den med den grejen som kommer upp elle??
och vart gör jag av den??? snälla svara!!"
,davva2,2004-10-02T22:56Z,asså den vill ha en cd-key...:P
,Troublemaker,2004-10-03T11:15Z,"det ligger en ""virtualdj.exe"" i RAR-filerna;

pdxad109.001
pdxad109.002
pdxad109.003

packa upp dem manuellt så får du se en kat. som heter ""Crack"" :P"
,davva2,2004-10-08T15:46Z,"tack så mycket... ska göra några mixar nu... lägger in dom på the pirate bay sen, så ni kan lyssna på dom...:P men tack för hjälpen...:D"
,PsighT,2005-02-21T21:16Z,Finns ju inget Crack eller Serial :S
,bansaij,2005-04-23T21:13Z,seed! or I will become a arg hest!!!
