User Type,Username,Date,Text
,whitekid77,2007-10-25T12:16Z,"Ok this may sound a bit stupid, but why do you have to add it to the registry? I downloaded world in conflict a while ago and i didnt bother with the reg setup, yet it plays fine and saves games etc..."
,J_Hook,2007-11-04T14:32Z,"Dopeman! You FUCKING rule, couldn't get it to work till i DLed this!

Kick-ass!"
,Groffse,2007-11-24T12:28Z,Thank you. Now it really works:P
,konanino,2007-12-02T17:55Z,"it doesn't work at all ... the reg setup doesnt start....

please help....l"
,Chapelier_Fou,2008-05-21T04:31Z,"This is awesome, ILY
thank you dopeman!"
,Skyfighter,2008-05-26T13:14Z,Lol someone seed this a little please ! :D ?
,Skyfighter,2008-05-26T13:27Z,Please seed this bastard for a little while !
,slicer485,2009-06-23T17:36Z,seed please its been 0.0% for last 10 minutes
,slicer485,2009-06-24T00:06Z,damn it finally worked....and it took me 5 hours to dl this file... LOL
