User Type,Username,Date,Text
,akita81,2007-10-06T19:17Z,"Tack Crumbs!

Men är det någon som seedar?"
,feldgrau,2007-10-07T00:18Z,akita81/ Du vet att det här är hemmamatchen va? Så att du inte tror att det är dagens match du tankar...
,akita81,2007-10-07T10:20Z,feldgrau/Jag vet att det är den regnig hemma matchen:-) Det e en synd att missa Tobias Hysén som expertkomentator :cool:
,akita81,2007-10-08T13:30Z,Någon kan väl seeda för det går väldigt segt.
,akita81,2007-10-10T11:01Z,"17% har jag på denna nu,så snälla seeda lite mer.

Jag tar över seedningen om jag får hemma allt."
,akita81,2007-10-11T23:35Z,"Det börjar likna en dålig följetong:blush:

Men någon kan väl seeda lite mer?"
,akita81,2007-10-13T23:43Z,Behöver lite mer seedning på den här ligger på 84% nu.
