User Type,Username,Date,Text
[T],BESTinTEXAS,2007-12-21T06:06Z,Lol who 1'd this? *rolls eyes*
,SBC,2008-02-03T05:36Z,"This is the best show ever. Michael Ian Black, Michael Showalter, & David Wain are without a doubt the greatest human beings ever."
,squeek502,2008-02-15T11:35Z,Cheers. Amazing show.
[T],Aufseher,2008-03-31T06:41Z,"Glad to see this torrent still kicking, thanks a lot guys! BESTinTEXAS out. >:)"
,rip090,2008-11-23T08:11Z,Hi I was wondering if you could seed it please for a couple days. Thank you!
,jjones40,2010-05-20T19:16Z,Thank you. This is a great series!
,FreeTibet,2011-04-14T05:39Z,Thanks for the upload. This show fucking rules!
