User Type,Username,Date,Text
,framitz,2007-09-21T02:25Z,Nothing but more spam folks.
,marcusn,2007-09-21T03:00Z,"hello! my name is sammy,
i am 21 years old. i like sport and ""pets""
looking for guys to chat and exchange photos whith.if you are between 18-35
please email me at sammy732@gmail.com"
,pooper55,2007-09-21T16:32Z,"hello! what a coincidence, my is also tammy,
i am 21 years old. i like sport and pets
looking for guys to chat and exchange photos whith.if you are between 18-35
please email me at tammy732@gmail.com "
