User Type,Username,Date,Text
,dannyboy93,2006-08-25T22:39Z,"what kinda of game is it? Beat-em-up? RPG?
How do i play? i burned it on a cd, put it in my CHIPPED/MODDED PSX, but when the logo screen dissappears then it just turns black. Then it stays that way no matter how long i wait. Please help!"
,l33t1b,2006-09-06T13:30Z,wtf is a naruto
,dannyboy93,2006-09-19T20:31Z,"If you don't know what naruto is, you're officially a n00b. Stop trying to be an 1337 and accept your n00bness!!! LOL!!!!!"
,Mlec-zarz,2006-09-23T20:07Z,"Can u seed it plz i stopped on 97%
Plz seed it"
,xyndos,2006-10-30T15:44Z,What is it for a kind of game is it a rpg or what?
,Alawi92,2007-05-26T16:50Z,"aww no seeders
plz seed"
,Govadina,2008-03-26T10:01Z,"This is a turn-based STRATEGY, its almost imposible to play if you dont know Japanese."
,fallen-abgel991,2008-05-18T18:45Z,does it work on PC
