User Type,Username,Date,Text
,chanrika,2005-02-23T23:32Z,the speed shoud pick up now...
,chanrika,2005-02-23T23:35Z,"by the way, whoever messaged me please type it again in English.  For some reason I could not translate your message properly."
,SaraHRara,2005-04-03T16:42Z,"I have just 0.3% left. Can you seeda, please? :)"
,JDeluxe,2005-04-04T15:08Z,Can someone seed please?
,chanrika,2005-04-05T00:19Z,I'm reseeding now.... thanks J deluxe for letting me know
,dmitri2,2005-05-19T10:04Z,"Does anyone has the possibility to reseed this one?
Thanks a bunch!"
,MiraLira,2008-01-23T21:19Z,please seed:D
