User Type,Username,Date,Text
,ishka,2006-12-27T15:35Z,SEED!
,fodeeka,2007-01-11T14:22Z,is it the original dvd?because i think 1.35gb not really believable
,Blade66609,2008-04-12T09:16Z,"Yes, it is real, and a great upload.  Thanks a lot!

I was wondering if anyone had the english .srt file for this?  All the talking is in Finnish (Dutch?) and I'd love to know what he's saying.

RIP Sentenced!"
,n3v3rl4nd,2008-12-14T18:08Z,hehe... DVD9 original version at http://metal.iplay.ro/details.php?id=26079 :)
