User Type,Username,Date,Text
,danniq,2005-06-17T15:51Z,Free WoW server http://wownorway.no-ip.org
,Djordad,2005-07-09T21:22Z,No seedrs.. and what do i download here.. the game?
,vgman02,2005-07-14T04:44Z,do you have to pay monthly for this?
,SkyHigh2016,2005-08-17T20:08Z,yes this is the game and i have make it work whith a carcked surver ones but i recomet to bye this great game i did 
,Rabbit boy,2006-07-29T11:48Z,yes you pay on monthly fore play world of worcraft
,andrefrisk,2006-12-02T10:41Z,"you dont need  to pay, you can play on pr servers"
,Mff_killen_92,2007-07-03T23:46Z,"Is this the Game ? And do i have to pay to Pay it ? and can i crack a Wow-account..or is there any chanses to play World Of Warcraft for free ?
If U can answer any of this questions..add me :

webmaster.92@hotmail.com"
,Capmor,2008-08-24T04:06Z,"OK this seems way to complicated to actually be SIMPLE-----I'm downloading this private wow server and it's awesome! Copy/paste into C drive and play updated 2.4.3 realm for FREE!!!
http://thepiratebay.org/torrent/4354005 also here's the site http://wowzerker.com"
