User Type,Username,Date,Text
,vhc3,2006-11-13T00:53Z,Vet nån vad låten heter när dom går nere på vatten festivalen eller vad det är när calle har kommit ut från fängelset?
,Slatter,2006-12-17T23:11Z,"är inte det låten med två blåbär - vill inte  , som spelas då ? "
,crille12345,2007-01-24T17:52Z,hur gör man för att ladda ner? ...
,adde_hv71,2007-02-26T20:46Z,Fan denna film är den skönaste som skapats!!!!!!
,Nossie,2007-04-01T17:24Z,Tackar! :)
,joelengman,2007-04-02T16:35Z,Gillar denna film obeskrivligt mkt :)
,mugen110,2007-04-07T17:59Z,seeda
,ninjaidiot,2007-04-17T21:58Z,Seeda gärna :)
,glasbruk,2007-07-08T16:40Z,är det någon som har vackert väder från 1996 skulle vara kul om även den kom upp tycker jag
,Mikk__,2008-07-30T18:47Z,seddaa för fan
