User Type,Username,Date,Text
,purplepants35,2007-07-31T21:06Z,downloaded 33 times but no comments.  Does it work? Is it clean?
,saggeklumpen,2007-08-01T10:57Z,No virus. OK
,*EL GRINGO*,2007-08-01T11:29Z, avg says Potentially harmful program HackTool.crack
,valpen_audi,2007-08-02T14:03Z,"The crack doesn't work!!
Stop sharing fake cracks!!!"
,joonballoon,2007-08-09T20:26Z,i have a dvd that i recorded off a camcorder but doesn't play on my pc(windows xp)... any ideas on a player i can download to make it work??? please sum1 help!!!!
