User Type,Username,Date,Text
,dag0407,2008-02-02T10:50Z,thx O.K. game
,bambuzled,2008-11-06T23:24Z,hey when I go on its flashing white constantly I fittled with the settings and still nothing whats going on???
,dambo12,2009-04-12T16:19Z,please seed !!!
,smasudi,2009-09-10T14:23Z,plz seed seed seed
,le_machak,2010-09-24T14:20Z,"Tnx for the upload. Game works. 
Any idea why the cheats don't work?"
,chank2,2011-10-05T08:10Z,please seed.been stuck at 96% for a week.just need 27 mb more to complete download.will seed for a week after dwnld
,rhtverma,2011-11-27T14:06Z,"SEED SEED SEED SEED SEED SEED SEED SEED SEED SEED SEED SEED SEED SEED SEED SEED SEED.Hey,any1 readin this pls SEED.Hey Subzero! be agud pirate n seed "
