User Type,Username,Date,Text
,braet,2007-01-05T17:28Z,"You're fucked up Frank, but I guess you know that... 

There is nothing like drunk girls... Keep up the good work.

/braet"
,speakeasy,2007-01-05T19:28Z,"LOL!  What ^ said.
Keep it up!"
,leecher71,2007-01-09T13:40Z,Is this for real? Not staged party with some lowlife hooker and small dick morons?
,itBme,2007-01-13T03:45Z,I think it is from partyhardcore.com
,FatFuckFrank,2007-07-21T21:12Z,http://thepiratebay.org/user/FatFuckFrank
,ABCDDCBA,2007-12-30T14:23Z,Is this the girl from denmark?
,Ronny_J,2008-04-06T00:38Z,Who give's a fuck where she's from?
