User Type,Username,Date,Text
,riccogrosse,2007-11-15T20:15Z,Thanks...
,jim158,2007-11-24T20:22Z,Thank U.
,reverand,2007-11-26T19:20Z,thanks alot been looking forward to this one!!!
,vidiation,2007-12-09T13:31Z,"Nice rip - thanks for the upload.  Sadly, I just listened to it and I don't think it's a very good album.  IMHO other Queensryche fans will similarly disappointed.  I'll be deleting this one after seeding to 150% ratio."
[V],RR-NE,2009-07-24T06:45Z,"I love Queensryche Welcome To The Machine cover!! awesome guitar solo and vocal sound:)
drums and bass..in the beginning the Best!!:)"
