User Type,Username,Date,Text
[T],romefritz,2005-02-02T15:40Z,"Tack för detta goa album. Har du deras album Growing Up The Hard Way, om inte så kan jag lägga upp det.

Romefritz
"
,janwava,2005-02-02T20:53Z,"Nej inte på CD bara på LP,så det vore kul om du la upp det.."
,rhino94,2005-02-04T21:09Z,"Oj vad jag letat efter denna. Har den på kasett sedan gammalt. Många tack!
PS På andra sidan hade jag en grupp som hette ""Santers"" och skivan ""Racing time"", ingen som har den?"
,Davey Jones,2006-07-12T16:59Z,"I really wanna get my hands on this, but it semms to be behind a firewall or something....Help"
