User Type,Username,Date,Text
,friflyger,2007-12-04T19:47Z,"Herlig !! endelig en film med norsk, dansk teksting og UTEN svensk teksting. Begynner å bli drita lei torrents med kun svensk teksting...

Før jeg uttaler meg mer..Hva er CUSTOM SWE.SUB ?? Er det svensker som har tekstet filmene selv?? Eller har de bare latt vær å ta med andre skandinaviske språk??

Nå gjenstår det bare å se om denne funker!!"
,Ubehage,2007-12-09T19:03Z,"""Custom Swesub"" betyder at nogen har lavet teksterne selv.."
,spag2008,2008-01-21T05:20Z,Could someone tell something about this movie in English? Is this the Original one or the custom one? Do it have all the extras? Is the picture & menu untouched?
,spag2008,2008-02-07T13:00Z,Can anyone give the link of the Extra Disc for this Movie?
,niko1010,2008-08-17T10:39Z,Can someone please seed ?.. I'm at 32 %
,jrud,2008-09-06T09:14Z,"Hej
Hvorfor virker den ikke.
Hver gang den når til kapitel 20, så starter den forfra.
Gør jeg noget galt?"
,thunder-dk,2009-07-08T19:50Z,er der ikke nogle der kan seede den her eller oploade en med dk subs
