User Type,Username,Date,Text
,Bohasusaa,2008-01-03T02:50Z,HDTV rip
,Bohasusaa,2008-01-04T17:57Z,"No problem dude,I do have all seasons if you need some other parts let me know"
,johnwullie,2008-01-14T11:40Z,can some others seed this please beentrying to download for ages
,BluStreak,2008-01-14T17:54Z,"1 seed and 126 leechers??

Where are other seeds??"
,cannabinoid,2008-01-16T17:57Z,"the file downloaded to just over 80% mega fast and now I can't get any speed at all, apart from the occasional 1kb/s! - is there any reason for this? "
,cannabinoid,2008-01-18T17:05Z,if anybody has the end of episodes 14 onwards please seed
,aliceandant,2008-01-27T22:43Z,how come episode 21 cuts off before the end???
,badlands,2008-03-23T04:34Z,"Because that's the way the episode ends, brainiac!"
