User Type,Username,Date,Text
,Nossie,2007-08-08T00:10Z,=)
,Dani016,2008-07-20T16:52Z,avsnitt 36 funkar ej :/ Krävs mer seeders..
,mm_jonna,2008-08-05T14:06Z,kan någon seeda snälla!!!! Måste ha de här avsnitten.
,Cyrose,2008-08-12T21:25Z,"Kom igen. 
Jag har legat på 71.7% i snart en vecka. 
Vore trevligt om någon kunde seeda lite. 
Och gärna seeda avsnitt 41-60 när ni ändå håller på. "
,hej116,2010-02-02T17:17Z,"den här säsongen ja skriver på nu vill ha alla delar på den nån som kan göra de för 1000kr till mig
adda min msn då
nicklas.anderson@hotmail.com"
