User Type,Username,Date,Text
,MrMolle,2005-06-24T13:05Z,Way to go... love roswell... thx...
,Trollkarlen,2005-06-29T17:32Z,Do you have the rest of the discs of Season 2?
,Cornflower,2005-07-01T19:04Z,@ Trollkarlen: Yup. I have season 3 too.
,Virran123,2005-07-18T19:29Z,Plz just seed this a little more. i'm almost done with it. ;)
,ravscool,2006-05-01T21:47Z,Hi everyone. I'm here to ask some help to anyone that has disc 5 from season 2 of Roswell. I'm at 98.5% with 64MB left to finish. Please seed a while to keep this file alive. Thanks in advance.
