User Type,Username,Date,Text
,ronnby,2006-01-04T16:34Z,Funkar inte i xp eller 98
,apbms1,2006-01-05T17:49Z,i'm using it on win XP pro with no problems.
,mobra,2006-01-13T22:49Z,does this include the new Focus (2005) ?
,mreiss,2006-03-24T21:52Z,"This is old version 2003, and don,t play with XP

Why is it not tell ??????"
,Sonnyblack,2006-04-09T07:03Z,please seed.
[V],rogga3,2007-01-01T14:21Z,"L채nken funkar inte, g책r ej att ladda..."
,ionut_jakal,2008-06-19T23:50Z,what version is this ? does it include the 2004 mondeo ?????
