User Type,Username,Date,Text
,ronline,2007-10-28T14:10Z,Do you have a walk trough for CIS. It won`t work.
,ufaelnk,2007-10-29T12:29Z,"If you look in the CIS folder there is a video clip with installation instructions.
Watch it. :)"
,drpeter,2008-01-09T02:45Z,"What about the hardware to connect to the vehicle, where can one buy or can it be made? What do you use? Thanks!"
,jametsi,2009-05-01T15:29Z,The cheapest place to get hardware for this is propably www.dealextreme.com
,rupert67,2010-05-13T14:15Z,"Excellent File, I lost my Original disk.
Many thanx for taking the time and effort to seed this.
Rupert"
,billydv,2010-06-08T12:12Z,"I am trying to install on windows 7,when i try to install stage 2 I do not get an activation icon. Any ideas on where it is?"
,znoopy2k,2011-08-24T23:14Z,"virscan.org finds some trojan horses in cis.exe

Here is the scan log
http://r.virscan.org/25ff49cc71bf5f723b83d59455abf877"
,biskety,2012-04-12T00:35Z,thanks i to lost the disk
