User Type,Username,Date,Text
,lukas,2004-11-05T11:27Z,tack så himla mkt min moster vill så hjärna ha den tack så jävla mkt älskar dej!.....:wub::wub::wub::wub::wub::wub::wub::wub:
,Nillan,2004-11-12T19:04Z,Tack så mycket. Du får inte en massa hjärtan av mig med ett stort tack;)))
,Nillan,2004-11-12T19:04Z,Tack så mycket. Du får inte en massa hjärtan av mig men ett stort tack;)))
,MintMaster,2004-11-16T20:08Z,Tack så mycket... nu kan man njuta av deras musik...
,Rolle12,2004-12-08T15:39Z,Takker så mye for denne og til den ene seeder'n som var igjen :)
,cnab,2004-12-11T22:15Z,tack så mycket nu har jag hittat en present till mamma 
,twinlab,2004-12-17T15:32Z,tack så hemskt mkt!!! 
,Marklar,2004-12-30T19:52Z,tackar för denna!
,rymdis,2005-04-26T19:38Z,"Varför varför varför?  (kan inte alla lära sig att inte ha svenska åäö med i filnamnet???????)

Suck..."
,Imjustconfused_,2006-12-17T20:51Z,Fick alla låtar utom spår 4
