User Type,Username,Date,Text
,Cyboman,2007-03-21T19:34Z,"Iso Kiitos tästäkin !
""senkin Paavo, tämä on ihmisten oikeus"""
,SloboHoro,2007-04-01T23:22Z,Miksi ei ole alkuperäisiä ekstroja vaan jotain Matrix hömpän pömppää?
,hemaanus,2007-05-02T20:58Z,"SIEMENTÄKÄÄ, PASKAT !"
,jussi.77,2007-11-17T20:24Z,"Hei vaan ""kymppi"" (tai kuka muu tahansa jolla sattuu olemaan), jos satut lukemaan tämän niin voisitko laittaa tän dvd3 paketin vielä vähäksi aikaa jakoon. Puuttuu sellainen 20 megaa. Kiitokset ennakkoon!"
