User Type,Username,Date,Text
,Time_Devourer,2007-09-09T01:01Z,"I am initial-seeding.
Just so you are aware."
,RougeNetNavi,2008-10-11T19:18Z,"This torrent is extremely rare nowadays. If you want the RPG Maker program, I'd highly advise seeding it after completing your download."
,Slik13,2008-11-06T00:12Z,"It doesn't look to be Vista compatible, anyone know if this problem?"
,ObamaTookMyTV,2009-01-01T09:50Z,"well, i have vista, am downloading and will let ya know if it does not work for vista."
,ObamaTookMyTV,2009-01-01T10:05Z,thx for the really fast download guys. took 2 minutes to download. unforunately this application does not work with vista...shit. i was really hoping this would work....
,Tumsy,2009-03-26T14:10Z,"For every1 with Vista just use ""Run as admin"". It  worked for me."
