User Type,Username,Date,Text
,blake5555,2007-10-27T00:12Z,.pdf files and two .html files.
,blake5555,2007-11-05T01:07Z,this is just philosophy son..it's not  really religion...just philosophy of mind and personality..see any insane christian or islamic books in there? hell no.
,riplikethat,2008-03-06T20:58Z,"@PhXAnarchy

You are a douche.


@blake
Thanks for the upload."
,moviewatcher10,2008-04-26T11:32Z,"This looks interesting.

Thanks for your efforts."
,muk3sh,2008-05-01T00:55Z,"I was searching for these. Thankyou.

Where can I find all the Vedas??"
,manggo4you,2008-10-17T19:47Z,Missing ang4.pdf on Angutarra Nikaya directory.  Could you please add the file?  Thanks a lot.
,wulfzden,2009-07-29T21:02Z,thank you very much keep seedimg please
,qams7,2010-05-03T21:27Z,"Interesting book for Wisdom, Check it out:
http://thepiratebay.org/torrent/5530033/Discover_Hinduism_for_All_Religion"
