User Type,Username,Date,Text
,reload99,2006-10-17T21:38Z,old good Quiet Riot. .. ....YEEEEEEE
,metal123,2007-05-03T05:38Z,NICE....gets me back in time....bang your heads....headbangers
,Beomaster,2007-07-22T18:48Z,I have seen them live :) :D
,Dirty50ck5,2007-08-20T22:25Z,Thanks a lot! An amazing addition to my music collection (and Metal Health has been stuck in my head since I got Guitar Hero Encore: Rock the 80s)
,Trapper,2007-08-24T13:10Z,Great...again some real music for my ears
,perra6970,2007-08-30T22:20Z,"Thanx, a very good rip"
,Tass1,2007-12-14T21:28Z,"This is why i love torrent bay...
Thanks"
,Overkill360,2008-08-07T11:45Z,"Great quality, works fine."
