User Type,Username,Date,Text
,creaTZa,2007-12-13T09:34Z,thnX
,DrBraun,2007-12-13T21:08Z,What is this? Bootleg? Fan compilation?
,Xeokym,2008-04-13T21:01Z,thaaaaaaaaank yooooooooooou
,Ezel,2008-04-19T15:05Z,"I can't find ANY info about this album so it seems to just be a fancompilation. I guess all the tracks can easily be found elsewhere. 'I Got Erection' and 'Selfdestructo Bust' are live-versions.
Too bad they fucked up the release by cutting 'Selfdestructo Bust' to short. It ends in the middle of a goddamn word!
This thing will get DELETED from my HD."
