User Type,Username,Date,Text
,sirfelgar,2008-04-13T01:14Z,PLEASE SEED!!
,kwiki,2008-04-26T00:04Z,please please seed i beg you
,maniacaljoker,2008-05-01T03:56Z,"PLEASE, PLEASE, PLEASE SEED!!! I have been trying to get this everywhere."
,kwiki,2008-05-14T00:05Z,whats the fuckin point of having it here if ya cant get please seed or some one else please seed thank you
,kwiki,2008-05-31T14:53Z,gettin sick of askin you you fool shove it
,ArjanR1,2008-10-17T02:06Z,"Can you please seed it again???
You can e-mail me @ ArjanR19@hotmail.com

Thnx!!!"
,mces97,2008-12-08T01:24Z,if anyone still has this please seed.
,Thomas117,2009-01-17T19:31Z,"What is the songs name then Tommy rides on his bike or what name of the song group?
please i whant that song."
