User Type,Username,Date,Text
,Snuffy,2004-12-31T02:45Z,"...heter ju iofs ""Battlestar Galactica 2003"" och inget annat.... Serien däremot sändes inte förrän 2004..."
,Komadyret,2004-12-31T05:54Z,"Kan noen seede? Har stått stille på 60,3% ganske lenge nå."
,Tobiash,2004-12-31T10:00Z,"Det er rigtigt, det er 2003 og ikke 2004, en tastefejl sorry!
Det må I undskylde, men var nødt til at slukke for computeren, men er oppe igen nu!"
,j_s_j,2005-01-16T22:43Z,hvad er det for en version?? har kun lyd
,zeitnot,2005-02-11T02:33Z,Is there a free version of this VP6 codec??
,d37nu1l,2005-02-27T22:30Z,"VP6 codec can be found here:
http://www.free-codecs.com/download/VP6.htm"
,CASAO,2005-08-14T00:49Z,"This is a horrible copy of the file, it requires a non-standard codec and the quality is subpar. It's got the super-low resolution of 320x176, and it can't be increased at all because the quality is so low. Go look at one of the other copies."
