User Type,Username,Date,Text
,tomtomx,2007-08-02T23:13Z,"""Dr. Max Gerson, a general practitioner physician who was assassinated for being far too successful in the treatment of Cancer and many other ailments.""

A typical Conspiray Central approach/lie/bs to make everyday happenings mysterious...

In fact dr Max Gerson treated many hundreds of patients and continued to develop and refine his therapy up until his death in 1959, at the age of 78. (According to http://www.gerson.org/)"
,Critic,2007-08-24T14:22Z,cancer has been brought to you by ; Belgium and France...  Trying to destroy africa but it got outa hand and now we all can enjoy the PAIN enjoy when you have it ;)
,nwo777,2009-07-17T00:10Z,Thanks for the upload here is more must see info on cancer : http://thepiratebay.org/torrent/5006792/Cancer_torrent_collection
,WilhelmTHE3rd,2012-07-19T01:45Z,"This Gerson protocol is a mess, and all it will result in is death with an anus full of coffee.  And if you die, they'll claim you didn't follow the regimen properly...just like faith healers

http://www.sciencebasedmedicine.org/index.php/the-ethics-of-cam-trials-gonzo-part-i/

http://www.sciencebasedmedicine.org/index.php/gonzalez-regimen-for-cancer-of-the-pancreas-even-worse-than-we-thought-part-i-results/"
