User Type,Username,Date,Text
,sebastiansson,2007-08-22T09:01Z,"Cover kommer också med=)

Komenter om det e ngt fel lr nåt :P"
,Ludde2007,2007-08-22T12:26Z,"Hej! när jag började ladda hem den här,så fick jag in ett Trojanskt virus i datorn

Hade inga andra aktiviteter på gång änn den här
"
,sebastiansson,2007-08-22T12:34Z,"Jag känner igen dig, DU FÖRSÖKER FÖRSTÖRA FÖR ANDRA !!!


Ni andra kan söka om det finns virus =)"
,Ludde2007,2007-08-23T21:42Z,"Talar bara om vad som hände mig 

och mitt virusskydd F-secure internet ""talade"" om för mig att det kommit in ett Trojanskt virus

Precis när jag startade nerladdningen

Är ju inte 100% att den kom härifrån men jag hade inga andra aktiviteter pågång då..

Om jag vill Förstöra så skulle jag väll inte tala om det här,utan låta andra evnt få viruset(Alla kanske inte har skydd som tar hand om virus)

Så  var min tanke...

OCH MIG KÄNNER DU INTE!!! Pucko!!"
,sebastiansson,2007-08-25T17:44Z,Finns det nån trojansk häst då????
,Jullevik,2007-08-26T22:41Z,"Är det inte bättre att ladda ner orginalet?

http://thepiratebay.org/tor/3780464/Absolute_Music_55_-_2CD-2007-JULLEVIK"
,sebastiansson,2007-08-30T22:09Z,"Det här e ju orginalet, som jag lånat från en kille :("
,Jullevik,2007-08-30T23:13Z,"Varför mäste du ljuga sebastiansson? Du har ju med mina covers liksom alla andra rellar av denna cd, jag har ändrat lite på det ena omslaget för jag skulle se vilka som snodde det :-) Så ljug inte för alla här på Tpb sebastiansson.
Min relle är orginalet som kom först, sen har andra kopierat det, that´s it....."
,downloading king,2007-09-02T13:43Z,jag använder f-secure och det finns inga virus på denna
