User Type,Username,Date,Text
,Master J,2007-01-25T15:35Z,"Please seed it,thank you"
,Go!,2007-02-23T13:27Z,isnt it MP4 format??
,rowborough,2007-03-24T08:56Z,yes but is tweaked to the ipods data rata and acreen size
,kazimir22,2007-08-17T03:41Z,"very nice quality download...

didn't like the movie though"
,drownzak,2007-09-26T17:12Z,Maybe this is one good download. But how the hell can one survive watching this movie?
,tbearnskwerl,2007-12-22T10:27Z,"excellent quality, terrible movie
mel gibson sucks"
,washwash76,2008-06-02T20:37Z,Seed please!!
