User Type,Username,Date,Text
,Bluesoul,2005-06-18T22:43Z,"Dare Mo Shiranai, excellent!!"
,johnmic,2005-06-18T22:55Z,just wait for me to connect to you. heh
,detonator2005,2005-06-18T23:24Z,SEE IT! http://brute.ru/welcome/in.php?detonator2005
,zake88,2006-05-15T19:36Z,"Is it DVD shrinked from dvd-9 to 1,38 GB? What are the benefits, besides it's faster to spread? Just thinking: What is a loss of spreading speed compared to the loss of quality."
,BlomQvistan,2007-09-09T18:25Z,"Please, can anyone seed this torrent?! :)"
,Ryuksapple,2008-04-17T00:33Z,seeders please
,Ryuksapple,2008-04-17T19:35Z,"No Seeders? Come on, anybody?"
