User Type,Username,Date,Text
,Eigyr,2004-12-26T18:39Z,"Hej alla 
vill ha alla delarna finns de??"
,sorkas,2004-12-29T13:55Z,"länk till bok ett

http://tracker.piratbyran.org/torrents-details.php?id=3268779&hit=1"
,McANKA,2006-05-25T15:55Z,"Bättre sent än aldrig ? 

Hittade en skiva med lite gott på så jag seedar bok 5,6,7,8 av drakens återkomst till er. :) 


Såg att det inte fanns några seeders sen länge på dessa. försök seeda vidare när ni fått ner dom !!! 

"
,iKim,2006-12-10T16:43Z,seeda är ni snälla 
