User Type,Username,Date,Text
,ZackFrhrt,2010-09-13T04:47Z,"Great download, I just can't get it working :(

""Audition has encounterd an error 
[\premiere2.0\Libraries\Asl\Foundation\Src\PathUtils.cpp-741]

Then it goes into ""restart program"" and than windows error comes up

help!

windows vista home basic 32bit"
,propersina,2010-09-20T23:00Z,"I like your presentation, is...i like it, thank"
,MrAnth,2010-10-11T01:25Z,"thank u very much 
u got +1 from me"
,freshtex,2010-10-11T18:04Z,"First Off, i'll like to thank you ""FiNsTeRc"" for a job well done, i have Cool Edit Pro & AA 1&2, this new version is really the bomb, installs fine cracks easy, & works great, you didn't have to put up this torrent but you did, so thank you again, this program costs $99 for an upgrade from 2 & $349 for the full version on Adobe's site. http://www.adobe.com/products/audition/"
,ukbull83,2010-12-17T02:58Z,"works 100%, just install like any other program, when thats done go to C:\Program Files (x86)\Adobe\Adobe Audition 3.0, drag the crack app file into this folder and click move and replace option and its done.

you will only get the sharedcontrols.dll error if you try to start the program before you crack it.

thanks FiNsTeRc."
,haseebjawed,2010-12-20T20:14Z,not working on windows 7?
,gabcooldude,2011-01-06T04:21Z,"I think the installation worked for me but each time I launch Audition, I have a pop-up saying ""To continue working where you left off, please restart Audition"" and everytime I do, it crashes again with this same error. Any help?"
,Pepparkaksmuffins,2011-01-09T18:15Z,"First of all. Thanks fore the torrent, FiNsTeRc!

Although, I need help. :S

I did as told...

1. Ran ""Audition3_EFGJSI_Trial.exe"" and selected the Adobe-folder under c:\Program
2. Deselected ""Start Adobe Audition 3.0 Trial Installer"" from the ""udition3_EFGJSI_Trial.exe""-install window and selected ""Open the stated map"" (c:\Program\Adobe) instead... and clicked ""Finish""
I explore 12 files: 1031.mst, 1033.mst, 1034.mst, 1036.mst, 1040.mst, 1041.mst, Abcpy.ini,adbsetup.cfg,Audition 3.0 Setup.exe, components.msi, Data1.cab and instmsiw.exe. But NO Audition.exe-file that all says i should replace with the cracked in the ""Crack""-folder! (???)

3. Then i run ""Audition 3.0 Setup.exe"" (There is no else setup-file)! and have to select language. After clicking Ok an install window appers for a very short time and nothing els happens. 

There is still no ""Audition.exe""-file in the folder.

I even downloaded the SharedControls.dll from http://www.down-dll.com/index.php?file-download=sharedcontrols.dll and put it in the installed folder c:\Program\Adobe\Adobe Audition 3.0 as @bibo116 hinted. 

But then i get the errormessage: ""Unable to find procedure startadress ?GetItemRect@CToolbarCtrl@@QAE_NIPAUtagRECT@@@Z in DLL-file SharedControls.dll""


(I run WinXP Pro (x32) Sp3, with Admin rights)

Please help! 

/""PepperCookieCupcake"". ;)"
,c.dur,2011-01-13T12:55Z,"i do crack ordinary and work fine. but when i go update it says:
Error PQ301: The audition 3.0.1. patch was unable to update your version of audition 3.0. Please re-install audition 3.0. with your adobe issued serial number and try again.  If this not resolve the problem, please contact adobe technical support.
whether it  is important update 
i can run program
please help!!!"
,L0xias,2011-02-19T01:19Z,"I have the exact same thing as Pepparkaksmuffins.

I run Audition 3.0 Setup.exe, select English as language, press ok and then the install window disappears.

suggestions anyone?

I have Windows 7 btw"
,djgyz,2011-03-23T18:49Z,This shared controls dll is shite it doesnt work ive spent the whole day installing and reinstalling ive downloaded 3 different versions of the crack all with no joy someone needs to listen to what were saying!!!!!!
,raiderette,2011-10-19T00:12Z,"Umm the link provided for the .dll file... there's nowhere to download it. Every time I click ""Download free of charge"" it takes me back to the same page. "
,adensdaddy2011,2011-11-10T00:51Z,i highly recommend putting the crack into a .rar or .zip. this way you always have the crack if needed. also you can extract it directly to the program file where it needs to be placed. But thanx for the awesome Torrent. not only does it work. It fixed a prob in my registry from a previous version that did not come with the uninstaller. NOPE really knows what they are doing THANX GUYS
,adensdaddy2011,2011-11-10T00:55Z,thanks For a great torrent guys. I highly recommend putting the crack into a .rar or .zip. this way you will always have it if needed. Not only does this torrent work perfectly it also fixed a prob in my registry from a previous install of the program that did not include the uninstaller. NOPE really knows what theyre doing. THANX GUYS. 
,Tyfer666,2011-11-14T06:57Z,"I can't help but wonder why the people that create these torrents don't make video tutorials to show users EXACTLY HOW to work the files. There are so many comments from people who have not the first idea of what they are doing with these torrents, and so many people thinking they are explaining the process with just 3 or 4 sentences. I'd imagine it would help a great deal, plus create more users downloading the uploader's torrent. Sheesh"
,edx500,2012-03-07T05:45Z,"Got it to work!-For those having problems just be sure to read thru the comments. There is a lot of chaff here.

Paste the audition.exe into the audition folder under programs-delete the desktop shortcut-create a new one from the cracked audition.exe.

You can now open the program. Seems to be working fine. I opened it 3 times and messed around with it a little bit.

I'm using this for editing and mp3 conversions"
