User Type,Username,Date,Text
,burberry,2008-02-07T20:28Z,"Seeda för fan, vi snackar jc på österåker här."
,Baly_kungen,2008-03-14T19:16Z,kom igen nu pojkar har alla album utom denna och seeden ligger atm på ca 1kb/s
,CharlieSnarl,2008-11-22T13:44Z,"Seeda då ffs!
The man in black e kung- Cash is King^^"
,Ã¶berg ronny,2008-11-25T01:42Z,"Inga problem för min del att ladda ner den här
jag lägger in Bittornado mirror 3 svenska ver.
Hjärtligt tack från mig."
,xas210,2009-06-15T20:18Z,seed please!
,acsanjin,2009-11-06T04:49Z,Please seed this! :)
