User Type,Username,Date,Text
,sukis,2006-05-30T13:58Z,seed pleeeease :)
,zoltan_jeff,2008-02-20T17:39Z,"Culture fan like me? and wanna download all their albums? go here.. http://www.torrentvalley.com/download_torrent_936665.html
Thanks this is one of their best albums by the way"
,zengjansen,2011-04-22T02:52Z,thanks man
,zengjansen,2011-04-28T10:05Z,"even much more thanks than i can say, i haven't heard this in 20 years or so and i still remember every note this is such pleasing music! HERB FOREVER"
