User Type,Username,Date,Text
,kenhag,2007-08-07T18:09Z,Thank you for the nice episodes! We all enjoy them very much. Do you have the episodes 8 and 9 also?
,thorongil2,2008-03-05T18:01Z,"Finally managed to get and put out the missing, last two episodes!"
,Endgegner07,2008-03-08T14:22Z,"Omg, thank you so much for the episodes.
This is one of my favourite SH series! I love it, thanks again!"
,vil77i,2008-10-25T04:21Z,"Shortly: Put all films in one basket. -> https://thepiratebay.org/user/vil77i/
Trying to get some life to this fine share. Use it if any of these gets unseeded or if you want to help to seed."
