User Type,Username,Date,Text
,Silence83,2008-03-02T14:17Z,Tanx so much for this one..Just saw the movie and simply loved the story.
,bennos5689,2008-03-04T14:10Z,PLEASE SEED ITS ONLY GOING 0.01KBS
,misterbs,2008-05-03T16:56Z,come on and seed! plzzzzzzzzzzzzzzzzz!
,fljewelcase,2008-07-26T17:19Z,Can we get a reseed on this?  I'm stuck at 99.7%.  I'll stay on to seed in return.
,datagutten,2008-09-12T20:06Z,"If you need seeding, ask at torrent(at)datagutten.net"
,Christerrr,2008-10-27T23:29Z,Please seed! really need it!
,Fappen,2009-01-23T15:44Z,"seeeeeed please, need this :D"
,Fappen,2009-01-30T19:16Z,"seed!!! 91,9%!! :/ pllllease i will help seeding!"
,Nosboy,2010-03-01T19:37Z,NEED SEED!
