User Type,Username,Date,Text
,lizzie2004,2007-02-16T08:47Z,"Thank you!!! What's the differents between this one and your Ugly.Betty.S01E16.HDTV.XviD-XOR? I understand this contains more files, does that make the picture and the sound much better? Which one do you recommend to download and why?"
,cathylou,2007-02-23T21:32Z,when does next episode come ?
,freak_chick,2007-02-25T16:55Z,hey:) i just want to know how many episodes is there total? and when does 17 come out?
,___Shivan,2007-02-26T19:28Z,"There are 16 episodes total so far the new episode air on Thursday, March 1 "
,Robinrunar,2007-03-04T20:50Z,If it aired march 1 why is is not here yet? i want to see it! soo bad!
