User Type,Username,Date,Text
,mikeportnoy,2004-12-10T18:03Z,If youre a big fan- BUY THEM!
,gustawwww,2006-05-22T17:37Z,plz seed
,john_glider,2011-06-07T21:57Z,"If you are Mike Portnoy, Fuck you!!"
,my_son,2012-05-19T19:47Z,"I would never pay for this shit Portnoy, mostly 'cause I don't have the money for extra shit. If I develop an extreme obsession for drumming, which would be after watching countless downloaded videos on the matter, I might buy my favorite ones. Most of the videos are trash anyway, in my opinion."
,my_son,2012-05-19T19:49Z,@TheAbsorbant - thanks for the upload
