User Type,Username,Date,Text
[V],RedAce,2004-08-07T00:17Z,Detta har jag väntat på! Det skall bli spännande att prova. Och litet är det också så det går fort att få hem.
[V],RedAce,2004-08-07T10:45Z,"Helt OK spel, nästan i klass med Pinball Illusions på Amiga. Dessutom är ju även detta spel från Sverige (http://www.iridon.se/).

Fletchett: Finns det en PC-version? Titeln på websidan är ju ""Pure Pinball - Only on Xbox!"" (http://www.purepinball.com/)"
,Robster,2004-08-08T13:47Z,Grymt kul spel
,Choc,2004-09-30T21:01Z,Jag fattar inte varför jag inte laddar ner! Det är ju 2 seeders. Någon som vet felet?
,Zire,2004-11-09T19:35Z,"Är det min lina eller seedarnas lina som det är fel på? 
För det går väldigt lllllåååånnnggggssssaaaammmttt..."
