User Type,Username,Date,Text
,Medveten,2007-02-10T12:02Z,"Det är ju inte alla som tycker att det är enkelt att hantera originalfilen, det är många som tror att installationen är klar när den är uppackad.
Här har jag gjort det enkelt och tagit bort det momentet, dvs det kan inte misstolkas, men det är ju frivilligt att använda vilken fil man vill, eller hur.. ;)"
,sune44,2007-02-10T23:52Z,går mot strömmen o säger TACK!
,xt660moto,2007-02-23T23:59Z,?????????
,popie joopie,2007-03-15T21:14Z,aub spreek engels of nederlands noobs
,havguf,2007-04-03T11:01Z,Seed :) Under 0 KB/s
,Big Bud,2007-04-05T18:58Z,Thanx Micke!
,subit,2007-04-30T14:29Z,what version of directX? the latest from microsoft is 9.18.944
