User Type,Username,Date,Text
,eifioneyles,2007-12-21T17:57Z,"Works perfectly, no problems at all. Thanks"
,shades101,2008-01-03T17:20Z,i cant get the crack to work. I replaced the orginal exe with the cracked one. but no luck. any suggestions?
,giomi,2008-03-03T18:19Z,pws borw na to kanw download?
,Cesaritom,2008-04-10T21:14Z,does anybody know if there are any issues with the crak depending on the OS?
,Cesaritom,2008-04-11T18:03Z,"Ok crack works perfectly fine, if you have installed a trial and played, what you need to do is unistall the game, delete all registry entries related to the game, then reinstall and before you play, copy the crack to the installation folder"
,sstem89,2010-05-02T06:50Z,"If you download this, your computer will get AIDS and die!  I did, now I'm working on removing the virus.  Here's what I found about this virus in this download, ""Win32/Heur, also mentioned as Virus Win32 Heur is a dangerous self-mutating polymorphic trojan virus, typically installed on windows system without victims knowledge.""... (and the description continues).  If you value your computer, DO NOT DOWNLOAD THIS TORRENT!"
,j_fix114,2012-03-09T01:37Z,I can't get it to work either.
