User Type,Username,Date,Text
,mangemann,2008-01-24T19:38Z,Kan någon vänlig person bränna in svenska text på detta avsnitt och ladda upp
,JohnNewall,2008-01-27T19:45Z,Hva er det med dere svensker og innbrennt text??? Det ødelegger filen for alle som ikke er svensk! Lær dere og bruk ekstern text fil..
[T],Knaster,2008-02-04T14:18Z,Norge suger Sverige äger
,berny_91,2008-02-13T14:24Z,Norge eiger - Sverige SUGER
,HenrikPonten,2008-03-03T00:18Z,Akta er för att dra svenska subs av Snowpatrol & Mr.Swede bara. De verkar vara två efterblivna 11-åringar som inte lärt sig vare sig svenska eller engelska på sin jävla särskola än...
