User Type,Username,Date,Text
,Dr.Egg,2006-12-02T14:53Z,yeaa
,metaxus,2007-02-08T03:06Z,Can we get a seed or two for a bit. I can seed once done.
,tenden91,2007-05-01T12:22Z,"Please, I need a Seeder. Leecher is also good for now"
,Jerqua,2007-09-13T23:06Z,yeah baby seed! been looking for this!!!
,thoraxo,2008-03-11T14:20Z,"These are some smooth grooves brother, thanks."
,my74standard,2008-05-14T03:28Z,"please seed, i need some smooth asap!!!"
,Allpaul,2008-10-17T23:47Z,"I'm losing the smooth! When you see a friend  drowning, you don't throw him a life jacket, you swim one over to him! In other words... Seed please. I need to get trapped in a sea of gentle grooves!!"
,punsphere,2009-08-29T07:34Z,"Looking for a Kenny Loggins expert and you seem to be it. I was seeking the live track of ""I Believe In Love"" from his Alive album which was 1981 or so I think. Have not found it but would love to find it. Thanks!"
,JosephE,2011-02-13T06:12Z,Hey could you seed this for me? Really need these smooth mother fuckers man.
