User Type,Username,Date,Text
,mrTLU,2005-01-22T00:23Z,"SFV-kollen kommer att misslyckas, detta beror på hjonet som släppte ut filmen på usenet...
NFO-filen har något fel filnamn och idioten inkluderade PAR-filerna i SFV-kollen...

anyway, inget annat fel än det alltså, fullt fungerande (checksum-mässigt iaf)."
,ancientdanne,2005-08-01T16:42Z,sedda sitter fast på 60.5%
,Hellizard,2006-02-27T22:25Z,"omg.. there are 10+ peers stuck at 99,6%.. some please seed ='("
,mad-doc,2006-03-01T15:39Z,"Stuck at 99,6%
common Plz seed"
,mad-doc,2006-03-09T14:43Z,"Ah nu sitter ja fast på 99.9%
bara lite till snälla!"
,MPnord,2006-04-09T09:34Z,"finally got it after like a week, will seed this for a couple of days now!"
,EL_REY666,2006-05-04T03:41Z,NTSC or PAL
,robertow2,2009-02-16T12:57Z,"please seed Iron Maidens fans.
I need too much this video.
UP THE IRONS"
,Philus666,2010-07-21T09:57Z,"Seed,please."
