User Type,Username,Date,Text
,robban98422,2007-03-11T15:55Z,"well they dident work, not one of them, i just get a 98style,"
,gomzi,2007-03-11T20:07Z,"works perfectly, but only on x86 not on the x64 winXP, havent found any method to use it on x64 systems"
,meytipeyti,2007-03-12T15:17Z,"Very Dangerous.Take every effort before any action to ensure safety of files.
Scan with every malware scanner at hand.At least with twenty of them :)"
,gurr4_93,2007-04-19T16:29Z,Is it only one instalationfile or is it 70 instalationsfiles or is it rar packs i hate to unpack
,D3LinQuENT,2007-06-03T21:03Z,u have to use a uxTheme Multi Patcher
,Sly_fox_2007,2007-07-02T20:31Z,"To make these work,you need StyleXP.Just search on here and you can get style xp cracked without tampering with system files like what the UXTheme patcher does."
,andycham3000,2010-12-02T12:55Z,whatsa the damn password to the rar file
