User Type,Username,Date,Text
,Rullator,2004-08-01T08:25Z,"Jag kör med en AMD 1,83GHz 512Mb Ram och för mej fungerar Pro versionen mycket bättre än standardversionen av Acrobat Reader.
En annan fördel med Pro är ju att man kan göra egna .pdf-filer! ;-)"
,scully,2004-08-01T09:33Z,"Jag har en PC med athlon 1,3 GHz och 256 MB RAM. Professional 6 går ganska bra att köra, det är bara första starten som tar lite tid. Men överhuvudtaget skulle jag vilja ha någon lättare pdf-viewer när man läser pdf-filer på Internet. Inte ens Reader-versionen är tillräckligt lätt. Men det var den inte heller i version 5. Pro 6 är suverän när man vill göra egna pdf, t ex från html-sidor."
,bananen,2004-08-14T13:09Z,"Finns det någon vänlig själ som skulle kunna seeda en stund vi är fast på 82,8%. MVH bananen"
,zIr,2004-12-17T00:40Z,"S E E D !

Vi är några med 82% så om du bara släpper till lite så vore det strålande......!


Tackar...
"
,nautilu5,2007-01-16T00:00Z,"thanks to thoses seeding this, atm"
