User Type,Username,Date,Text
,zapper,2004-12-18T00:29Z,this game works great with gcsim(r) :)
,Pojken,2004-12-18T01:32Z,how does this work?
,zapper,2004-12-18T12:09Z,"there is an exploit for the phantasy star online 1+2 game, if you have that and a broadband adapter for your gamecube you can stream games from your pc. :)

read more here:
http://forums.afterdawn.com/thread_view.cfm/7/61273"
,zapper,2004-12-19T23:14Z,http://www.gamespot.com/gamecube/action/capcomvssnk2eo/index.html
,laika424,2005-01-06T11:16Z,Can anybody seed please??? we are 10 ppl stuck at 51.6% 
,thekarateka,2007-06-14T00:43Z,what emulator do you use to play this?
,superpipo,2007-12-30T01:16Z,"Zapper, can you please seed? Thanks."
,fgg1985,2009-01-14T06:34Z,Torrent still alive...
