User Type,Username,Date,Text
,kagulo,2007-07-18T23:33Z,"Det finns få historiska böcker på TPB.
Hjälp därför till att seeda minst 24 tim eller tills du uppnått en kvot på 1.0 så skall jag lägga ut fler.
/Tack"
,Bokvard,2007-07-19T00:18Z,"Du har helt rätt - Villius är en mycket god berättare och det finns för få historiska bcker här på TPB. Jag lovar att seeda till minst 1.0 efter att ha fått boken...

Tack förupload!"
,Albacken,2007-07-19T07:39Z,"Efter antalet uppladdade böcker av dig verkar det som om jag får isolera mig igen i skogen för att få lugn och ro och hinna lyssna på dina uppladdade.

Får skaffa solceller för att ladda upp MP3 spelaren och bärbara datorn.

Huga mig, gubbar vad bra ni är."
