User Type,Username,Date,Text
,dARXidE180,2006-12-26T11:26Z,"Jag gillar verkligen att det finns nån som har tänkte lite och gjort ett bättre brogram än det i windows! (fast det har ju gjorts nya liknande prgram som är bättre till typ allt i windows)

Men jag skulle gärna vilja ha ett program som hittar OCH ansluter till det snabbaste möjliga wlan som finns . Nån som vet?"
,torson,2008-07-20T12:11Z,Wifi-radar tror jag fungerar så.........
,Djsanz,2008-11-25T15:19Z,"is this vista compatible? Anyone know vaguely a few step by step instructions on using this tool? I already have it installed just want to know how to actually get a list of networks in my area. I have wireless ready laptop and the software just says no wireless adapter found and gps disabled.  If i need a different program or something any help would be much appreciated,

thanks."
,Djsanz,2008-11-25T16:42Z,"It's ok i've found out that if your on vista you want either inSSIDer or Vistumbler and not netstumbler.  Warning: netstumbler can cause problems with vista system and cause crashes, it's not for vista or XP 64 edtion.  I've downloaded inSSIDer and it worked straight away. Also it's freeware I think so your better getting it from Metageek.  "
