User Type,Username,Date,Text
,wolfen_155,2006-11-01T18:55Z,sänd när ni har ladat  färdigt är ni snälla
,elwoodbloos,2007-08-21T09:47Z,muchas gracias
,lillewickepicke,2007-12-07T22:05Z,Tack som bara den.  detta är helt underbart. Seeda när ni tankat denna!!!
,Rataxes69,2007-12-22T13:47Z,"Är det någon som har kvar denna torrent
http://thepiratebay.org/tor/3549407/ronny_j__nsson
om ni har den snälla lägg upp den igen."
,jon_smod,2008-02-24T20:30Z,"Tjena

Finns det några fler obotliga Ronny fans där ute som vill vara med på idén om att samla ihop allt material som Ronny 'någonsin gjots i raddio' som han själv skulle ha uttryckt det. Leta fram era gamla dammiga band och maila mig på jon at smod punkt se."
,centercap,2011-02-16T21:49Z,Nån som vill lägga ut igen?
