User Type,Username,Date,Text
,galvanize,2008-01-20T20:25Z,noen som har ep 1 og???;D
,stizzn,2008-01-21T08:09Z,Laster den også opp...
,s0617750,2008-01-21T17:52Z,"Glimrende:) takker så mye, kommer du til å fortsette og legge ut alle episodene?? takk igjen"
,Jizz3r,2008-01-27T09:01Z,"Ahh! Fantastisk, tusen takk for dette. Varmer for de av oss som ikke har mulighet til å følge våre venner på TV-skjermen hjemme i Norge...!"
,realbabs,2008-01-29T21:15Z,knall bra. legger du ut 3 også eller?
,techd,2008-02-02T09:49Z,"Utrolig glimrende, og veldig bra kvalitet! Noen sjanse for at du legger ut resten av episodene også?"
,stizzn,2008-02-03T15:11Z,"Legger ut episode 3 og 4 ut i løpet av dagen,,"
,robinbye,2008-02-04T14:16Z,Strålende! Håper inderlig du har anledning til å legge ut flere episoder!
