User Type,Username,Date,Text
,Francesco Dottore,2007-12-12T02:41Z,You're doing great & we're enjoying it . Impatience is a virtue for some people !!!! Thx for the  updates Merzedes and keep them going as long as you can
,cupid2,2007-12-14T07:16Z,"merzedes, this UK Dogging series is truely the dogs bollock.
I've got your page bookmarked and regular check for updates

Now I've seen a lot of porn in my time, but this is how it should be done. The girls have great personality.

Excellant, Happy Christmas to you mate, and all the best in 2008

Tony 

tonyd42001@yahoo.co.uk"
,iamme09,2009-06-25T15:39Z,thanks mate you rule 
