User Type,Username,Date,Text
,vietvet52,2008-01-08T04:28Z,"hey FFF  you sill fucking that fat chick,."
,FatFuckFrank,2008-01-08T11:22Z,only when she's stopped eating
,Jecille1,2008-01-09T06:32Z,"Hey, FFF! I guess getting Dolphin Porn is to much for you, huh?"
,vietvet52,2008-01-09T22:32Z,"hank hill got fucked my a dolphin, check that out"
,Tinface,2008-01-10T02:35Z,jesus christ...I wouldn't mine being a dude there...with girls somehow jizzing on my face...
,mipohond,2008-01-10T12:18Z,"hey man,

do you have this film in your collection?

Caged Hearts 

http://www.imdb.com/title/tt0112612/"
,FatFuckFrank,2008-01-16T15:10Z,dolphin porn is illegal
