User Type,Username,Date,Text
,Naesstrom,2007-09-15T14:13Z,"BTW, I think this is in Swedish only, no multilanguage version!"
,Vispen74,2007-11-07T16:11Z,Could someone seed please!
,rutan33,2008-01-10T11:54Z,Tack så jättemycket...Nu blir jag förmodligen lite mer slimmad tack vare dig!!!
,Nethan,2008-02-20T06:33Z,"Jag fattar inte hur jag ska få denna att fungera...(kanske trög, men ;o) ) Jag brände ner vpp1.iso, men sen då??

SNÄLLA, hjälp!!
Tackar på förhand :$"
,apang,2009-07-18T17:30Z,I WILL KEEP SEEDING FOR ALL THE FAT GUYS IN THE WORLD!
,pictu,2010-11-08T02:19Z,vore FAB om någon kunde lägga ut Ät & Njut 
,NickeNyfiken66,2011-02-20T18:15Z,Eller den nya versionen Points Plus Duo Val :)
