User Type,Username,Date,Text
,OxyContin,2006-06-16T05:14Z,Fantastic torrent. I love the Guilty Gear music. Thank you !! Thank you !!
,Necrophagist1,2007-01-29T20:44Z,Please seed if you don't mind!!
,carlitosv.1.0,2010-03-05T04:26Z,"dude, i finishing downloading and you're missing GUILTY GEAR X OST album. And would like to say thanks for having all these albums. Had them all at one point but they got stolen."
,carlitosv.1.0,2010-03-05T04:29Z,"Almost forgot too, back in GGX2, in the extras, there was an ggx anime. Know where to get that? been searching forever!"
,Elena_Kiske,2010-10-31T06:47Z,"carlitosv.1.0,
In the ""X:\[where_you_installed_it]\Guilty Gear X2 Reload\movie\"" folder. If you don't have it for some reason, I can ul it."
,carlosv.1,2011-04-06T23:24Z,"elena_kiske,
lol i don't know if i understood correctly, but you're saying the movie is included in this torrent? i can't find it if it is :P"
