User Type,Username,Date,Text
,xhack,2006-01-20T14:12Z,"damn itz looking 4 a disc 2 blah blah blah its a 2 disc but it wil find disc 2...
what d hell wers d real disc 2"
,MKotnis,2006-01-22T13:30Z,What the Fuck are you takling about
,Norpan_karlsson,2006-02-05T18:43Z,no seeders?
,DarkS7ar,2006-02-22T15:15Z,"Trying to run the game it asks for Disc 2, cannot find an .iso to mount. Not quite sure if its just missing or if theres something I'm not doing since there is no readme support."
,DarkS7ar,2006-02-22T15:18Z,"Ahh nm, mouted the winrar file and it works just fine. Great torrent submitter."
,Miniheaton,2006-03-09T13:16Z,"please, seed, it´s 5kb/sec!

i have dsl 8Mbit telia!"
,klauscull,2006-04-09T22:55Z,"I can install the game just fine, but when I try to run it, I get this error:

AppName: ravenshield.exe	 AppVer: 0.0.0.0	 ModName: ~df394b.tmp
ModVer: 0.0.0.0	 Offset: 0004e8ed

Does anyone have a solution? "
,Joker-Fin,2006-09-14T16:40Z,"Hi i downloaded this game and when i go to multiplayer it says register the i register in ubi.com but the i select ""join ip"" the i putted ip addres and then it asks cd key what i have to do? ps:im from finland so i speak and write bad english"
,Twinbird24,2006-12-01T23:06Z,"okay, if it asks for the cd, you either need to get a cd key for the game or get a crach. For a CD key, just go to some serial website that will give you a cd key for the game. Just try going to serialz.to and type Rainbow Six 3. Yeah...just firgure it out, google it. it's not that hard"
,Nikolaa,2006-12-02T01:05Z,please seed a litlle bit
,atav4156,2007-04-01T22:28Z,"thanks soo much for game...

can seeding continue please?? ill be sure to when im done"
,chka95,2008-11-30T10:19Z,how to install the game?! plzz answer really whont this game!!:P
