User Type,Username,Date,Text
,septimus07,2006-12-19T17:39Z,"Downloading now,  if this is as advertised then its a true classic and a MUSt for everyone,  If I recall then its only softcore but its soooo  funny,  cant wait to see those ""Giant Penisaurus's and Dr Flexy Jerkoff"".  
Thanks Very much for seeding :)"
,xenontouchstone,2006-12-19T18:07Z,"Thanks septimus07, it is indeed that one, penisauruses , rapist robots and all  : )
 I also have the sequel, Flesh Gordon meets the Cosmic Cheerleaders but in my opinion it is not as good."
,joolzg,2006-12-19T19:41Z,"all we need now is Jungle Burger???

joolz"
,xenontouchstone,2006-12-19T21:40Z,jungleburger on its way joolz
,xenontouchstone,2006-12-19T22:27Z,"Jungle Burger now seeding at
http://thepiratebay.org/tor/3580013/jungle-burger

 Enjoy"
,xenontouchstone,2006-12-22T11:47Z,"Thank you to those helping to seed, its appreciated."
