User Type,Username,Date,Text
,dimi888,2007-11-12T11:27Z,Kan nån seeda denna?
,larpiainen,2008-01-02T23:50Z,"har någon mera Wallader filmer med engelska eller finska subs? Min svenska är inte tillräckligt bra... Baba2u, kan du hjälpa mig?"
,fyrekrig,2008-02-01T00:23Z,"Cd2 är inte komplätt, bara 13mb.

Kan vi få hela Cd2 ?"
,AnotherStranger,2009-09-30T21:58Z,"Om nån tycker att avsnitt 1-3 slutar lite väl abrupt så kan jag säga att det är precis så kasst de gjort det på dvd:n, så inget fel på rippen inte.

För övrigt så är denna rip att föredra framför dvd:n, där bilden är letterboxad 1.66:1 vilket inte ser kul ut på en 16:9 tv - svarta kanter på alla håll - och zoomar man blir bilden både beskuren och i sämre kvalitet. Allt det slipper vi med rippen, som tacksamt fyller ut nästan hela teven - tack ska du ha!"
,AnotherStranger,2009-10-01T18:35Z,"Hm insåg just att det här måste vara en rip av denna http://thepiratebay.org/torrent/3383841/, för visst fan är för- och eftertexter med på varje avsnitt på retail-dvd:n. Men skitsamma, man missar trots allt inget av handlingen."
,emmachristina,2011-01-27T03:35Z,Seeda någon? Har läst ut boken och vill se hur filmen ser ut. Puss!
,Ayouni,2011-12-25T19:01Z,"För att få ett eller flera avsnitt i XviD format använde jag mig utav ett så enkelt program som Youtube downloader, riktigt märkligt va men nu kan jag kolla på filmen i min externa hårddisk till tvn. jo jag har också den där cd1 fr en annan torrent som redan är i XviD formatet så jag omformaterade bara avsnitt 3 och 4. det tog lite tid men nu kan jag se HELA filmen och inte bara 13mb på cd2..."
,Ayouni,2011-12-25T19:12Z,"jo en sak till, märkte det att den andra torrenten med cd1 är kraftigt osynkad och väldigt störande ljud så hoppet står till att omformatera även de två första avsnitten"
