User Type,Username,Date,Text
,Prutt,2005-07-29T18:50Z,"I was just now gonna surf the net for some drivers, but.. what do I find here? DRIVERS!!
Excellent! Thanks a lot!!"
,gorillapappa,2005-07-29T19:32Z,lol
,Shiva,2005-07-29T21:46Z,"Great. I was looking for my drivers , didn't know you had them."
,oktan,2005-07-29T21:59Z,hahahahahaha! what a moron this is!
,oktan,2005-07-29T23:32Z,this is not a fucking webhotell u dumb idiot!
,cardioman,2005-07-31T09:40Z,"This is an excellent program that make a backup  of all ur drivers u fuckin lowlife asswhipes!
Stop throwing shit around when ur the pile of shit urselfs!

Great torrent,thanx alot dude:)"
