User Type,Username,Date,Text
,Leonidas_71,2007-10-18T00:20Z,"I stacked on 97,8% PLEASE seed! What a pity to loose it for 96,0 kB..."
,Midnight_Meat_Train,2008-06-02T00:23Z,"someone please seed this, i'm stuck at 97%"
,Ollerman86,2008-09-21T22:24Z,can somebody please seed im stuck at 97 pct... thankyou
,vio-x,2009-02-21T08:41Z,seed you mother fucker....fucking jew's...seed seed seed
,ChangKee,2009-10-06T19:25Z,"wew... hey everybody, did somebody seed on u guys???

ur right, im stuck at 97.8% weew...
pity on usss... somebody seed please...."
,Dince,2010-01-20T09:18Z,"Same thing for me, stuck at 97,8. Please seed!!"
,Mangustays,2010-02-13T16:45Z,"Some seed this please, I am also stuck. "
