User Type,Username,Date,Text
,yesitis,2007-10-01T19:29Z,could someone please tell me which of dick's books are discussed in the doc?
,pkd_arena,2007-10-02T02:46Z,"I Documentary focuses around people who knew PKD personally and his peers.  They discuss many of his works (Valis, Man in a high Castle, Ubik, Do Androids Dream of Electric Sheep? amongst others) interspaced with readings and footage of the man himself.  
"
,mallrat_ld90,2008-02-19T19:36Z,"Haven't dl'd it yet, but sounds really interesting.

Thx!"
