User Type,Username,Date,Text
,eldiablo_666,2006-11-13T22:30Z,EEEeewwww Frank ! .. Iwe seen alot .. but this tops em all !  :) 
,LStone,2006-11-16T09:29Z,"Oh dear god! This almost makes me want to vomit.
A little warning next time Frank!"
,FatFuckFrank,2006-11-16T15:22Z,WTF!; none of you men luv the hot brazilian bootie?
,sonofmogh,2006-12-03T18:48Z,what is it with the video that make you want to vomit? let me know before i download it
,SkAudun,2006-12-26T19:11Z,"this is realy sick! I didnt read the coments, and downloaded this shit. plz put warnings on this type of sick movies! I dont want this type of suprises again! "
,PSIR,2007-01-06T20:55Z,"Scat = Shit = Feces = Bajs in swedish. 
Thats the reason. 

Cute girl strap on action ruined by miss shitsalot.  "
,babuto,2007-05-03T17:02Z,super
