User Type,Username,Date,Text
,rangnar,2005-02-06T17:19Z,Rikigt bra program för alla som arbetar med vektorgrafik.
,janxster,2005-02-16T23:17Z,nice one thank a bunch
,gammgerillan,2005-03-16T21:00Z,serienummret hade varit guld värt :)
,muddy,2005-03-30T04:19Z,"gammgerillan
Serienumret hittar du i 'serial.txt' ..."
,Epex,2005-06-16T18:45Z,Snälla seeda någon :-(
,gris01,2006-01-29T01:10Z,please seed. gracias.
,aramil,2008-08-13T21:45Z,"A seed would be nice
"
,Sampio,2008-09-18T13:32Z,"can anyone tell me what is the serialnumber, please"
,trngw,2011-02-20T16:44Z,"From illustrator CS2 and on this function is included, no need for streamline anymore, and adobe no longer supports it"
