User Type,Username,Date,Text
,scary_bozo,2007-06-17T04:22Z,"doesn't anybody have ""on location - costa del sol""? that's the best one...I'd like to have it."
,johnthehair,2007-07-02T21:05Z,"If you're looking for big tits then this is for you.

If you're looking for anything more don't bother  -  this is softcore."
,spitfire37,2008-02-14T07:44Z,Zoom and pan over not to good looking girls. To mobile camera is not a good thing. This is just not enjoyable. Deleted.
,Giggsy55,2008-12-24T00:50Z,"Nice tits don´t bother anybody, just enjoy tits I love em tits, tits, tits get your cock between them and enjoy the soft mounds."
