User Type,Username,Date,Text
,TreZnor,2006-10-10T20:25Z,AWESOME!
,dahulk12,2006-10-12T14:58Z,Thanks for the reply TreZnor! I love to share what I have with people!. God knows I have found movies and music on here I have been looking for. I'm trying to give cool things back as well!
,pathder2,2006-10-18T00:56Z,"yes yes thank you so very much for sharing these albums :-) i just hope some seeders stick around, iv been wanting to hear Vanessa's music for sometime now, i hear its just beautiful!"
,Tuffturk,2010-05-29T23:09Z,Thanks buddy!
,Onatopa,2010-08-11T19:52Z,Thanks for the UP!
,capahance,2011-04-12T05:30Z,"Yes!  Thank You! I wondered what happened to Vanessa Daou.  In college I listened to ""Zipless"" non-stop!!  Thanks a million!  No clue she had this many albums!"
