User Type,Username,Date,Text
,tcobo,2005-01-20T15:55Z,"Seeda, era fullblodsegoister. Själv har jag  på datorn på nätterna. "
,tcobo,2005-01-23T13:10Z,"Inget har hänt!
Jag rättar in mig i ledet och utgår......!!!!"
,dk-gathering,2005-06-16T03:10Z,i`m seeding it now
,dk-gathering,2005-06-20T01:30Z,and this time stay on so other can download it to
,castob,2005-07-09T22:24Z,"Pleace seed......Jeg er strandet på 95,2....."
,Prettyfly,2006-06-10T14:10Z,"please seed this one i want it bad i will seed
it for some time when i am done..its not much fun too be able too seed with 56 kbs up when you dont have anything too seed.."
