User Type,Username,Date,Text
,duderaven,2006-04-10T12:18Z,"no seeders....so i can not tell you what version it is.....sorry....but if you like kim larsen and or gasolin you should be listening to the live album ""gĂ¸glernes aften - live in scandinavia...""....great album....."
,TigerMale,2006-04-10T13:34Z,"Ye i got that album too, but this version of ""this is my life"" is soooooooooo much better than the live one! "
,kruch,2006-04-22T18:07Z,"Hi TigerMale
It's the version from the LP ""Kim Larsen og Yankeedrengene"" recorded at Lowery Studio, Atlanta USA in 1977.
Sold in Denmark in 1978 (CBS 82090).
Also found on the LP ""Supermix 1"" (Gasolin) from 1980."
,lisanne,2006-11-17T02:11Z,Tusind tak - den manglede jeg ;)
,dennis andersen,2007-05-25T18:19Z,1000 tak ;) det er sku en af de gode gamle 
,dennis andersen,2007-05-25T18:21Z,seed tak sĂĽ vil jeg blive meget glad :D
