User Type,Username,Date,Text
,Porkster,2007-12-24T22:16Z,People should learn about how Zionists killed 100 million Christians in Russia during the communist era.
,tomtomx,2007-12-31T16:25Z,"Yeah right, and at the same time the soviet government persecuted jews in the soviet and armed and trained all of the arab states to crush israel. Zionist my ass. Stupid fuck. "
,Mandell_House,2008-10-01T20:42Z,Please seed...
,Mandell_House,2008-10-30T16:55Z,Please seed--thanks!
,upyoursmamma,2008-11-08T22:10Z,"i am stuck at 98 % would you please be so kind to seed so i can discover for myself how revealing this book is.
thanks a million allready"
[T],moman73,2009-01-09T18:37Z,"Pls seed, I am stuck at 98.8%"
