User Type,Username,Date,Text
,husmusen,2006-04-05T14:02Z,"Tycker enbart rumpan är fin på henne, på vissa bilder liknar hon en anka med sina ""naturliga"" läppar. Men det är ju min åsikt :)"
,greggan44,2006-04-05T19:38Z,anka? snarare pelikan. ;D
,seavalley,2006-04-23T15:50Z,seeda måste se henne please
,seavalley,2006-04-23T16:48Z,"hej tack hon är fin men bilderna 18, 32, 35,27
går inte att se kan ni inte lägga upp dom så att man kan se dom i sin fulla skala 
nice upload tack"
,benke_bus,2006-12-18T03:51Z,seeda snälla!
,JELLY-j,2007-03-18T00:26Z,seeda! är ju enbart 11mb!
