User Type,Username,Date,Text
,GN85,2008-06-02T21:21Z,grrr.... SEED >_
,Drinaloo,2008-07-26T23:59Z,Please seed..
,benduncalf,2008-10-18T08:23Z,hello peoples.. please seed i'd really like to hear this in its entirety!
,CZJames,2009-03-17T13:33Z,"Hey people, seed it please!! I really want to hear this cd..."
,DivineAna,2009-03-18T17:11Z,"Yeah, it'd be fantastic if someone would seed this-- c'mon folks!"
,anna102,2009-09-16T09:09Z,"Lets face it, this atomicblue person is never online to seed this one.."
,Dingodin,2010-05-02T22:30Z,Download it from http://upload.com.ua/get/901598279/
