User Type,Username,Date,Text
,pimpinella,2007-09-17T09:14Z,"Pleas, seed it, I'm stuck at 99,9%"
,estevario,2007-09-17T18:45Z,"seeding does not go beyond 99,9%, don't know why."
,joemjoem,2007-12-20T20:15Z,Can somebody seed?
,johannno,2008-05-22T10:51Z,yes yes please start too SEED
,Pepperon,2008-11-03T21:20Z,"Please, seed it, I'm stuck at 70,6% from weeks.
Thanks!"
,psaikoski,2008-12-14T03:47Z,could somebody seed this file?
,Eluard,2009-02-08T01:32Z,"I am also stuck at 70,6. (And that 3 months after Pepperon reported the same...)
 So please can anyone seed? We would really like to se this masterpease. And thanks for uploading estevario!"
