User Type,Username,Date,Text
,newmax07,2008-10-12T10:28Z,please seed  please seed please seed  please seed 
,newmax07,2008-10-12T10:29Z,please seed  please seed please seed  please seed        
,newmax07,2008-10-12T11:01Z,please seed please seed please seed please seed 
,newmax07,2008-10-12T15:13Z,please seed..... i am stuck at 88%  please  seed....
,newmax07,2008-10-12T18:27Z,please seed..... i am stuck at 88% please seed....      
,boteh_28,2008-12-04T06:24Z,please seed
,LinuxLair,2010-07-17T17:32Z,"To Know More About Linux,friends in India can send an SMS having text:rnrnON LinuxLairrnrnrnto 9870807070rnrnIT\'S FREE!"
