User Type,Username,Date,Text
,venommetal666,2007-04-23T07:19Z,nej det har du inte=)
,Benker11,2007-07-18T11:41Z,"Är de bra kvalite,ljud och textning utan en massa fel stavningar?? :P"
,venommetal666,2007-09-11T17:50Z,"den e rippad från en dvd,utan fel i text å sån crap"
,T-Flipp,2007-10-04T23:17Z,kan du seeda plz?
,d3nniiz,2007-10-30T00:25Z,Seeda! plzplz har brottom
[T],leoman,2007-11-01T07:55Z,är detta 1:an? Från -97?
,juniorjesper,2010-10-07T19:17Z,"Seeda :)
Jag och en kompis ska dl :D"
