User Type,Username,Date,Text
,gilma_x,2007-10-14T17:52Z,any Seeders please ?
,goedkopekees,2009-04-14T14:05Z,"Great movies, thank you!"
,harish74,2010-07-13T15:44Z,Thanx for the trilogy...all gr8 movies
,Parizaat,2010-09-19T04:33Z,"thank you very much frend, for your uploads, such rare and must watch classics are actually prooving  TBP  as mustknow/must use/mustn't down ever platform of worldwideweb."
,vevdare,2011-09-26T06:26Z,thanks thanks 
,magznolia,2012-07-24T01:36Z,Very nice. Seeding all 3. 
,eyehear05,2012-08-15T15:58Z,thanks so much for this one :) downloading all three
