User Type,Username,Date,Text
,Ustav,2006-11-30T18:32Z,Tack
,usco,2006-11-30T23:44Z,Jag lyfter på hatten och säger TACK!
,marlon69,2006-12-01T14:20Z,"Alla tre avsnitten finns även på svt.se i en månand alltså fram till typ 14 dec 2006

Finns avsnitt 2 som torrent?"
,marlon69,2006-12-01T14:25Z,ops! jag missade att alla avsnitt redan fanns! Tack!
,Pk__,2006-12-03T13:47Z,vad heter den sista låten i det här avsnittet? och vilken artist är det?
,marlon69,2006-12-14T12:54Z,Låten heter Bhambahta med Zola. Finns på Soundtracket.
