User Type,Username,Date,Text
,vigeza,2007-06-06T16:06Z,Gyerekek seedelni is kellene nem?!!!
,tata123123123,2007-06-06T16:42Z,"Teljesen igazad van csak szarakodott a gépem, de már itt vagyok ma kb.18.00ig  holnap egész nap"
,tata123123123,2007-06-06T16:44Z,Valakit érdekel meg van az ?ssz. album.
,Abore13,2007-06-16T14:03Z,Sziasztok!A betiltott album megvan valakinek?
,HungaristA,2007-06-24T11:22Z,Engem érdekelne az összes!!
,zeppelin88,2007-09-03T18:25Z,"Sziasztok! Ha ilyen zenéket akartok, haznályatok a magyar trackereket!!! (pl. www.moobs.hu - ez nagyon jó! sok nemzeti dolgok is vannak!!!) minden jót gyerekek! Kitartás!"
,Abore13,2007-09-19T21:38Z,"és tunál küldeni meghivót:),mert már csak azzal lehet felmenni"
,alalala28,2008-01-17T18:39Z,"Létezik betiltott Kárpátia album?
Ki merészelte betiltani és milyen indokkal?! Ez érdekelne!"
