User Type,Username,Date,Text
,HÃ¥kan66,2007-11-09T10:34Z,seeda för fan
,crazy clown,2007-11-13T04:19Z,400 leechers och ingen som seedar vad fan är det för skit!!!
,johooh,2007-11-18T01:39Z,"come on seed the last bit! 

seed för fan... varför ska alla ladda upp en bit och sedan låta alla få vänta??"
,Xion21,2007-11-18T18:20Z,"You lazy gits, how hard is it to leave a damn torrent running after its finished downloading, this takes the piss, how would you toss's like it if we were to do that to you.

fuckin seed, its NOT that hard, jees"
