User Type,Username,Date,Text
[T],themagicke,2007-12-04T23:38Z,"It's very annoying that you can't edit these descriptions once you've posted here on TPB... ah well, there's a grammatical error.

Is anyone else out there stoned too..? =)"
,Tubbytwotoes,2008-01-17T12:32Z,"Not stoned right now, but would love to be
Just wanted to say thank you a million times over, the magicke really is !!!!!!!
Your torrents are the best, all of them. 
Sincerely a music fanatic
Keep keeping it real brother
Peace "
,Speaker4TheDead,2008-12-02T14:22Z,"Thanxz
I Love The Doors
And I Study Evolution
Put 'em together and whaddya get...?"
