User Type,Username,Date,Text
,xerxes97,2005-05-10T12:51Z,"Tackar, ska bli spännade o se vad du bjuder på nästa gång. Rocka på"
[T],Lurwas,2005-05-10T22:19Z,"kör en limited edition remix skiva från batman & robin låtarna, the end is the beginning is the end.. 
grymma låtar för övrigt! fast detta är ju som sagt remixes.. men jag tycker att dem är riktigt bra dem med! 
hög kvallitet på mixen och mörk stämning =)

skall bara hoppa i duschen.. sedan så skall jag rippa och lägga upp =)"
,pada,2005-05-10T23:31Z,tackar
,nutmegggggg,2012-08-29T21:31Z,wow I cant understand anything you guys are saying lol. Let's hope it's good though cause I'm about to get this torrent!
