User Type,Username,Date,Text
,madjock56R,2007-01-20T01:33Z,"At least put in an IMDB link or something, christ talk about making an effort."
,m0j0_72,2007-01-20T02:20Z,"Yeah, there were two movies released in 2006 called Bloody Mary.  It'd be nice to know which one this is."
,madjock56R,2007-01-20T02:33Z,"Bloody.Mary.2006.DVDSCR.XviD-ReCode

http://www.imdb.com/title/tt0469684/

Hell Hath No Fury Like A Woman Scorned.
To Release The Greatest Evil On Earth All You Have To Do Is Say Her Name "
[T],Knaster,2007-01-20T05:24Z,Bloody Mary Bloody Mary Bloody Mary Bloody Mary...........I dont dare to say any more
,BeppasWolgas,2007-01-20T20:09Z,"Sounds a little bit like Candyman, that was a great movie, doubt this one's any good! Comments please?"
