User Type,Username,Date,Text
,Peracer,2006-12-17T21:27Z,yeah that's fantastic
,karekare,2006-12-18T16:22Z,"Thank you wmjoabe. Waited ages for this one. :)
Only hope it's good quality. Btw, is this PAL or NTSC?"
,pinkpantress,2006-12-19T20:56Z,It's also fantastic that there are always a few retards complaining about seed. Most of those retards have never ever uploaded anything themselves.
,maew4,2007-07-06T09:35Z,Please seed. Stuck at 99%
,maew4,2007-07-06T09:48Z,"Pinkpantrees. ""It's also fantastic that there are always a few retards complaining about seed. Most of those retards have never ever uploaded anything themselves. 
"" I understand that this comment come from you. You have only uploadet one file, two years ago, and from the comments, you are doing a poor job seeding this single file."
