User Type,Username,Date,Text
,xxxUltraZxxx,2006-10-01T17:28Z,"Snabb som ""*#!#&&!!!"" , Grym relle! Aiiight!"
,Malakas,2006-10-01T17:45Z,uppe strax!
,Malakas,2006-10-01T17:57Z,sådär happy downloading :)
,LOOPTROOP,2006-10-01T21:54Z,Seeda så gör jag de.
,p0lak,2006-10-01T22:33Z,"Ni som tankar nu, uppa fan då oxå!"
,Malakas,2006-10-02T09:45Z,"This DVD gives you a little insight in the train/street graffitiscene in Stockholm, Gothenburg, Malmoe and Oslo 2006.
Some of the crews involved are: Vimoa, Aod, Kh, Y2k, Fy, Ner, Ocf, Fags, All, Fos and Ae.
The DVD is approx. 1 hour long."
,grekkoz,2006-10-03T16:24Z,"men era fetton, fortsätt seeda när ni är klara."
,alexlaine,2006-10-18T19:16Z,seeda snälla ! :D måste fan ha den !
