User Type,Username,Date,Text
,lunaticslave,2007-09-12T04:58Z,"I been a J-rock/J-metal/J-pop follower for more than 15 years, and decided to share some of my fav collections with you guys =).

Il be uploading more soon, please enjoy and help seeding when you end."
,lunaticslave,2007-09-12T05:49Z,"go to  http://thepiratebay.org/user/lunaticslave/

to check if i have uploaded anything new. I'l keep uploading Japanese music quite often. Happy downloading!"
,remoneedo,2007-09-24T14:29Z,hey please seed. i wish to get this torrent done. please seed! thanks!
,Freddy_X-Japan,2008-02-10T19:05Z,Thnx man ! You made my day have heard this band for the first time today and it just felt like real and powerful music. And now i have all there albums. Carpe Diem man ! 
,musiccreativity,2008-02-13T01:31Z,"Luna Sea is ok but NOTHING compared to Oomori Kinuko and the 80s and early japanese pop music. Can we talk lunaticslave i would really enjoy it, lufia3@hotma_ _.com"
,ministryhellie,2009-03-30T23:44Z,thank you for this 
,viav,2010-12-01T00:16Z,thx ppl x) i ll seed as much as I can
,ManOfSkate,2011-10-04T17:08Z,Thank you. :3
,astronotbumi,2012-03-16T04:57Z,Thank you... Thank you very very much...!!! I've been listening to their song since 2000!
