User Type,Username,Date,Text
,your,2005-06-17T13:27Z,No seed since the post.....where are you man ?
,JBHunter,2005-06-23T16:40Z,now it work's
,JBHunter,2005-06-24T08:34Z,Seed g채rna efter att ni laddat ner den.
,blank15,2006-02-15T19:18Z,What's up with that! bro ?
,Niltech,2007-02-16T17:11Z,hey. how can i get vue 5 to work?? please help
,xIntruderx,2007-08-22T15:13Z,anyone have Vue 6 Esprit?
,de_e_najs,2007-10-17T22:15Z,i can't get it 2 work. when i double click on the icon it loads and then nothing more hapends. Help!
,de_e_najs,2007-10-17T22:17Z,JBHunter can you help me?
,adikted1208,2008-04-18T09:11Z,"seed plz!!!
only 3 kb/s..."
,jforsgren,2008-10-20T09:55Z,did anyone find out how to fix the startup problem?
,netweasel,2009-02-04T21:55Z,works great .. no problems ... thankx!! :-)
,teladoy,2010-01-20T06:23Z,Netwesel you are lier 
