User Type,Username,Date,Text
,gorbyrace,2006-05-04T21:03Z,s책d채r bra please seed
,RamY92,2008-02-02T20:54Z,"hey.... can u send me a link of ur Def Jam Fight for NY torrent?

i need it...

\\\\\\\\\\\\\

hey, kan du sende meg en link til din Def Jam Fight for NY torrent?

jeg trenger den..."
,RamY92,2008-02-02T20:55Z,"by the way, my email is: Rami.S@live.com


PLEASE, send me the link and then u seed it;)"
,RamY92,2008-02-02T20:56Z,"my email is: Rami.S@live.com

send the link for Def Jam Fight for NY there;)"
,Ugotit,2008-05-25T18:20Z,Can someone please seed this torrent?
