User Type,Username,Date,Text
,Asmachilca,2006-11-06T07:44Z,"A lady over 40, with breasts greater than the rest of her body. No beauty at all. Some kind of curious thing. For connosieurs only."
,harry7777,2007-06-23T11:42Z,100% stunning big-boobed goddess.
,craxkz354,2007-07-25T07:10Z,"If you are a boob lover. Milena velba got huge & nice looking boobs.
Also check out www.milena-velba.de"
,krisapin,2008-05-20T19:09Z,could someone please seed this? I'm stuck at 27%
,ejidal,2010-02-11T03:05Z,"The biggest, most beautiful mounds you'll ever see.  Pure tit godess."
