User Type,Username,Date,Text
,boyslife,2005-02-28T14:07Z,Helt utrolig bra album!
,poparanoya,2005-02-28T23:58Z,"Grymt bra platta.
Isis kommer hit till sverige i maj köp biljetter direkt.det har jag gjort.

Kolla även in deras sido prylar och deras skivor innan den här.Allt är bra."
,Devilman,2005-03-16T20:23Z,"Jag såg dem live senast de var i Sverige, och ska givetvis se dem igen. För er som ska på Roskilde, missa dem för f*n inte. Håller med föregående kommentar, kolla upp Old man gloom, Red sparowes....."
