User Type,Username,Date,Text
,StoneMonk,2006-11-27T21:37Z,"is there somewhere we can go to find out what is in this rar?
I like mashups, and am looking for a specific one, but I'm not going to d/l 12gigs of files for 1 song."
,Stonebender,2008-04-19T21:38Z,"Seed Please, I'd like to check these out, but I've been stuck at 52% for several weeks.
Thanks!"
,Harmltc,2008-10-28T11:11Z,"Please seed this one and the other mashup-vol files!
If somebody would seed this one for the coming week or a few days i owe him a great thanks.
I will seed it myself till share ratio reaches 2!"
,rjay49,2009-02-05T17:31Z,"The songs in this torrent are all from this site, which streams them all and can be downloaded for free:  http://goodblimey.com/tunes/"
