User Type,Username,Date,Text
,ehbreno,2006-12-06T20:03Z,"Whats wrong with Spain? Can't you guys read subtitles on your own language, 
why is it dubbed? Don't you think you're ruining a movie if you watch it dubbed? And we other
Hate to Spain, germany and all other looser dubbing-nations."
,carpanetti,2006-12-07T08:38Z,"VILL DU HA NYA DVDR SÖK PÅ Google SwePiracy VI HAR ALLT NYTT!
DET ÄR BARA TILL ATT REGGA SIG!"
,BigRed777,2009-06-20T21:34Z,"ehbreno, there are people that are deaf, if you didn't know it."
