User Type,Username,Date,Text
[V],zebbbo,2006-04-05T22:15Z,Tack brokep!
,baZo`,2006-04-05T22:39Z,sånt här är alltid bra ^^b
,White_Warrior,2006-04-05T23:26Z,"Om jag har fattat detta rätt, så kan inte P-byrån göra nåt sålänge som man delar en fil eller massa filer i en torrent-fil? :D Eller?"
[V],GreyRaven,2006-04-06T03:29Z,"White_Warrior, Jag är inte riktigt säker på hur du menade med att ""P-byrån göra nåt sålänge som man delar en fil eller massa filer i en torrent-fil"" om du menar att AntiPirat byrån inte kan göra nått åt det är förvisso sant, i med att ingen kan urskilja hur många det är som delar filen. P-byrån om fallet du menar Piratbyrån så har du nog trampat i klaveret :), Thepiratebay skapades av piratbyrån från början men är nu ett eget organ. :)"
[V],GreyRaven,2006-04-06T03:33Z,"gah, lol försök skriva med rent huvud är inte lätt så här tidigt på morgonen. :P"
[V],lastie,2006-04-06T23:16Z,snygga skor rasmus.. var köpte du dom? hur mycket kostade dom?
