User Type,Username,Date,Text
,AdolfPancake,2007-05-08T03:45Z,"Gah, I know I'm really late with downloading this, but could someone seed?  Please, and thanks in advance."
,red_laces,2008-01-23T18:59Z,"Seed FFS! I want this, be true vikings and help your fellow nordic countrymen!!! :D"
,aTeE666,2008-02-26T20:16Z,ooohhh plss SEED i need it :D
,musicNYC,2008-11-19T10:49Z,very VERY talented band. a friend of mine knows them so booked them over here in NYC. awesome guys too.
,Malacht,2010-08-12T01:07Z,"could you please seed, sombody, anybody."
,Malacht,2010-08-15T16:11Z,i need a seeder please
