User Type,Username,Date,Text
,Cephaus,2008-02-01T01:08Z,Good shit
,sarkofag,2008-02-11T20:56Z,Top quality. Great upload!
,spicyNfiesty,2008-02-23T18:29Z,quick dl!  320 kbps as you said.  
,captainwest,2008-03-03T09:59Z,My Daughter appreciates the better quality sound & the fact you included a link from the oppositions window lol
,kanonkas,2008-03-27T13:01Z,"can you please upload: Slumber Party Sing-Along Volume 1   -- I can't find it anywhere!
Thanks if you do!"
,EZCool,2008-04-09T19:41Z,"Thanks, downloading now. :)"
,caznelson,2008-07-13T17:53Z,Thanks for download appreciated
,shbb89,2008-07-23T11:18Z,Thanks!
,fuelbomb,2009-01-05T17:41Z,"good quality, but is it so hard to include the track number in the filenames?"
,shyam2020,2009-08-03T19:48Z,"Awesome Quality.. Great Work... Especially the tracks Apologise(Orig and Timbaland) are proper rips.. Flawless..

10/10"
,MrWhite2,2010-08-24T23:21Z,"Perfect (I do like numbers in file names too, but that is petty :P )"
,austin6598,2011-06-22T22:45Z,"great torrent
lol its funny how captainwest  is raising a daughter getting free music ahem ya great way to raise her 
btw this is not legal "
