User Type,Username,Date,Text
,suckmyballs,2006-12-05T10:31Z,Thank You!
,nadymo90,2006-12-17T12:37Z,this is real nice thank you
,nadymo90,2006-12-17T12:37Z,do you have more? greetings hans
,thaieiler,2006-12-23T18:30Z,Can somone help me with manual for E30?
,_Mac_,2007-07-06T17:22Z,"This is obsolete.  The DVD is now available.
http://thepiratebay.org/tor/3734337/BMW_RepROM_R-Model_5th_Edition"
,Oglomite,2007-07-23T23:47Z,"_Mac_ : You know you can delete the torrent? Just check the small red cross, to the right, above the torrent header. You need to be logged in.
Thanks for the nice initiative"
