User Type,Username,Date,Text
,Herman_von_Salza,2007-01-14T14:04Z,over 400 snatches and not one coment!?!?!?
,Malicious81,2007-05-02T09:58Z,"Havent finished DL it yet, but tnx anyway :D"
,kookamongu ,2009-03-11T01:14Z,"Sinnsykt fett! Husker godt når dette gikk på radio. Vi tok det opp på kassett men kassettene er jo borte... Hvis du har flere så må du gjerne legge dem ut :)

Tusen takk!"
,Herman_von_Salza,2009-07-08T01:30Z,"Har desverre bare denne ene.

Men siden jeg har Tv hjemme så gjør det jo ikke noe"
