User Type,Username,Date,Text
,torrenting,2007-02-23T17:59Z,"Maybe not the best movie, currently #17 worst rated movie on IMDb, but this release by PUKKA looks excellent. Video has a resolution of 640×352 and a bitrate of 898 kbps. Audio is great at 192 kbps AC3. Very nice R5 from PUKKA once again.

For screenshots and nfo: http://www.hypoh.com/movies/r5/vanwilder2r5xvid-pukka"
,Lillego,2007-02-23T18:34Z,Maybe you can do as you always foes and make the fridays complete and put up Greys Anatomy?
,sweetjohan,2007-02-23T20:45Z,rerfewdfdsfdfds
,tatsudoshi,2007-02-24T11:56Z,http://www.imdb.com/title/tt0480271/
,Cowb0y,2007-02-25T23:50Z,"Ny site för Svenskar. Kolla kvaliteten på rellen innan du laddar ner. Kvalle.se 
Läs om kvallen på Van Wilder här: 
http://www.kvalle.se/2007/02/25/van-wilder-2-r5-xvid-pukka/"
