User Type,Username,Date,Text
,thelost,2006-03-12T03:06Z,"oh yes, forgot to mention incase anyone is interested the musician who does it is maxence cyrin and if anyone is interested i'll upload the full album. has a classic rendition of Jaguar by Rolando"
,krum,2006-03-12T10:55Z,"cool thanks. theres a complete cd of the london philharmonic orchestra playing aphex twin tracks, but HMV only has it as an 'import' so it's v. expensive."
,jiggy_247,2006-03-12T18:33Z,"Classic Jaguar?!!? Gimme that album!!!
thnx 4 this m8"
,JaymiUSA,2006-03-25T06:28Z,Bitchin'.  I got turned on the these guys listening to KJHK in Lawrence KS.  All I can say is sweet.  Keep em coming.  Thanks Tons.  Peace
,playerthe2nd,2008-04-07T22:20Z,you should seriously upload the whole album!
