User Type,Username,Date,Text
,dj fiesta,2006-12-09T12:37Z,thanks
,nirve1,2006-12-27T17:41Z,pou tin vrikes?
,ASSOL,2007-02-26T15:42Z,thanks
,efthlouk,2007-04-29T13:45Z,re paidia kapoios seed...!to katevazo 1 mera kai einai sto 45%!eleos!plz seed
,EvilErnie,2007-06-22T21:18Z,re paidia kserete pu na katevasw to Soundtrack?
,CrAcKeZ,2008-05-21T16:47Z,"leei tipota i poiotita? (epidi info den blepo)


Kamia ali tainia elliniki? p.x ""molis xorisame"" 'h ""loufa kai apallagh"" ?

Y.G. Gmt eimai ektos Ellados kai den mporo na tis bro :("
,shani3596,2011-02-20T14:14Z,seed paidia mono apo edw boro na tin katevasw exw faei ton topo........ plzzzzzzzz
,shani3596,2011-02-20T14:49Z,epitelo0c katevike....!!!:D
