User Type,Username,Date,Text
,MPalle,2005-01-11T09:34Z,var är episode 3??
,prins_valle,2005-01-11T09:37Z,"Dra ner avsnitten från http://btefnet.net/ istället.

Där finns avsnitt 1-4 också, just med 4322 seeders på avsnitt 1 så det borde ju ganska fort också."
,Perius,2005-01-11T14:09Z,Anbefaler www.tvtorrents.tv til serier.
,cobe,2005-01-11T14:46Z,"e03 ska ligga precis ovanför. Sök, och du skall finna.

Vet inte hur de andra sajterna/irc-kanalerna har det med rar-rels - de flesta, inklusive TPB, är tyvärr väldigt dåliga på att skilja på uppackat eller amatörproducerat skit och riktiga, rar-packade, officiella, kvalitetssäkrade rels."
,BlackDiamond,2005-01-18T14:31Z,Tack Prins Valle för tipset :D
,Japina,2005-01-27T15:43Z,Varför min download stoppar för 99%
,Markus_Odhner,2007-04-07T23:33Z,"okok
 du hade rätt :P haha men men skit i det:P"
