User Type,Username,Date,Text
[V],Zapf,2006-01-11T13:28Z,Nazi spam. Ideologi for deg som ble knullet av far. Innavl = liten IQ.
,mito2005,2006-01-11T14:03Z,88
,Rainstalker,2006-01-11T17:16Z,"Nazi spam..!?! ""deg"" , ""knullet"" ?? What is this? You on some kind of drugs??"
,Lugubrizione,2006-01-13T19:06Z,"I assume WP stands for White Power or something similar. It's sad, really... Ignorance might sometimes be bliss, except for those affected by the stupid mofo's..."
,Lugubrizione,2006-01-13T19:12Z,"Rainstalker: I suppose Zapf are referring to the ""keep white ppl white"" bullshit that ppl who sometimes gather around a svastika has been told. For anyone with a minimal skill in biology, the idea to diversify is the better one for getting a good end result. "
,white-wolf,2006-08-24T01:00Z,"Gött att några ser klart på Bitten åxå :)
HELL SEGER!"
,wighen,2007-02-15T01:47Z,Snälla seeda alla dina torrents PLEASE! jag vill ha jag vill ha :D
