User Type,Username,Date,Text
,Misco10,2005-02-06T13:14Z,Har någon testat liret med Viper?
,a19610101,2005-03-07T10:59Z,"Kan någon seeda lite, finns bara c:a 90 % av filen just nu."
,stromling,2006-03-28T10:06Z,kan nån seeda lite?? har varit fast på 99.5% i över en vecka :(
,viraldna,2006-04-08T18:58Z,I mean 99.5% sorry
,Meatloaf92,2006-05-30T15:46Z,Tar det lang tid å laste ned denne? Hvor mye i nedlasting har dere...
,monkynia,2006-06-17T05:11Z,Please seed stuck at 99.5
,Lord_Exide124,2006-08-02T19:46Z,testat med xeno någon???
,attila23,2006-10-01T17:41Z,Please seed stuck at 99.5
,feelme1212,2010-09-19T03:07Z,PLS SEED!!
