User Type,Username,Date,Text
,camarols6,2005-01-15T11:53Z,har laddat hem ogg vorbis och instalerat det men kan inte köra igång det. Om någon vet vad som kan va felet så skulle lite tips uppskattas. 
,blargh99,2005-01-15T17:18Z,AFAIK så skall Winamp spela Ogg Vorbis by default.
,Holmer,2005-04-19T21:30Z,Grymt initiativ! Desvärre är det nåt knas som gör det omöjligt att komma åt den här via trackern. Ere nån som har tips om hur jag kommer runt det vore jag tacksam.
,gibbog,2005-06-13T22:54Z,Thanks!!
,MickDagger,2006-01-22T03:31Z,"Thanks!  (Although, I was curious what you meant by ""windows friendly"" and what impact that had on the files for non-windows, if any.)"
