User Type,Username,Date,Text
,bb-gun,2006-10-08T00:13Z,is there swede subs??
,DjZiLk,2006-10-18T03:23Z,no dumd ass when it says its not ANY subs. it is most defenetly not swed subs...haha
,Cederholm,2006-10-25T15:39Z,seed please iam on 4 kb/s
,Elmialmo,2006-11-18T16:23Z,plz seed:)
,O.G. Crip CPT 4 Life,2006-12-04T20:42Z,this video is the best video ever
,Pirate like is-cream,2007-04-14T20:03Z,"What is Seeds?

I dont now so much about this?
if seeds is good plz seeds me

Hva er seeds? hvis det er bra plz seeds meg! det hĂ¸res ut som at det er bra sĂĽ ber deg."
,G-STAR01,2007-06-26T17:54Z,"i need peers and seeds.
post them u arshole
why do u write 11seeders if it only gives 2
are u stupid"
,shadow995,2007-10-03T00:10Z,seed plz im dying here
