User Type,Username,Date,Text
,ferarrifeet,2007-12-29T19:40Z,anybody got any feedback on this.
,cybergyerek,2007-12-30T06:29Z,hacktool.win32.agent.cx
[T],botpet,2007-12-30T13:32Z,"Hacktool means that this tool help you to hack up the program (in this situation).
This tool make you easier to veiw you keys if they are blacklisted.
/sorry for my english/"
,goodyme,2008-07-29T21:00Z,this is a good program but it neraly stoped working for me
,goodyme,2008-07-29T21:00Z,this is a good program but it nearly stopped working for me
