User Type,Username,Date,Text
,eric36m,2007-03-26T23:15Z,"Tack för uppladdningen!

Kan någon lägga ut extramaterialet på ytterligare 4 timmar?"
,dallenan,2007-03-27T06:20Z,Tack som f_n för denna. Har 2:an försvunnit? Kan du lägga upp den igen?
,Filibom,2007-03-27T06:34Z,"Tack för upplägget av denna svit.
Ska bli intressant att se vad denne figur egentligen tänker, när han inte är ute efter att dupera arbetarklassen."
,Hoffa-1,2010-06-03T22:57Z,"Snälla!  Seeda, vill väldigt gärna ha denna dokumentärserie.
Tack på förhand!

Tack för suveräna uppladdningar!"
,Napoje,2011-10-15T13:40Z,Är detta den sista delen i serien?
