User Type,Username,Date,Text
,drys,2006-10-08T15:47Z,This  want quicktime and says virtual mem atleast  3 mb Free.  error. on XP :(
,Strict,2006-10-09T08:25Z,Ok......poker is working.....but you can't see the girls...or hear them talk.
,allright335,2006-12-21T13:40Z,WHAT THE FUCK!!! IT SAYS I NEED 3MB SPACE I HAVE 634GB LEFT!! WHAT THE HELL IS THIS SHIT???????????????????????
,coraxvtl,2007-05-24T03:48Z,"Use this:
http://www.pokai.com/support.html"
,coraxvtl,2007-05-24T04:05Z,"Never Mind, the game sucks anyway"
,tuberider73,2008-06-04T06:40Z,"Successfully installed, but it ask for the CD. Any idea, any help? thanxx in advance."
,Dinky_Peters,2010-05-21T02:50Z,wow these women are old and ugly.
