User Type,Username,Date,Text
,share2,2007-10-03T10:13Z,nån som kan lägga up nya Thorleifs skivan ?? 
,cradle,2007-10-03T11:55Z,"Whant Speed?       Go TiAMO

warning Thorleifs may cause friction burs in your ears..."
,OlleFläns,2007-10-03T17:54Z,"Share2: Nää, men vi lägger gärna ner hela d-a Thorleif! "
,Liak,2007-10-03T18:32Z,A+++++ fast seed. would download again.
,jeromedevine,2007-10-05T00:30Z,Hey Nephropathia thanks very much for posting the subtitles much appreciate it buddy Thanks your the best !!!!!
,marlicone,2007-10-06T14:59Z,"English subtitle for this release @ MoTechSubs:

http://subs.motechnet.com/title/tt0412142/"
,davewill,2008-02-02T03:15Z,Thanks
,johnnyp7,2009-02-06T20:50Z,thankyou
