User Type,Username,Date,Text
,zaiba,2006-01-03T21:35Z,doest it work on 1.5 firmware?
,_champloo_,2006-01-05T00:38Z,"OMG!!! this has to work on 1.5, or else i'm importing. EoE and evangelions to kick ass with!!! HELL YES (FYI, my fav. anime is evangelion) (T^T)"
,Sontiago,2006-01-08T17:01Z,Could someone please verify if this works on 1.5 with the bootloaders?
,Gladiatorxxx,2006-01-08T19:20Z,"this game is not working !!
i try with UMD emulator 
systeem menu ot work
direcht load en copy load not work !"
