User Type,Username,Date,Text
,fidel_funk,2006-04-10T13:22Z,Hey there... pleazeee seeddddd this baby
,-Aenima-,2006-05-23T02:53Z,"Plz seed! I´m stuck at 99,2%"
,Team CSC,2006-06-24T20:23Z,"Kom igen seeda då! Är fast på 99,2 %!
Pleas seed im stuck at 99,2 %!"
,deathbert,2006-09-01T04:58Z,"Everyone seed so i can get it too, even if you're not done :)"
,deathbert,2006-09-23T15:50Z,i'm stuck at 99.3% too :( PLEASE see this who ever has the whole thing!
,sb_stefan,2007-04-09T13:24Z,Kan nån vara vänlig att seeda denna????!!
,sb_stefan,2007-04-11T18:05Z,PLEASE SEED!! I'm dying to get this one!
,arnthorla,2007-07-10T18:27Z,"You can find Höllentour at 
http://helltorrent.no-ip.biz
You just have to register and search for höllentour. 

Happy loading! :)"
,quill7111,2008-06-30T11:58Z,Please seed! Stuck at 99%!
