User Type,Username,Date,Text
,keeben,2007-01-10T10:37Z,Lots of sperm here :D
,speakeasy,2007-01-11T01:27Z,And somebody using a decent service to post images - thanks for that.
,ticktock_man,2007-01-12T05:06Z,"why do you need to convince them? most will take it, and those that dont you blow your wad in their face regardless, since theyre not a keeper anyways :) "
,clambert030,2007-01-13T09:46Z,"Basically, 45m of facials.  Some damn fine ones in there though!"
,czechmate67,2007-04-04T01:44Z,Horrible music why do these death metal sh1theads not take the micropohone out of their mouths? It might sound better?
,durinsvloek,2007-10-28T11:15Z,"The first metal song has a kinda fun title in combination with the video: ""spit it out""...
the others I didn't recognize... in one they keep ""singing"" look away :P"
,wackedchewbacca,2008-04-15T09:23Z,"Musics better than that corny porn shite, 
Tracklisting Anyone?"
[V],bestec1234,2009-07-13T22:05Z,"Yeah I watch this one with the sound down.  

Does anyone know who the woman is at the following times:

19:49
24:14
29:11
33:05

She's a very, VERY cute brunette who appears to be enjoying herself...  I'd love to know who she is so I can find more of her.

I see, BTW that there are no seeders here.  I have the video, but not three files... so I could re-upload this one, but not seed. :(  "
