User Type,Username,Date,Text
,overmuch,2007-02-25T20:09Z,"Anyone who have the song/melody by Ennio Morricone from the 1978 football World Cup, i think its called ""Mundial"" ????"
,Lord_Kamiizumi,2007-02-26T17:35Z,I need seeds please...
,michaelcrs,2007-12-29T01:44Z,"Clean download, no spyware. Beautiful movie btw, loved robert deniro"
,fredfan,2009-08-31T15:40Z,"Absolutely beautiful.  Helped out in finding an instrumental for ""Nella Fantasia"" which is reprised in the themes throughout this soundtrack, but notably in the two versions of ""Gabriel's Oboe.""

Thanks so much!"
