User Type,Username,Date,Text
,mrdunworthy,2006-11-02T22:49Z,"http://www.stacken.kth.se/~maxz/valerian/albums.html -- Pardon, mais sont-ils en français ou anglais? -- are they english or french? English yes?"
,Blue_Mage,2006-11-02T23:02Z,Nope. Ils sont français. They've been salvaged from the original torrent. Unfortunately the last image from Cite des Eaux Mouvantes is unrecoverable.
,mrdunworthy,2006-11-02T23:07Z,Thx! Never heard/seen these before. Looks very interesting. Downloading and seeding.. Thanx again for nice upload :)
,540,2006-11-02T23:15Z,Synd att de är på franska. Jag hade de flesta på svenska en gång i tiden men lånade efterhand ut alla. Men ändock en kulturgärning för dem som kan galliska.
,mrdunworthy,2006-11-02T23:26Z,"540, Själv tänkte jag försöka fräscha upp mina 100 ord franska/galliska med dessa. Man får bilder ""till"" så att säga. Såg Asterix på Latin en gång, men de kostade apa tyvärr. | "
,540,2006-11-03T00:10Z,"mrdunworthy: Quelle spirit! Je suis tres inspirerad och tittade lite snabbt i en av filerna och comprend á mon surprise un part. Deux signe den termin francaise je dans la antique genomled, synd att jeu fin. :)"
,mercyfulfate83,2007-02-08T19:53Z,Merci BLUE MAGE pour ce torrent intemporel !!!!
