User Type,Username,Date,Text
,petillero,2006-03-14T19:41Z,languaje?
,dizzeenr1,2006-03-14T19:59Z,English
,berkomannen,2006-03-14T21:36Z,my dosnt work.. i got kaspersky personal pro 5.0.385.. it only asks me if i want to remove the old kaspersky.. i tried that and then it dosnt work.. what to do??
,SIRMASTERD.J,2006-03-14T22:34Z,GRRRR.....this must have a new key....key doesn´t work with old activation..give me key please!!! 
,dizzeenr1,2006-03-15T15:00Z,yes it does work with old activation.!
,SWG 2005,2006-03-27T20:32Z,It works for me:) Thx a lot for this program! Love it... Like dizzeenr1 write it does work with old activation
