User Type,Username,Date,Text
,byblos,2007-02-13T16:51Z,Request: Sky Simulations MD-11 for FS2004
,byblos,2007-02-13T16:52Z,Pleeeeeeease ! :-)
,sakuto,2007-02-13T17:13Z,Hi Craig you are a very big pirate!
,yo7,2007-02-13T18:20Z,"REquest the new:md-11 skysimulation http://secure.simmarket.com/product_info.php?products_id=2232

:) thanks "
,cardo519,2007-02-15T09:09Z,"this is garbage, go to CYXU for an example, there is no other buildings around the airport in real life, plus there is a lake too"
,jonasbeaver,2007-02-22T17:36Z,"There are a few low factory type things, and the lake around the airport has to be done with an ultimate terrain type product, or FSX vector europe/usa can fix it... but we haven't seen FSX vector Canada yet"
,FL280_DCP,2007-03-06T00:27Z,REQ: FSX xclass USA
,toshibct,2008-02-10T12:30Z,Request ! cloud9 xclass Afria/Asia !!
,maximus92,2008-11-22T06:28Z,Can anyone seed this?  Stuck at 91.4%.
,guitargamery,2009-05-07T07:20Z,"nice torrent tx!!i have it and works nice, people have a look at my fsx videos in youtube-guitargamery i can be wrong but they kickass the are simply a must!!! lol tx"
