User Type,Username,Date,Text
,Z-2004,2006-11-26T00:27Z,http://www.filemirrors.com/search.src?file=cs16full_v7.exe&size=282464253
,redhammer,2006-11-27T00:35Z,ALREADY BEEN UPLOADED LIKE 10000 TIMES CHRIST SAKE HOW DUMB CAN U BE NOT SEARCHING FOR A TORRENT BEFORE U UPLOAD SOMETHING THATS ALREADY UPLOADED
,Z-2004,2006-12-01T19:01Z,"i uploaded this for a friend you stupid ungrateful assfuck, ppl started downloading and i kept seedin.."
,havoka,2007-02-11T14:37Z,tack fรถr upploaden hรฅppas bara att den fungerar :D
,Sweely,2009-06-08T23:32Z,Great torrent!
