User Type,Username,Date,Text
,Lasher,2008-01-16T23:11Z,"Cool, I been waiting for this to get reseeded, starting now but no seeds yet. Plz seed, TOA own gabber, keep this alive, I will. "
,CarlMemphis,2008-03-15T14:15Z,"Really kool Machnie Slavery video on youtube
retype this adress in browser as obviously shown: youtubedotcomslashwatch?v=3MKDxDZHepI

Any true gabber would find this interesting.
Great album, wraps up TOA in a neat little black box to stowe away in the closet amongst the other half million skeletons.

Seed 2000%, and spread the word! More hardcore techno on TPB FTW!!!"
,spuddy76,2008-06-26T18:07Z,Class album!!! The acid tracks are f**king amazing....
,meskalinka_5za4,2011-01-25T11:27Z,seed people seed ....PLS!!!
