User Type,Username,Date,Text
,bygdegaard,2004-09-27T18:38Z,nice. thx.
,Clean,2004-09-28T07:09Z,Tackar!
,mster,2004-11-02T21:35Z,"Ursäkta mig... men vad gör man med en *.rfl fil ??? är det en imagefil eller vad är det?

*skäms*"
,Ice-T,2004-11-09T01:18Z,Jag vill med veta vad en RTF fil är ur öppnar man den??? :D
,Ice-T,2004-11-09T01:43Z,RFL fil menar jag :D hehe
,French_Look,2004-11-15T13:41Z,"HEhe, det är ju refill- rfl.....u get the connection? Öppnas å används av Reason."
,paizanoo,2006-11-15T19:54Z,"Heeeeey!

I need Reload, and a keygen for Reason 3.0

Suggestions??"
,Ill Limit,2006-12-15T02:53Z,woot well needed thanks a lot
,VinoVeritas,2007-01-18T23:29Z,"what else is needed for the refill to work...i get nothing but ""bad format"" message and a illigetimate looking refill icon"
,mm4free,2008-05-05T02:55Z,piazanoo...Reason 4 is available w/key.
,mm4free,2008-05-05T02:57Z,Ohh this is an old torrent...no seeds?
,Endtrend,2010-12-26T21:10Z,"For the love of God, someone fucking SEED THIS FOR AN HOUR OR SO...long enough for me to get it then I will take over and seed it. It's only 108Mb, Jeeezzz! "
