User Type,Username,Date,Text
,azazell86,2006-11-04T08:39Z,"Could U please put more Mad Magazine comics on upload......they are great and I cannot find them anywere:)
Great Upload"
,pcy70,2006-11-04T09:51Z,I will. But I have a cheap internet account so it will take some time. (32kB/s up) Please help me seed people. :-) MAD's are indeed very funny.
,Friggebod,2006-11-04T10:35Z,"thank,pcy 70 for this,,please if possible more "
,majtymicke,2006-11-05T00:21Z,Gonna try this and see if the humour in them are as good as the old ones I got from the 80's.
,dr.drummer,2006-12-02T19:18Z,"Thanks! It's great!
Could you please upload more?!"
