User Type,Username,Date,Text
,Corpus,2006-10-01T18:48Z,man tackar!
,nexon_uwh,2006-10-01T19:52Z,seed for fuck everybodey is stuck on 65%
,nvrmnd,2006-10-01T22:02Z,varför seedar ingen? :/
,Pago422,2006-10-01T23:37Z,Det vore trevligt när man lägger upp en torrent om man såg till att några kommer upp i 100% innnan man stänger av datorn :(
,killrr,2006-10-02T05:02Z,det vore trevligt om fler hade sagt tack.. jag kan tyvärr inte råda över vädret och jag är inte heller så sugen på att ha igång datorn när det åskar som fan.. ledsen om ni fick vänta lite längre..
,nvrmnd,2006-10-02T09:04Z,"Alright, ingen fara! Nu vet vi hur det låg till i alla fall. :P 
 Tackar alla som seedade! Fortsätter seeda en stund."
,Erdbeereblau,2006-12-13T12:51Z,Could someone please seed this torrent? Thanks.
