User Type,Username,Date,Text
,ellerhur,2005-04-03T09:01Z,reseed pls...tx
,boogerup,2005-04-04T15:02Z,"There are only 3 movies in the series, but they're pretty nice - very twisted and sadistic."
,smoke_prophete,2006-05-23T09:34Z,"It looks great, I've heard a lot about it, please seed , I sure will when I can ! Thanks y'all !"
,ThrashHell,2007-01-24T22:36Z,Would someone please seed this.
,Alexxxx,2007-08-17T07:36Z,I would really like a reseed on this one. Been looking for these 3 movies for quite a long time now. Cheers
,MassOfKthulu,2009-04-23T19:37Z,Please reseed someone!!
,Bluedawg,2009-05-09T13:33Z,Please reseed. Many thanks!
,cmdowns,2010-01-07T03:32Z,seed please
,GoblinJim,2011-08-04T00:05Z,Would it be possible to get another seed?
