User Type,Username,Date,Text
,digger44,2006-08-12T20:53Z,seed please im stuck at 99.8
,godspeed_you!,2006-08-14T22:34Z,"Ohh thanks!
Great upload and release! I've just checked and quality is superb!!!"
,smoothmachines,2006-12-20T02:10Z,"Thank you very much for a great movie!
I´d like to get rid of the subtitles when suing english audio, is there a way to do that, the menu did not give me any option...
Polanski and Hajime rules!"
,CostelloCostigan,2008-06-24T21:04Z,"This is bullshit, man. This fucking thing took 4 days to download and once it's done it tells me ""Disk Problem"". "
,audrey88,2011-07-31T23:51Z,"Please, seed!"
,barton101,2012-08-14T09:36Z,"Next time, please include English subtitles for the hearing impaired. They are also good for people who don't have English as their first language. Subtitles take up hardly any extra space and they make for more seeders because the torrent is useful to more people."
