User Type,Username,Date,Text
,Djer6666,2006-03-04T07:32Z,"Comme je commencais à trop m'inquieter!!! Ouf, je voila rassuré!!!
Une fois de plus, merci!!!"
,pestekkorna,2006-03-04T09:21Z,"j'ai eu chaud aussi!
mais 5yn est une garantie!
excusez moi pour mon français!
merci encore et à la prochain!
peste"
,monkey42100,2006-03-04T09:23Z,"super boulot comme dab :-)
merci a toi :-)"
,joecool22,2006-03-04T12:23Z,merci beaucoup!! Beau boulot!!
,Dee-Dee,2006-03-04T12:40Z,J'ai pas encore dwl mais déjà merci! !!
,X-Men972,2006-03-04T18:24Z,"Encore une fois merci 5YN, c'est bien toi le meilleur..."
,Kilik,2006-03-05T13:29Z,merci thanks gracias tout ce que tu veux ! :)
,sooty_monster,2006-03-07T02:19Z,speak english??
