User Type,Username,Date,Text
,PSYCHO2008,2007-09-13T20:19Z,"Pls seed after download it doesnt efect you at alll.
You can allways set the upload limit down and then you will be
fine when you downloading.

peace out"
,PSYCHO2008,2007-09-14T12:16Z,Der kommer mere fra mig af med dansk music.. Men kan ikke seede alle sammen saa vis folk er søde at seede saa andre folk kan faa det sangene ville det være rart. HOLD DANSK MUSIC I LIVE
,DoggTack,2007-11-09T21:30Z,"følgende numre er ikke lavet af Suspekt:

Ryst Dit Røvhul (dette nummer er af 4Fod)

Knep Knep, Drik Drik, Hor Hor, Snif Snif (dette nummer er af BullDogg)"
,Hax0ro1,2008-09-25T18:54Z,plx seed /:
