User Type,Username,Date,Text
[V],yatzyman,2006-11-29T00:12Z,Tackar för denna. det finns lite som jag sknar till min eddiesamlig.
,ondsvensk,2006-11-29T00:21Z,"kommer lite mera sen , killen som rippar
banden har fullt upp."
[V],owebratt,2006-11-29T10:44Z,"Tackar !!!

Trodde inte att det fanns så många mer än dom ja hade men där ser man, nu har man ju dubblat  upp :)"
,Klimmpen,2006-12-13T23:15Z,"Hoppas att hejna funk nu, har försökt ladda ner massa eddie låtar osv som ingen jävel seedat >."
,ondsvensk,2007-01-16T10:02Z,http://web.telia.com/~u58113644/Meduza.htm
,ondsvensk,2007-01-16T10:04Z,http://listen.to/errol
,gammelnok1,2007-12-02T01:40Z,Finns dett någon här som den första skiva med eddie meduza. Då skulle jeg bli mycket glad om någon vill lägga opp den på den här sidan. Det är den enda skiva som jeg inte har.
