User Type,Username,Date,Text
,ofblong,2008-01-19T14:52Z,hmm fake?
,mhorton,2008-01-19T22:00Z,Do you have a reason to suggest it is fake?
,macfan99,2008-01-19T23:41Z,All the plugins and transitions don't work after applying the crack. Updated the corporate version. Any idea?
,brenyoka,2008-01-20T00:38Z,"after updating the 8.0a corporate, trial period starts again...how did you update successfully?"
,wackopath,2008-01-20T00:54Z,"NoPE cracks sucks mayor ass!
search for the DI (DigitalInsanity) patch+keygen
they work 100% flawless! 

Peace!"
