User Type,Username,Date,Text
,ingerlise,2008-04-18T00:53Z,you are a legend! thank you!
,sparky1sparky,2008-09-25T20:51Z,Please Seed! I've been trying for over a week to get the 3 Volumes. My little one is ga-ga over the Wiggles. Please and thank you!
,sparky1sparky,2008-10-09T14:19Z,"tmsboys, you're terrific. Thanks so much for taking the time to put the 3 volumes together.

THANK YOU Seeders!! 

After 3 weeks of trying, I finally got all 3 of your Volumes. Happy as a clam!

They're all clean and perform perfectly.

I'll seed for at least another week for others in the same boat. 
"
