User Type,Username,Date,Text
,lugz,2007-12-04T03:12Z,"trailer:

http://www.megavideo.com/?v=OO28ZENA"
,nobends,2007-12-04T11:17Z,"thx lugz i forgot bout the trailer :P

thx for the comment "
,amaze3,2007-12-06T08:07Z,hows the quality? anyone?
,Wetbones,2007-12-08T07:43Z,"He already said that the quality is ""grate""."
,ston3r,2007-12-10T18:38Z,"Torrent worked on WM Player and GOM Players

It's watchable....high contrast and you can sometimes here the crowd but all in all good enough to watch....what do you expect its a CAM!

Video 5/10
Sound 5/10

smoke a blunt!"
,drsims,2007-12-14T07:51Z,THANKS..BRO BUT DONT TAZE ME...LOLOL
,nobends,2007-12-22T16:59Z,thx for the comments guys nice to see so many seeders :)
,ministerbob,2008-01-16T14:26Z,"Bad quality. Wait for better.
Thanks for a good movie anyway!!
"
,Raulll87,2008-01-18T02:40Z,Does anyone know where to find a dvd screener or dvd quality of The Mist? Thanks.
