User Type,Username,Date,Text
,jbergh,2008-06-18T13:55Z,"hah all three? you do know that Mushroomhead has 6 albums right? what you have here is the 3 most recent albums... look for SuperBuick, M3 and Mushroomhead, good albums"
,xXsplinterheadXx,2008-09-14T06:24Z,"arghhh why why why rar. well imma be a hit n run kuza u, fuck i dont have space to watse"
,checkle1,2008-12-19T09:12Z,"damn it, superbuick is the one that i want and noone has it"
,JaMSta,2009-02-05T06:11Z,yea superbuick is really hard to find considering it cost an average of $40.00 and no 1 on tpb is willing to buy and upload it and i dont blame any 1.
,mrlahey,2009-10-01T20:45Z,"Sorry  but the quality of these are fucked, the compression is awful.

iTunes it is then."
