User Type,Username,Date,Text
,xLogicx,2007-09-20T22:21Z,SEED!!!!!!!!!!!!!!!!!
,xLogicx,2007-09-21T15:34Z,whats the fucking point of uploading movies when our not fucking seeding!!!!!!!!!!!!!!!!!!!!!!!!!!!!!!!!!!!!!!!!!!!!!!!!!!!!!!!!!!!!!!!!!!!!!!!!!!!!!!!!!!!!!!!!!!!!!!!!!!!!!!!!!!!!!!!!!!!!!!!!!!!!!!!!!!!!!!!!!!!!!!!!!!!!!!!!!!!!!!!!!!!!!!!!!!!!!!!!!!!!!!!!!!!!!!!!!!!!!!!!!!!!!!!!!!!!!!!!!!!!!!!!!!!!!!!!!!!!
,Kidnice,2007-10-26T17:49Z,I never seed muahahaha I never ever seed...muahahaha  Naaa Jusss kidding man.. lol
,mrjonez,2007-12-22T19:55Z,"Please, need some seeding..."
,Kjellemann`en,2008-01-03T23:54Z,"Seed plz need this torrent ;D

SEED !!!"
,lolladin,2008-03-11T16:12Z,how do you seed? 
