User Type,Username,Date,Text
,kentknet,2006-12-04T22:55Z,OBS! Det blev tydligen nåt fel när jag gjorde torrenten. Det verkar inte kunna bli helt klart med de flesta filer ser ut att bli kompletta dock.
,the.pirate,2006-12-04T23:03Z,"jag kan riktig magi faktist de er inte på skoj jag kan trolla jag lovar jag bor en litten hudda ut mot skogen av södermanland jag utövar naturiska konster och lever i harmoni vill ni veta mer om magi och troll konster skriv till mig på allankatz_@hotmail.com

OBS: jag utövar ej svartmagi konst."
,hand64,2006-12-09T10:29Z,fan varför stannar den på 98??????????????????
,kentknet,2006-12-27T00:38Z,Vet ej. Jag har själv inte mer än just dessa 98%.
,kentknet,2011-11-23T16:30Z,"Hej alla!

Testade sjalv nu och det verkar som att det ar tva filer som inte blir klara.

Jag lyssnade genom dessa tva och det verkar som det har ramlat bort delar av filerna. Finns hack/hopp i bada.

Ska försöka att reparera detta. Borde gå att rippa om dessa två från skiva och byta ut de ""gamla"" och göra en ny-check.

Återkommer"
