User Type,Username,Date,Text
,JohnRapp,2006-03-19T12:28Z,Please seed!  Gettin 0 kb/s.  Thank you!
,bearcy,2009-09-07T13:45Z,"The easiest way to stop smoking for everyone:
Den letteste måten å slutte å røyke for alle på:

http://thepiratebay.org/torrent/5077573/Allen_Carrs_Endelig_ikke-r_yker__-_norsk_Lydbok

In Norwegian and English - 2 audio books:

Allen Carr's Easyway to stop smoking.
Allen Carrs Endelig ikke-røyker!

MP3-pro CD-quality 6½ hours."
,malouphix,2009-09-15T16:05Z,"Is anyone able to seed this please?

Thanks."
