User Type,Username,Date,Text
,kUNt,2008-01-08T13:31Z,"For andre året på rad - nå  er den her: Den (uoffisielle) komplette samlingen av oneliners fra Radioresepsjonens sendinger i 2007! 

Hør Steinar nesten miste selv-ironien, Tore komme nærmere kontorene til kringkastingsrådet og Bjartes ufarlige og koselige innspill!

Over 4 timer med konstant latter, fnising, gapskratting og pauseringer! 

Oh lord!"
,simsensen,2008-10-13T00:17Z,"Seed please! Står fast på 15,5%... Genial sessong med oneliners som enhver burde ha! Så venligst, seed!"
,simsensen,2008-10-14T16:21Z,Kunne fortsatt vært fint med litt seeding! 51.2% nå...
