User Type,Username,Date,Text
,vargen35,2006-09-06T12:56Z,jag lägger upp fler axe om intresse finns mvh vargen35
,vargen35,2006-09-06T14:51Z,har lagt upp en till axe mvh vargen35
,vargen35,2006-09-09T21:34Z,http://thepiratebay.org/tor/3521673/axe_6_album
,frankius,2006-10-08T14:30Z,tackar för mycket bra hårdrock har dem på lp så det e gött att få dem på data tackar & bockar
,neuro.no1,2007-04-02T21:26Z,"WOW!!! Har inte sett AXE sen jag gick på Gymnasiet. Har försökt hitta lite gammalt godis på ebay, men tilloch med där går man bet...
Har du mer gör du iaf mig :-)))))"
[T],nystrand,2008-11-05T07:33Z,har lagt upp best of volume I nu. Volume II kommer snart.
