User Type,Username,Date,Text
,btisinfestedwithnoobs,2007-09-22T10:51Z,seems like these get reposted over and over
,blubbare,2007-10-28T17:39Z,"..I dont know, england is known for their fucking ugly bitches..!!!!!!!"
,yetiboy1975,2007-12-13T22:11Z,"and america is known all over the world for being the biggest bunch of inbred, self important, insular, ignoramous' on the planet. We may have uglier girls but at least they know where Portugal is on a map!"
,mshark89,2008-02-24T10:58Z,yetiboy is just pissed cuz he cant even fuck the ugly brits. its just him and mommy.
,rock52,2008-02-25T05:17Z,gee guys chill its just porn besides everyone knows the usa and england are dying empires 
,mad_homer,2008-03-26T16:40Z,russia and china are the next superpowers when america dies of inbreed and playing police
,teamsamson888,2008-10-25T09:11Z,"yall stick to your own country then, we are doing great here fattest country hell yea we eat fat n work hard for it, we make american muscel cars and run the biggest army in the world suck on that people"
,shiddy81,2008-12-01T18:58Z,"I dont know why everyone is slating the English - Lets face it we managed to colonize all you morons put together.  We are by far the most civilized nation in the world.  Thats why u lot have to escape your war torn, poverty stricken countries and flee for the delights that we offer.  I'm proud to be English, I'm at the forefront of the modern world, whereas the rest of you can only get your hands on Gucci knock-offs, Playstation 1's, Amiga's (if your lucky) and actual hand knitted socks - and your country probably smells too!"
