User Type,Username,Date,Text
,bs,2006-01-04T21:07Z,"Fede upload af denne serie :-)
Kom nu lige igang med at seede jer som har hentet filerne vi andre vil oz gerne ha lidt glæde af dem..... "
,fatstein,2006-04-07T06:27Z,"VIGTIGT DANSKE M8's ;P

**********************

Hvis nogen af jer har ale afsnit af denne slags med danske tekster på vil jeg gerne have fat i dig / jer ;) har en masse at bytte med kontakt mig på msn the_charmann@hotmail.com håber der er en der kan hjælpe mig :) .."
,tjalfe08,2006-04-24T01:05Z,"Muligt at en gider seede det her afsnit mandag 24/4, mangler 4,25mb ;)"
