User Type,Username,Date,Text
,tobdub,2005-05-08T22:48Z,http://www.playx.no/index.php?SCREEN=item&item=15432
,jaal,2005-05-09T00:10Z,"http://www.bseller.com/frontpage/

Där kan du dessutom se trailer på filmen..."
,BigM,2005-05-10T06:42Z,Gammal skåpmat och som vanligt när det ska vara svenskt några importerade porrstjärnor.
,torrent1963,2005-05-13T23:38Z,"Maxs + Bestseller = Samarbete.

Det mesta filmmaterialet i Svenska Pumor kommer ifrån Maxs Svenska Nybörjare 5, http://www.maxs.se/cart/details.asp?vare=172731

Det är uppenbart att man vill lura av folk på pengar på en massa gammalt skit.
"
,lilleloola,2006-06-27T16:12Z,"please seed, stuck on 93,9%"
,primux,2006-07-05T15:36Z,tja skulle vara trevligt om dom sista procenten skulle kunna komma också.
,Knarsa,2007-01-17T15:08Z,Have somone get this 100%??
,PatrikBre,2007-09-03T23:09Z,Someone that start to seed again ??
