User Type,Username,Date,Text
[V],velvetfog,2007-11-21T11:38Z,http://www.imdb.com/title/tt0477348/
,IttoDaigoro,2007-11-21T19:19Z,I wanna see this movie so bad I'm almost tempted to download this cam.
,freddiep4,2007-11-24T10:38Z,"DLing now, will let you know"
,Wetbones,2007-11-25T19:39Z,lol the coen bros probably uploaded this themselves to fuck with you
,michaelrwatson,2007-12-20T03:50Z,"This is real, but.... it has terrible flicker. That means you will experience an epileptic seizure if you watch more than about 30 seconds of it. 

Thanks, cammer, but you need to remove flicker by syncing your cam better--NOT by trying to run it through filters afterwards."
