User Type,Username,Date,Text
,tek1992,2006-05-15T21:01Z,fuckin superb many thanks
,matrick,2006-07-28T07:55Z,Sweet Upload
,mooncats,2006-10-14T11:03Z,"Can't get this to play dude.. Got nero smart vision, that s not compatible.. says i need mpeg 2 got any advice???"
,mooncats,2006-10-27T13:52Z,"Ignore the above was being stupid.. Works great with Power DVD... Nice 1 Dude, choice vid!!!"
,baz1l,2007-02-04T21:58Z,goys if this works i will love you its a classic
,bonechilling,2007-04-27T16:00Z,"Have you seen him?

Thanks for this rip.  So great.  If you can turn up the rest of the Powell video library, I'll buy you an ice cream sandwich."
,the uploader,2007-04-30T11:31Z,skit bra film
,avrgnative,2007-06-17T21:00Z,http://www.imdb.com/title/tt0378720/
,sammyt500,2008-01-25T11:27Z,Not sure if this is the same one I downlaoded - but what a blast from the past - I would love it if someone could hook us skate heads up with H Street Shackle Me Not - Sweeeeettttt!!!
,worked,2008-03-01T05:33Z,Shackle Me Not - Matt Hensley... on YouTube.  Just search H Street... Quality!
,kostonskid,2008-10-24T19:47Z,can anyone tell me how the video quality is? want to make sure i'm upgrading
,dmkartist,2009-03-14T02:16Z,Show me those rib bones NOW!!!
,wheresmysnare02,2009-09-29T17:15Z,"would any one public domain to be uploaded? if so, just lemme know"
,oldjugbh4life,2010-02-27T22:07Z,I can't get it to work either.
