User Type,Username,Date,Text
,KRABBAN2007,2007-11-22T19:57Z,"varför Flac? hur stora filer som helst.. aja fin skiva iaf, tack! "
,KRABBAN2007,2007-11-22T19:57Z,"och seeda gärna.. hade varit schysst. 

peace"
,KRABBAN2007,2007-11-22T19:58Z,"""FLAC provides audio compression that sounds exactly like the original CD""

göööttt, läst einte så noga. "
,JustInsideTheGates,2008-01-17T21:38Z,this seed has been spilled to the ground... >40% avail.
,gonzex,2008-11-27T16:43Z,"thnks a lot...
do you have the .cue files for this cds?"
