User Type,Username,Date,Text
,bellis,2004-09-14T09:29Z,f-n   Du är verkligen Idol 2004  för mej .. sång eller inte .
,AceRimmer,2004-09-14T10:58Z,Hade jag känt dig Spendrup hade du fått en puss ;)
,Kufen,2004-09-14T11:04Z,"""f-n   Du är verkligen Idol 2004  för mej .. sång eller inte .""

ha ha ha"
,Knaspeter,2004-10-29T06:20Z,"Men vart blev del 7 av?
Suck, en sån underbar serie och så missar man ett avsnitt... Ingen som kan lägga upp den på nytt eller som vet vad som hänt?"
,fastshit,2005-06-28T20:02Z,"Tackar som faan! Har bara 14,15 och 16 kvar nu."
,tummen2,2006-01-11T23:34Z,"Vi är några som saknar 0,3 %.Någon som kan hjälpa till ?"
,denonmann,2006-01-13T01:50Z,"99,8%  Please, someone?"
,pj_09,2006-02-08T22:49Z,"99.9%, anyone?"
,torjig1,2006-09-30T00:02Z,Please seed this serie if anyone can and I will do the same.
