User Type,Username,Date,Text
,fredrik_muppet,2006-03-17T15:26Z,Om du gillar det här. Snälla Köp Skivan Band som domma måste få finnas kvar... Albumet kostar bara  79kr på cdon
,PiG,2006-03-19T18:33Z,Självfallet köper man plattan. Hoppas jag alla andra som tankar den oxå gör!
,jazzdoktorn,2006-03-28T07:26Z,"Kanonskiva!!
lyssnade på den hela vägen till skivbutiken.
79 spänn!
Alla skivor borde kosta så här lite!"
,kontrast_dk,2006-04-09T14:12Z,"Please support this small group an buy this record!

Only 9 Euro here: http://www.cdon.com/main.phtml?navroot=906"
,dreamsdonotend,2008-04-02T16:23Z,seeda så jag vet om det är något som är värt att köpa sen.
