User Type,Username,Date,Text
,bdtiger,2010-09-05T06:31Z,Saw a clip of this and it looked great! I'm still at 98.09% for the past 3 days. Please seed!
,bdtiger,2010-09-05T06:32Z,"And if I forgot to say ""Thank You,"" Mea Culpa. Great work with this one!"
,bdtiger,2010-09-12T07:07Z,Please seed!
,bdtiger,2010-09-25T07:55Z,Please seed! Please seed! Please seed!
,bdtiger,2010-10-03T05:08Z,THANK YOU  so much for seeding! You are awesome! I've been dying to see this one for years! Very much appreciated!!!
