User Type,Username,Date,Text
,SammeJ,2007-06-18T18:52Z,"Ni får gärna skriva kommentarer ifall det är något ni undrar eller vill säga o.s.v.
Jag vet att jag har tagit låtar från olika artister och mixat ihop dem, så det är inget som ni behöver påpeka eller så, för det är det som är själva grejen. Jag tar ut delar från låtar som jag tycker är bra och så mixar jag ihop dem, så är det blir någorlunda bra iaf (Jag kallar mig inte själv för någon expert eller liknande). Från början gjorde jag detta bara för mig själv, men sen frågade några kompisar ifall jag kunde lägga upp dem på piratebay så då gjorde jag det. Artisterna som jag tagit låtarna är de som förtjänar den stora äran av det hela, och inte jag.
Men om det finns någon som gillar att lyssna på mina mixar så är det ju jättekul tycker jag =)!
See you around...
Mvh Samme"
