User Type,Username,Date,Text
,kviende,2007-08-29T06:41Z,vilka filmer är det lite info tack
,krister60,2007-08-29T07:57Z,tack tack
,janek,2007-08-29T14:44Z,Tjorven och Mysak + Tjorven och Skrållan
,BajenViking,2007-08-30T15:45Z,"Fan jag får error på samtliga Astrid superpack, från 1-7.
got bad file info-path .checked disallowed for security reason.
Ngn vänlig själ som kan förklara för mig vad det betyder? Jag kan nämligen ladda ner annat."
,mathsped,2007-09-18T12:03Z,Är alla eller någon af dina Astrid Lindgren filmer med danska tekster eller dansk tal ?
,LasseLiten,2007-10-02T16:04Z,kan någon seeda superp pack 1&2
,jonas1986,2007-11-02T11:25Z,Vart är kalle blomquist ?
,nalle.bamse,2008-03-06T16:52Z,TACK NU BLIR SYRRAN JÄTTE GLAD :)
,Moontracker,2008-06-14T17:10Z,"Suverän UL, He0N. TACK!"
