User Type,Username,Date,Text
,unreal,2006-12-28T11:15Z,"these girls can´t even pretend that they like it. not very fun to watch

...but thanx for the torrent"
,bobkyrre,2007-01-02T23:32Z,Thanks for warning! I will download it right away. Just to see how bad it is. :-)
,w-f-t,2007-01-04T13:20Z,"if you had to swallow all that jizz would you like it :)
ok shes not a happy bunny but its good porn"
,NaarRod,2008-06-21T05:39Z,Thanks
,noekk,2008-11-01T04:11Z,Who cares if she's happy ?
,vodoovolkanox,2010-03-25T19:25Z,HAHAH yeah dear) who cares ??? does she get it inside??then kein problem ich liebe es ) ja wohl!!
