User Type,Username,Date,Text
,jsgrim,2007-01-26T07:34Z,thanks :D
,RaDoNix,2007-01-26T07:44Z,SEED!
,burro9876,2007-01-26T08:20Z,"Maybe try the newer one, uploaded 30min or so later. (also, Smallville.S06E12.HDTV.XviD-XOR)"
,coleix,2007-01-26T22:42Z,"Muchas Gracias Amigo, Thx a lot man."
,Elkar,2007-01-26T22:46Z,"please send iam on 99,8"
,coleix,2007-01-27T01:55Z,"Someone seed plz, im at 99% :´("
,UnderGroUndSam,2007-01-28T22:31Z,"Seed please, I'm also at 99%"
,kevin1980,2007-01-30T05:59Z,seed please stuck at 99.8%
,Brian33,2007-04-23T16:27Z,"Can someone seed this episode, only one I'm missing?
Thanks"
