User Type,Username,Date,Text
,swedewolf,2006-03-15T10:55Z,Does anyone have a cover of this? thx
,uraphake,2006-03-15T11:39Z,"Here's a cover:
http://www.evilangel.com/page.php?node=item&item_id=1523"
,uraphake,2006-03-15T11:43Z,"Actually, *here* is the cover (front and back):
http://www.evilangel.com/images/boxcovers/jd-boob_bangers_2_dvd-big.jpg

The first link I posted required clicking on the image there -- this one is direct."
,nickex35,2006-03-16T07:58Z,"everybody is stucked at 3,7 %.....i think you must seed severely weeks....."
,Quasi88,2006-03-18T19:28Z,Why do you upload if you dont SEED???
,Killbill21,2006-04-10T02:18Z,"No shit, if your posting you should seed until your ratio is 1.0+,   nothing less.  "
,Killbill21,2006-04-11T12:28Z,12.8% and waiting.  
,dragonfox6,2006-05-09T01:37Z,"this torrent is dead. we need an repost.

ohh and try to remember that for every DL you make UL x2

help us keep the files alive."
