User Type,Username,Date,Text
,redsunx,2007-04-27T23:02Z,ummmmm is this fucked with like a bunch of missing dlls?
,RobNuqem,2007-05-05T10:11Z,Jag vill ha win 98.....det är et ända som funkar på min slöa dator.....ska inte köpa ny bara ha win 98 det är skit bra ju!
,darkdays,2007-05-09T22:38Z,"Well, I'm downloading it to install in a virtual machine, have some old progs that I need to run that won't under xp/vista..."
,sintjern,2007-05-22T13:58Z,Does this really work? is it multi-language?
,s1ay,2007-06-08T09:34Z,I wonder if MS feals stupid? Vista created a reson to pirate an old vertion of Windows...  and they give you the means to use it for free by making Virtual PC free.
,Big Bud,2007-06-24T21:42Z,Jag vill gärna ha den. Har en gammal härk till dator på landet som inte orkar med något bättre. Någon som har Windows 3.11? :-)
,Retur,2007-07-10T04:34Z,"the answer to why anyone would wanna download win98se is in my case the following: 
Im building a computer for my mom for Diablo II, Tetris, a SNES emulator and microsoft word... That's my reason. WinXP/vista/ would be overkill... 
So now please SEED :D 
seeda är ni snälla, jag vet att alla skiter i win98 men vissa av oss behöver verkligen få tag i det. Kram!"
,notbydesign,2007-09-11T19:23Z,Im getting windows 98 for Black & White... I bought that game when i first bought my computer (also my first computer) but it had XP only... and now that i've upgraded it and know how to fool around with my computer im going to have both. 
,mrjpt,2008-01-26T11:24Z,"Bock & Tack !!!
Nu får jag nog fart på min
GAMLA laptop"
