User Type,Username,Date,Text
,Redreb,2005-03-24T00:49Z,"well well ! look at that...just passed my 100 torrent upload, and gotta say its a nice start......lol"
,Damp,2005-03-24T01:42Z,bangbus totally owns. Could you make a dir with it and just 1 big torrent with like 200 bangbus movies? :) for me...? :p
,silenos,2005-03-24T01:59Z,"your torrents rule, Redreb :D"
,benzfriend,2005-03-24T02:11Z,"Redreb - I'd like to share your hand to congratulate you, but on second thought that probably isn't such a good idea :)"
,mave,2005-03-24T02:36Z,redreb.. plzzz... couldnt u get the episode karina... shes a italian.. very nice... shes on the site... plzzzz!!!!  sha walks with her bike.. shes HOT!!!!
