User Type,Username,Date,Text
,motherloader,2007-10-10T12:49Z,"Well, Im not sure I want to trust anything from USABIT again since Michael Clayton turned out to be a Zix file,  but since this an AVI ill give you another chance.  

thanks for the up"
,rogard,2007-10-10T17:09Z,"Would the abuser above please go away and abuse some other forum? Why don't you go and find yourself a brain?

If you're not interested, don't download it.

http://www.imdb.com/title/tt0948279/"
,jr0416,2008-10-07T14:34Z,"Hi, could someone please RE-SEED? There is a few of us stuck at 97% and noe current seeders. If I can get the whole file I will seed for a month or so.
Thanks
jr"
