User Type,Username,Date,Text
,Hmmmja,2006-09-20T13:54Z,how do you play this file on mac?
,az5,2006-09-20T14:07Z,"Who the fuck cares, get a real computer"
,oktan,2006-09-20T14:20Z,az5....ROFL !!!!
,jjcale,2006-09-20T16:44Z,"vad skall man använda för program
för att se"
,tooheys,2006-09-20T18:07Z,Man behöver winace för att packa upp den
,kaptenclabbe,2006-09-21T15:17Z,det är för fan min granne haha 
,MegatonSE,2006-09-21T20:56Z,password?
,tdia,2006-09-21T22:46Z,some movies aint work. need som fucking codec i donno
,Mortuus Anima,2006-11-19T01:11Z,''get a real computer'' *lol*
