User Type,Username,Date,Text
,pjtmoi,2006-07-08T03:38Z,Why ?
,Temptation,2006-07-08T06:18Z,"pjtmoi, I think MattiP is trying to be sarcastic because you put this in the wrong category.  The ""Movies DVDR"" is for full DVDs, whereas a DVD rip, i.e., avi files, should be in the category ""Movies video"".

Is this in English? "
,pjtmoi,2006-07-08T07:05Z,"Thank's Temptation and excuse my mistake, I'm new in Torrent stuff... How can I change that ?

Yes, in English. Full V.O.
"
,pjtmoi,2006-07-08T14:12Z,"I'm NOT deaf. 

How can I change that ?"
,Temptation,2006-07-09T00:56Z,"pjtmoi,

Don't worry about it :)  Everyone makes mistakes.  It's generous of you to upload and share something.  Ignore the rude a**holes.  Unfortunately, uploading is mostly a thankless task.  You'll get a few thanks if you're lucky, but a lot of complaints otherwise.

As far as changing the category, unfortunately I don't think you can do that after you've uploaded something.  You could delete this upload and then re-upload it in the correct category, but that would mean people who have already downloaded this torrent and are in the middle of getting this will then not be able to complete it.  It's up to you about what you want to do, I guess.  To delete a torrent, go to your ""preferences"" page and select this torrent.  On the upper corner right, you'll see a red X.  Click on that to delete this torrent.  You can then re-upload it if you wish in the proper category."
,stilgarprim,2006-07-13T12:45Z,"I play this movie in VLC Player. This is in French!!!!! 
pjtomi, could You tell us: What the fuck is goin on??"
,midow,2006-07-14T05:35Z,"Um, just to clarify, the audio track is in french, so if that's nt what you want, pass this one up"
,insomniaklad,2006-07-27T14:19Z,"It's not spoken in English you fuckstick...

Why, oh why do they allow fuckstains to upload?"
,mathess,2006-08-01T00:34Z,is this english?....... answer please
,kärrg,2006-08-17T07:06Z,"why do you say that it is in englsih when it is in french, fucking dork!"
,safr,2006-11-03T10:05Z,WARNING: THIS IS IN FRENCH
,BrenJames,2007-01-29T01:21Z,French you fucking pointless waste of a sperm!
,mybirthday1990,2008-02-01T22:51Z,i know this is french adn all but thanks for uploading it was very nice of you :))))
,skimmer65,2008-02-10T20:25Z,yes its dubbed in french....
,Milatzziey,2008-05-09T17:07Z,"Might want to change spoken language too, if you can. This is dubbed in French."
,Milatzziey,2008-05-09T17:08Z,"Oh, nevermind... I see that's no secret :P"
,ukpanik,2008-06-12T01:59Z,"pjtmoi, you are one dumb fucking noobie.
must suck to have that jam between your head you call a brain.
good luck with your life, im guessing you will need it bubba"
,stucat,2008-07-27T23:26Z,"@ upanik.
so quick to pass judgement, so quick to condem him for being a ""noob"" dont see any uploads from you with all your experience. Ur just a sad ,whinging, leeching ,user. Try learning another language retard.

@ pjtmoi merci pour le travail. les erreurs sont l'etat humain."
