User Type,Username,Date,Text
,lechampion,2007-08-05T19:17Z,The view is too dark.We see nothing except the tits.Very bad quality...
,Prilep,2007-09-14T17:04Z,"Very nice one! but short , got the full film or longer one ?"
,fordprefect1952,2007-11-11T03:01Z,"This seems like a staged soft-core vs FKK nudist video ... if u like genuine ""naturist"" kind of video, skip this one, you'll be disappointed.
That said, it is an elegant portrait of young women/girls in a shower setting.
It is a bit dark, as earlier poster observed."
,keshavabs,2007-12-06T02:05Z,"People I know for this is one of David Hamilton's movie Bilitis or Premiers dĂŠsirs or Tendres cousines   something....  

All the actress must be underage..... 

I dont know if its illegal, I guess if its on IMDB it should be fine, ART movie and stuff I guess... 

look up http://imdb.com/name/nm0357807/"
,turd001,2008-04-02T17:16Z,you sick fuck!
,Floydoid,2008-07-21T11:01Z,It's a scene from the David Hamilton movie 'Summer at  San Tropez'.
