User Type,Username,Date,Text
,Raj,2005-07-05T01:23Z,seed please
,nork,2006-05-12T02:29Z,"i would really like to get this program to test it out. Would appreciate if anyone could seed it, please.
thanks"
,Zoorg,2006-12-27T21:56Z,"Men detta är inte Pro versionen väl ?!
Jag kan iallafall inte få till att återställa MBR, däremot kan jag ju ""se"" filer och mappar på min trasiga partition. Men till vad nytta är det om jag inte kan få igång filsystemet så att WinXP kan boota :(  Som det är nu kommer jag till bootloggan, sen startarskiten om igen ...spelar ingen roll om jag använder felsäkert läge eller nåt annat i bootmenyn."
