User Type,Username,Date,Text
,arne_414,2007-01-04T02:04Z,this shoud be under the porn category.
,helmuthz,2007-01-04T10:51Z,"@arne_414:
Why? This is supposed to be art and no porn at all. 

Come on, don't be a prude. You can find nudes in the art world since the stone age. ;)"
,bob664,2007-01-04T10:53Z,Crap quality unwatchable
,siggomar,2009-04-22T06:41Z,"I agree: unwatchable.
Maybe it is censure?
I delete it before my share ratio climbs to 1.0 , so that this bad video dies from the share place."
