User Type,Username,Date,Text
,sd2005,2007-02-14T07:14Z,"super thanks, my all time favorite! :-)"
,addictedtomovies,2009-03-22T03:09Z,"could someone please seed,,,i am trying to get this for my wife. thank you."
[V],cezen,2010-02-17T20:22Z,"I agree... this would be great seeded, I might have to UL mine if the seeds don't come back!"
[V],cezen,2010-05-06T22:59Z,"Ok, I am going to UL mine.  Coming soon!  I will post link to new UL that will be Seeded and contain all 9 of the books, not just 7 of them."
[V],cezen,2010-05-07T00:04Z,"http://thepiratebay.org/torrent/5539974/Laura_Ingalls_Wilder_Complete_Series_Homeschool_Educational


Enjoy, hopefully this will stay seeded."
