User Type,Username,Date,Text
,BJK84,2004-12-26T14:38Z,snëla sëëda
,ancientdanne,2005-05-15T15:51Z,sedda snälla:)
,yiltgoob,2006-04-11T14:51Z,"snääälllaaa seeda, jag vill ha denna !!"
,myggfan,2006-06-27T18:57Z,"Kan inte NÅN seeda?? vill ha den, var där :P"
,koskinkorva,2007-12-13T19:05Z,"ja va också där, fan va fett de va. Metallica spelar aldrig en dålig gig därför e de metallkungar, men om någon sitter å trycker på denna konserten video hela så skulle ja fan så uppskatta om någon orka lägga upp sheiten. Om ingen orka kom till dc, look for MetallicA"
