User Type,Username,Date,Text
,karlkringla,2006-07-05T11:54Z,"Seed please stuck at 99,8% for a week now!!!!"
,galielio,2006-09-25T02:40Z,Can anyone help me. I new to Torrents. I have 95.6% of the file downloaded but can't complete it? Any help would be greatly appreciated.
,hunyluvy,2006-11-11T12:37Z,how do u play?
,jojo116,2008-01-04T09:31Z,"Seed please stuck at 96,9% :("
,rd1381,2009-07-24T04:51Z,is the quality bbetter than that other upload of yuor or that on e is just the rip of this dvd?
,Spinik,2009-07-30T22:08Z, ?????????? ????! ??????? ?? 95% !!!!!!!!!!!!!
,Spinik,2009-07-30T22:14Z,"Seed please stuck at 95,4% !!!!!!!!!!!!!!!!!!!!!!!"
,spamandy,2010-06-06T16:05Z,FAKE--- This is just st trinians with porn clips added ----AVOID.
,spamandy,2010-06-06T18:19Z,Sorry don't know what went wrong with last download. Tried again and fine this time round. Thanks
