User Type,Username,Date,Text
,olle ball,2006-12-05T15:53Z,det var en redig samling.olle bugar och tackar
,manniXXL,2007-01-21T09:49Z,"I Think its complete, great work"
[V],Grapetonix,2007-01-21T16:59Z,"Great, however the last CD (2003) contains lots of cracks and pops, probably ripped from a scratchy CD"
,CrilleX,2007-01-25T13:13Z,Seeda!!! M책ste ha den h채r! 
,viciousnightmare,2007-05-25T21:21Z,"good work but its not complete ..
1 of the missing albums is *something else*"
,omega45,2007-10-27T00:24Z,Nice torrent thanks
,piiider,2008-02-28T21:34Z,thnx =D
,rohtonoita,2008-04-14T03:21Z,I like Shadows very much.. thanks and ill seed :) Jah Bless ya all! :D
,Larsologie,2008-04-22T15:01Z,"Boy, did these guys make some crappy music! I like the first two albums, partially, very much. But the rest... Ugh... Thanx for the torrent though, I wouldn't have known without it ;-)"
