User Type,Username,Date,Text
,Mr.Teslacoil,2006-03-29T23:17Z,"Tjena, Min första torrent, hoppas att den är till er tillfredsställelse"
,-Marley-,2006-03-29T23:40Z,"Hehe de var precis vad jag letade efter.. har bara sett säsong 4a och lite av 5an, så tänkte måste se 1-3 :).
tack o hoppas verkligen de någon som seedar.."
,Mr.Teslacoil,2006-03-30T07:07Z,"Seedar gärnet nu, datorn krålnlade innan, men nu e det ok, fullt blås!!"
,mardner,2006-07-13T11:45Z,"Kan nån seeda, needar season 4=)))"
,BabyNo1,2009-03-15T21:30Z,"storlek 1,13mib???
o ingen seed... hm..."
