User Type,Username,Date,Text
,mr.arne,2005-04-22T12:03Z,Why do you remove the subs? Each sub take up maybe 2MB of space so it's no big deal.
,reptile256,2005-04-22T16:52Z,im really sorry but i subtitle dvds by a way of a subtitle guide where u don't keep the original subs. sorry again.
,BloodyWR,2005-05-08T17:31Z,e d bra kvalitet??
,Tenari224,2007-06-12T20:27Z,come on no seeds! You people are selfish!SEED
,barton101,2012-08-14T15:22Z,"Next time, please include English subtitles. Subtitles take up hardly any extra space and they make for more seeders because the torrent is useful to more people."
