User Type,Username,Date,Text
,shypys,2007-04-05T09:23Z,"Whats BitLord? Is it better than uTorrent or Azureus, ie does it have better speeds?"
,Silvers_Swe,2007-04-07T20:11Z,kolmo jepp det är den men just nu finns jö vara den i beta version
,Mr.Big.Dick,2008-02-22T15:17Z,Är den bättre än utorrent??
,Mr.Big.Dick,2008-02-22T15:21Z, SEEDA SEEDA SEEDA SEEDA SEEDA!!!!!!!!!!!!!!!!!
,B_KILLS_U,2008-03-06T13:10Z,"GREAT TORRENT, WORKS FASTER THAN ANYTHING I HAVE EVER USED. 100% VIRUS FREE I WOULD RECOMMEND IT TO ANY ONE WHO LIKES TO DO MULTIPLE DOWNLOADS, AND IT WORKS FAST WITHOUT SLOWING DOWN YOUR COMPUTER. 100% GREAT JOB Silver_Swe"
,SyDoX,2008-03-20T15:45Z,"fint :) takker silvers_swe ^^,"
,splitendz,2008-05-06T13:21Z,can someone pls seed!
,HellMen,2011-12-27T16:33Z,SEEDS SEEDS SEEDS plz
