User Type,Username,Date,Text
,Dainfamous24,2006-11-26T18:37Z,pal or ntsc????
,janek,2006-11-26T19:26Z,"Har du etten får du gärna lägga upp den, går ej att få tag på här, med svensk sub. Tackar på förhand."
,Amraith,2006-11-26T20:42Z,Thanx for the Greek subs!
,sandrew77,2006-11-27T23:04Z,thanx for the greek subs but i m still in 0%!!! seed!!!
,nerdo,2006-12-24T17:12Z,pleeeeas seed some =) 
,VladZore,2006-12-27T16:10Z,Plz Seed this one
,pirate_maiden_trivium,2006-12-30T20:04Z,jävla flat jessica börja seddajävla luder
