User Type,Username,Date,Text
,sums,2008-12-21T21:20Z,"@dtrbot i simply just LOVE your torrents. You are my ROCKSTAR...plz keep up the good work.

Wish you all the best. "
,sums,2009-01-03T20:02Z,"Hey...i downloaded the whole movie, but unfortunately CD1 has many issues, like stupid advertisemnents in the beginning, no scences sequences like movie beginning is in the middle of the movie...and stuff.

I'm sure you'll come out with correct one soon!!

I personally was surprised to see this as after all this was your torrent."
