User Type,Username,Date,Text
,arogantstoffe,2006-11-26T19:38Z,ha ha ha ingen vill ha den ta bort filmen
,Gilera_runner,2006-11-27T17:32Z,Har en Fråga...e ny här på the pirate bay undrar hur man Seedar:$
,titestef,2007-01-29T21:20Z,"hi ! I began the download 2 days ago, and it stopped at 59.7% !!!  please more seeds, guys !  thanks silvia for this post, but I hope I'll enjoy DEAD AND BURIED soon (RÉINCARNATIONS en français... Because I'm a french girl! yes!  lol).   Take care
And More seeds and peers !   See ya'  "
,titestef,2007-01-31T06:30Z,more seeds on this one please !!! 
,titestef,2007-01-31T19:15Z,"great!!!!  THANKS Silvia ! i just got it , and this horror flick is incredible!!!!   take care "
,ellerhur,2007-03-25T16:18Z,tnx... and seed pls....
,fowler29,2009-03-19T12:21Z,RESEED PLEASE!!!!!!!!
