User Type,Username,Date,Text
,H2ns,2006-12-26T11:42Z,Please keep the seed alive after download - Venligst seed efter endt download
,SilverWombat,2007-01-15T18:44Z,"Wow, det er hidsigt ... God stil .. Jeg vil seede til min computer bliver formateret. :)

CDen står på hylden."
,Maltheskalle,2007-09-16T23:10Z,http://www.dr.dk/P3/Session/koncert/20070830135730 P3 sessions hvis nogen skulle være interesserede
,Nekiam,2008-03-22T08:54Z,"Nogen der har hendes totalt fede version af TV2's ""Alt hvad hun ville var at danse""? Den ligger på youtube - men mp3en ville være guld???"
