User Type,Username,Date,Text
[V],knaverlisa,2006-11-23T10:04Z,"Tack, tack för denna"
,hasse54,2006-11-28T18:00Z,Någon som vet var man hittar covern ????CD+FRONT+BACK
,Tackleberry,2006-12-12T14:21Z,Skulle även gärna vilja ha tag i covern för denna.
,bondelokrume,2006-12-15T16:46Z,Är det någon som har hittat covers. Hade inte piratebits en coversida eller var det någon annan??
,Smick3,2007-10-29T17:04Z,thx! :)
,olaagp,2008-04-13T01:37Z,Pls kan någon seeda???
,mimsan123,2008-06-03T01:30Z,dålig seedning :(
,sostra,2009-03-14T15:17Z,Tack Kopimi!!
