User Type,Username,Date,Text
,_trooper7609,2008-05-09T15:27Z,"The Duchess in leeds hosted these guys what a laugh, back in the days when the place wasnt run by commies.
88"
,darkspirit08,2008-11-11T11:28Z,GREAT UPLOAD M8 THANX
,seaman_stains,2009-02-09T18:57Z,Need More Seeders please...make an old man happy.......
,saddythedaddy,2009-03-18T23:01Z,c mon seed u greedy fuckers i need this fucker!!!!!!!!!!!!!!!!!!!!!!!!!!!!!!!!!!!!!!!!!!!!!!!!!!!!!!!!!!!!!!!!!!!!!!!!!!!!!!!!!!!!!!!!!!!!!!!!!!!!!!!!!!!!!!!!!!!!!!!!!!!!!!!!!!
,dfc2tone,2012-04-06T16:04Z,"Many thanks for this mate, they are funny as fuck!!  Still remember laughing my pants off when I first heard them many years ago."
