User Type,Username,Date,Text
,Epoz,2007-01-04T23:18Z,La upp denna för någon frågade efter den ;)
,NisseP,2007-01-05T06:21Z,"Lycka till med nyårslöftena - sluta röka.

:-S"
,qwzxc,2007-01-05T09:52Z,Tackar så mycket.
,pawarotti,2007-01-05T10:51Z,tack snälla. God fortsättning!
,Epoz,2007-01-05T14:13Z,Vassegoda och god fortsättning på er alla ;)
,ChristinaSwe,2007-01-05T16:59Z,"Tack, har varit rökfri i 10 dagar nu, denna kanske kan peppa en lite när suget gör sig gällande."
,aswqeee,2007-01-05T23:55Z,Tack!! Kan vara precis vad jag behöver :)
,th3vil,2008-11-01T22:51Z,Kan någon vänlig själv seeda denna gamla torrent?
