User Type,Username,Date,Text
,nicola2505,2007-12-15T15:10Z,pretty god
,emandem,2008-01-03T09:53Z,"This is one of the best downloaded torrents so far. Video and sound are excellent. No English closed captions (subttitles) at all. 
Keep up the good work and keep the Axxo rips alive!"
,bwsjr99@yahoo.com,2008-01-20T17:43Z,what site is axxo uploading too now?
,Death91,2008-04-06T10:46Z,"omg this has some really good seeders, thanks a lot! downloaded this with about 500kB/s and sometimes it went up to 640! Thank you all, I'll seed this for a while too"
,marios1975,2008-05-05T19:49Z,please seeed
,shazzaB,2008-05-19T14:33Z,"brilliant download. fantastic quality. 
i love this film! 
it download at around 100kb/s
this one goes highly recommended!
thanks TrackAddict42/axxo!"
