User Type,Username,Date,Text
,robinvarestorp,2006-11-10T00:55Z,"would you please start seeding? no offense, but what was the meaning of uploading if you're not seeding?"
,bobv,2006-11-10T03:14Z,sorry screwed up try it now!
,mina-1,2006-11-10T12:06Z,please seeda..
,iambuck,2006-11-10T17:25Z,seed
,gary_currington,2006-12-25T00:08Z,yo...moremore your link has less seeds than this one....thanks for the upload bobv...
,chadzky,2007-06-22T03:50Z,to silverbemr.... you are scaring!!! I hope that you will offer some alternatives. You are nuts!?@#&*^()$#@&
