User Type,Username,Date,Text
,bringsli,2006-12-03T13:41Z,sedd please :P    perfekt julegave jo
,gunnulf,2006-12-03T13:47Z,den kommer må bare få ut den på hesteryggen først. ca 50 % nå så det er ikke lenge til
,vigron,2006-12-03T14:14Z,"Kanskje noen kan forklare dette med seeding. Er det bare å sette på ""seed"" etter at man har lastet ned? Har ikke hatt peiling på dette og det gjelder kanskje flere."
,gunnulf,2006-12-03T14:22Z,jepp
,Power+,2006-12-07T18:22Z,"Du setter den til ""seed"" etter at du har lastet opp .torrent filen.
Når du har lastet ned fra nadre så lar du den stå slik at andre kan seed'e fra deg."
,oslojenta,2007-09-19T23:08Z,Kan noen seede? takk :)
