User Type,Username,Date,Text
,winet12,2008-01-06T16:54Z,"this is my first torrent, hope u like it. please comment and don't forget to seed ;)"
,donveli,2008-01-07T21:45Z,thanks! this one is needed!
,priester,2008-01-29T10:04Z,"Thnx dude, do you have anymore wakeboard dvds??"
,dittan,2008-02-14T22:10Z,"no, i don't think so. but if i find one i'll upload it"
,tommyt1979,2008-03-11T01:00Z,"I've been stuck on 99.9% for days now, anyone else having trouble completing download? It appears to be pieces 16 & 2699."
,DagbyTheone,2008-08-10T07:52Z,"Thank you! :)
Does somebody have "" The Book "" (Wakeboard Movie)?
or can help me find it?
Really wanna see that movie! ;) "
,dancerboy,2009-07-20T11:04Z,"Please seed!
Sn채lla seeda!

Gotta have this movie!! :)"
