User Type,Username,Date,Text
,highwinds,2008-02-25T21:44Z,working perfectly for me. nothing wrong with the files too. no infected files at all. thx for the upload!
,X-Vision,2008-02-29T02:05Z,"keygen has NO viruses, its just the way they work.."
,Terrifix2,2008-04-27T14:46Z,Hij zegt bij mij dat de versie verouderd is.
,daverimmer,2008-05-29T19:35Z,"Massively ridden with trojans, viri and malware not to mention root kits - ignore all promises that this file is clean.   DO NOT USE THIS FILE"
,TheOneX*,2008-05-29T20:26Z,the torrent is clean.
