User Type,Username,Date,Text
,Karras,2006-09-09T15:42Z,Would be good if someone could seed it to!
,wertlos,2006-09-09T16:36Z,"I've been seeding non stop with a 10mbit line. So maybe you have a NAT problem, or a firewall problem."
,Iger,2006-09-09T19:03Z,"Is it working for you, guys? I can't seem to run the official patch - it crashes with a message that
""No suitable patches were found""... Anyone has any idea?"
,gelia,2007-02-02T16:11Z,plz seed!!
,stars1477,2008-03-31T21:27Z,I don't mean to sound mean when I say this but....WHY PUT IT UP IF YOUR NOT GOING TO SEED!
