User Type,Username,Date,Text
,spm116,2007-09-07T17:24Z,"This will be the first torrent I've uploaded with my FiOS, let me know how the speed is! :-)"
,anders_and,2007-09-08T20:35Z,"it's daa-format, which means not everybody can use it ..."
,spm116,2007-09-09T22:06Z,"Sorry about the .daa, I wasnt paying attention when i ripped it.  But you can get PowerISO or Daemontoolz or Alcohol 120% and they will all open it just fine."
,Davidovich,2007-09-14T15:37Z,The right format please!!!
,apt2vanish,2007-12-03T04:49Z,"powerISO dummies
its the best compression around,
for anything, its all i use"
