User Type,Username,Date,Text
[V],saknad,2006-12-15T13:00Z,"BTW, it's encoded with quality 5."
,boknÃ¶rd,2006-12-15T20:07Z,"tack det var länge sen jag hörde dom, hadde t o m glömt att dom fanns  :)"
,boknÃ¶rd,2006-12-15T20:35Z,hur spelar man upp en OGG-fil  ?
[V],saknad,2006-12-16T18:35Z,"boknörd: Det går bra med de flesta moderna ljudspelare, men ibland krävs ett insticksprogram. Vilken spelare använder du?"
,battalion,2006-12-28T02:32Z,Jag bugar och tackar denna är kanon
[V],saknad,2006-12-30T10:21Z,battalion: vassego :)
,larza48,2007-01-28T13:32Z,"Please somebody!! Seeda  tack....fy f-n va jag har letat efter Ensamma Sussie..ett stor tack! har bara 5,4% kvar...seeda!"
,larza48,2007-01-29T21:56Z,PLEASE!..SEEDA NÅGON!!
,larza48,2007-02-11T19:52Z,Äntligen Ensamma Sussie...Tack saknad u r my hero...
