User Type,Username,Date,Text
,e.g.l.r,2006-11-22T14:46Z,1994 Jim Carrey.
,sigve50,2007-02-19T16:27Z,could someone please seed.
,dumukku,2007-06-18T06:57Z,Seed please. Stuck @ 97%
,GirlsBRKboys,2008-05-14T05:28Z,luciferxe lmfao you went hard
,BigFoot.BF,2008-11-06T00:03Z,luciferxe. if any one here's a moran its you. can u next time u leave a coment swear just a bit less?? btw u can ask nicely if u know what that means
,MikeQuest3,2008-11-15T07:50Z,"boy, one guy goes thru the entire process of ripping & then uploading a torrent...
and some guy goes thru the trouble of typing 3 lines of ungreatfulness & curses!!!
atleast this uploader has shared something for free & in return some smarty goes ahead & calls him a moron!
if you are such a perfectionist ""Go BUY the damn movie!""
PS : There is something called suggestions & they are not given like 'luciferxe' here did.
Mike"
