User Type,Username,Date,Text
,Spacy Bickerson,2007-06-21T00:52Z,"Commander ""X"" huh!! Makes you feel important to pretend you have secret knowledge dosn't it?
Stupid wanker playing at conspiricies."
,Ezel,2007-07-23T16:59Z,"Ok, I haven't seen the film, but if the Nazis are involved then why is Israel protected by the USA? Is that explained in some way?"
,Ruff-Destroya,2007-08-10T16:54Z,"everyone gots problemoz, so i gotta give my fucks of:
fuck all you motherfuckers, who think they know everything,about everything.
fuck you to the FBI and the CIA, fuck you to the AmeriKKKa, fuck you to the B-U-S-H and fuck you Bin laden, who the fuck do you think you are???
and especially those old dirty bastards named pedophiles, fuck you and you mother fucking disease, you sick old muther fuckers, fuck you!!"
[T],lkobescak,2007-11-09T15:26Z,"For more movies/music and files like this, check out my other torrents at:

http://thepiratebay.org/user/lkobescak "
,Ashkelon,2008-08-19T17:55Z,"What the guy says is interesting. But the idea that this is a video taken during a lecture i do not believe. Just listen to the 'coughing-samples' and the 'applause' you hear during the video. It's always the same sound-sample; there is no real audience.
Interesting stuff nontheless."
,topcat787,2008-09-04T02:25Z,Thank you.
,Wopatoolie,2009-02-20T01:10Z,"ruff destroya:

tnx for showing us youre a wigger, its not all of you who are stupid enuff to come right out and practically and proudly scream 'im an idiot!'. so go back to your WoW game in your parents basement where you live or your 40 year old mobile home with wet laundry everywhere surrounding your meth lab/kitchen and continue selling rocks while your children in diapers constantly run in and out the front door in winter, snug in in the knowledge that you have shown the world how fkn stupid you really are."
,Herkimer,2009-09-30T02:05Z,"I started watching about 10 minutes of this. Don't waste your time. I'm all for a good conspiracy, but this guy is undone by his himself. 
Remote viewing pioneer? Wow. Guess he didn't see any of this coming, like the dramatic shift in politics from conservative to liberal/republican to democrat? 
Hmm...
And all that stuff about Bush? Wow. Bush who? That kind of fizzled out to, but then again, he should have known?! Shouldn't he?
Time always seems to undo the piss-poor conspiracies. 
Bush is gone. Obama is in. Health care is the big deal. The NOW is sagging on the ropes. It's the same-old same-old. Who knows what's going on, but it sounds awfully convoluted to me.

Herk

Another beaut is Niaomi Wolf's little gem of celluloid about the rise of fascism in America, under, guess who? George Bush. To bad she didn't count on those soft, cuddly dem's not only continue the path of that fascist Bush, but redoubling anything he could hope to accomplish.
"
