User Type,Username,Date,Text
,Odins_Blade,2007-02-13T15:20Z,"Hay tere Mr.frank, you have sooo much content
have you ever tought you might start your own page/tracker?

Just a fan..."
,Kayel,2007-02-15T22:32Z,"Oh Yeah... Great idea!

FFF Private Tracker

only for Fat Fuckers!!

Wooho, i second that!"
,tomj1225,2007-02-19T23:02Z,A FFF Tracker? Where do I enter my credit card number???
,dollar34,2007-03-18T00:49Z,is this the whole thing of polina very drunk and young dr31?
,FatFuckFrank,2007-07-21T04:23Z,I'm a noob at the Internet; page/tracker?
,GRGUR,2008-02-21T00:30Z,FFF is king of porn.. thanks
