User Type,Username,Date,Text
,superberra,2006-12-14T20:47Z,what is the keygen ????!!!
[T],nystrand,2006-12-15T09:01Z,the crack is in the winrar file
[T],nystrand,2006-12-16T11:47Z,and the keygen to
,Zade911,2006-12-17T01:05Z,Någon som seedar? Hjälp!
,krull_91_,2006-12-18T12:07Z,Seeda!
,Zade911,2006-12-19T17:58Z,Seeda!! Är på 96.8 %!! >
,Zade911,2006-12-19T20:30Z,"98.9 %, 6 peers, 1 seeder."
,krille_n_n,2006-12-26T10:29Z,anyone who knows if this one workS?
,dummyboy88,2006-12-27T19:45Z,"plz if it works, comment and seed!"
,zincko,2007-01-06T00:03Z,Finns svensk installation med?
,nyable,2007-01-10T05:58Z,can anyone play the game? it kept asking me real CD after i installed it....please
,Gooffe14,2007-03-04T15:05Z,"är detta verkligen FIFA manager? för på uTorrent står det som fm07 och det är ju ett annat spel?? 
och seeda!!!"
,phillan1992,2007-03-17T11:50Z,Seeeda för i helvete
,psykosonne,2007-04-15T08:30Z,plzz seed this file. its stuck on 48% 
,psykosonne,2007-04-15T08:31Z,er der ikke en der vil seede
,jockebra_93,2007-05-31T21:07Z,är den på svenska?
,filip_9211,2007-06-07T22:39Z,funkar inte att ladda ner får bara nån fil me ca 150kbit :S
,kurd00,2007-07-15T16:07Z,do it works?
,abakaliki,2008-01-17T15:52Z,seed plz
