User Type,Username,Date,Text
,AnTi-kiLleR,2007-01-29T18:07Z,Gona SEED all the night long ;)
,AnTi-kiLleR,2007-01-29T20:16Z,Snälla hjälp till o seeda ;)... Jag kommer sätta upp flera filmer imorrn
,steff_ice,2007-01-29T20:22Z,Thank you!
,AnTi-kiLleR,2007-01-30T15:36Z,Hjälp Till o SEEDA ;) 
,grohild,2007-02-05T22:09Z,Please seed untill im done:)
,railroadr,2007-02-08T13:00Z,awesome download...  ty   been trying to get this movie for a while...  now i will seed for a while   :)
,Kermen,2007-02-09T05:33Z,very nice well im not done downloading yet NICE JOB!
,messupper,2007-02-15T15:07Z,skitbra jobb ska seeda den här iaf några dar
,jocketheshit,2007-07-02T00:00Z,Fattar inte var ni menar med Seeda?? vad menas med att hjälpa till att seeda?
