User Type,Username,Date,Text
,Powerpar7,2004-10-15T22:57Z,Klart hon blev lesbisk. Vi är inte värda henne...
,AstroZombie,2004-10-28T00:34Z,"Håller klart med, men synd på en sån babe !"
,Rimmer,2004-12-09T00:03Z,Härliga gamla Foxen!
,erzon,2004-12-10T20:57Z,"Fan va grymt det skulle vara om nån schysst snubbe seedade denna i tre minuter till! Snälla, det är ju snart jul! :D"
,Gisselo,2004-12-14T02:23Z,Seedar lite då  GOD JUL!!!!
,heggiiman,2005-02-27T15:42Z,Hon är faktiskt bi-sexuell
,Black-Mamba,2005-04-06T13:08Z,I've always had a thing for Samantha Fox as far back as I can remember. Thanks for seeding some of her pics! :)
,leeway,2007-10-08T00:15Z,PLEASE SOME ONE SEED!!!!!!!!!!!!!!!!
,Rebali007,2012-02-27T17:36Z,"har 54,5 % i have 54,5 % "
