User Type,Username,Date,Text
,Beksinski,2006-11-27T07:30Z,"Thanks for all the Makevejev, great additions!"
,lillemask,2006-12-25T22:51Z,Improved (readable) English subtitles for this film here: http://www.opensubtitles.org/sv/subtitles/3092202/w-r-misterije-organizma-en
,korpatalik,2008-03-16T21:59Z,I've heard of this film from my friends and now I'll see it for myself. thank you kegir. 
,rogerpP,2008-09-26T09:53Z,"D/l now, many thanks."
,Lovefoxxx,2008-11-18T19:15Z,Thank you very much :D
,thitapet,2008-12-14T03:14Z,"thank Very much! 

downloading on progress..."
,ShineOnYouCrazyTorrent,2011-06-22T20:05Z,for once i dont have to download the subs xD suck it :D good upload i will seed for a bit
