User Type,Username,Date,Text
,chifus,2005-06-20T09:11Z,Third torrent for this episode and no seed on all of them. =(
,surfarn,2005-06-20T13:56Z,Kan någon vara snäll och seeda. Tack.
,yavin2,2005-06-20T16:17Z,"Alltså... varför finns det inga widescreen-releaser av säsong 2? Jag blir vansinnig. Den här slaktade fullscreenskiten går ju inte att titta på. (jag provade ;)

Inget ont till Discobear för seedningen men jag menar... releasegrupper skärp er! :P"
[T],Robin86,2005-06-20T16:48Z,"Jag tror att det är så att USA Network inte sänder i widescreen, vilket är konstigt med tanke på tom TV3 sänder serien i widescreen. Det är samma sak med Monk som också sänds på USA, tyvärr."
,Ismyname,2005-06-26T05:37Z,Is this widescreen 16:9 or crappy 4:3???
