User Type,Username,Date,Text
,islendingen,2005-06-11T00:24Z,"noen som gidder å seeda nr1 litt til. er stopp på 98,9%"
,AntiJw,2005-06-11T05:16Z,LillaJag: Latest DVD-Decrypter is version 3.5.4.0.
,Onte321,2005-07-06T21:38Z,"EY, this is DVD #2, i checked it in my dvd-player. Because first dvd is 5 million years ago, second is 100 m years ago and third is 200 m years ago, BUT THIS FOR 100 MILLION YEARS AGO!!!  "
,zelos,2005-07-09T23:04Z,"its not years ago, its years into the future"
,Onte321,2005-07-10T15:05Z,"sorry, ma bad, i was wrong"
,snygg_grabb,2005-08-17T20:55Z,"LillaJag. Jag håller med dig där.
Jag har 1 låt som alla har 92,6% klar men ingen har mer än så.
SÅ jag håller med dig.
Men jag har väl inte varit så bra på det. Men då jag får min nya 24Mbit så blir det fult ös. Har nu bara 0.5Mbit så har inte varit så från mig men när jag får 24Mbit så  är jag en av dom som har det tills någon ladda 2-5 fulla omgångar så det blir några som har den osv."
,Captain Perverto,2006-09-14T00:57Z,Can anyone seed this for about a day? I'm at 74.3%
,ButterC,2008-11-22T19:46Z,"Hej 

Underbara filmer. Skulle du vilja seeda alla dina walking with filmer igen Och the future is wild samt torrenten med cover bilder. Får jag hem dem så seedar jag på tills de får ett eget liv"
,ezboard,2008-12-04T21:02Z,"does anybody have an ENGLISH dvrip of this with NO subtitles? or know where I can find it?

nobody fucking likes DVDs "
