User Type,Username,Date,Text
,ahshera,2007-11-25T23:03Z,Seed please! A 100% copy is not available.
,Isaac85,2008-03-06T07:33Z,Hi Godarium I remember your username from demonoid b4 it got shutdown. I'm lookin for some more NLP vids and wonder if u mite be able to help. I'll check bak here in a few days
,jtrying,2008-12-20T08:05Z,"Archive reports as Not a Valid Archive.  If you got this to work, leave a comment saying how.  Thx"
,bullisman,2009-01-19T21:50Z,This is NOT a valid file.  DO NOT WASTE YOUR TIME DOWNLOADING!!!!!!!!!!
,wairo,2009-05-31T09:25Z,I DOWNLOADED THIS :RAR ONLY TO FIND OUT THAT IT IS EMPTY.  DO NOT DOWNLOAD.
,chickensaladisgood,2009-07-22T23:03Z,"All of these files are available for individual download in the following torrent:

http://thepiratebay.org/torrent/3676662/Library_of_NLP 

I have used this one and it works fine."
