User Type,Username,Date,Text
,NisseP,2007-04-13T07:02Z,"Hm.. Hoppas det är lite mera än 5 min ljud... Nåja. det duger ju det också...

Har nån skiva med ljud från Djungeln som Mattias Klum gjort - men det tråkiga är att han pratar... jag skulle vilja haft alternativet att inte behöva höra hans babbel också... ungefär som på en dvd där man väljer om man vill ha subtitles eller inte..

Nån som är intreserad av den så slänger jag upp det..
/NisseP"
,plus50,2007-04-16T07:20Z,"Jag söker efter skivor med fågelsång.
Alla typer av naturljud är ytterst välkomna, föredrar dock nordiska "
,plus50,2007-04-16T07:21Z,"Gömde bort, tackar ._. många tack @_@"
,orgpunk,2007-04-17T23:50Z,"""Spår 3-9: Det är månskenskväll, nollgradigt, klart..""
Hur kan en som är blind veta om det är månsken och klart? En jävla bluff är vad det är. Han har säkert suttit vid en dator och gjort hela skiten."
,orgpunk,2007-04-17T23:54Z,"""Han har en suverän förmåga att imitera djurläten."" Där har vi ju svaret! ""Kuckelikuuu, nöff-nöff, kvack kvack, muuu, vov, mjau.."""
,Jimmy_Manen,2008-03-03T13:58Z,"Hoppas någon kan seeda denna,, skulle vara trevligt. Jimmy"
