User Type,Username,Date,Text
,vikramhegde,2006-12-30T21:22Z,i am stuck with 64% please help
,Minze,2007-08-17T04:47Z,Someone seed please!
,airdao,2008-08-08T02:52Z,For the love of G... Please seed!!! it has been 8 days and all I have its 11% I already uploaded over 2.5 gigs please please seed.....
,Codeb,2008-12-30T12:11Z,Thanks Drezic 4 ur wonderful uploads. I kindly request 4 an upload of only CISSP since this is quite big as it will take me ages to download. Many Thanks
,shoaibnohani,2009-02-14T18:55Z,Dear Brother that is great to help some one like that 
,shoaibnohani,2009-02-14T18:57Z,its not big which file u need just check that and download its easy not download all 14gb  
,shoaibnohani,2009-02-14T22:41Z,Dear it is not downloading file 
,shoaibnohani,2009-02-14T22:42Z,"i am also having problem with this plz send me the solution on my mail
shoaibnohani@yahoo.com"
,shoaibnohani,2009-02-14T22:44Z,if there s any other source of all these plz tel me
,shoaibnohani,2009-02-15T10:18Z,dear sir these all file r included in my course plz send me the where to take all these
,shoaibnohani,2009-02-15T10:23Z,its stop 0.07%
,kudhi,2009-12-08T07:10Z,Nice Collection.. 
,kudhi,2009-12-08T07:11Z,Someone SEEEEEEEEEEEEED Pleaseeeeeeeeeeeeeeeeeeeeeeeeeeeeeee
,ssbk,2010-02-01T18:04Z,Please seed! :D really want this package!!
,amylinda333,2010-06-14T17:30Z,Someone Plz seed........... I really need this.
,LinuxLair,2010-07-17T17:36Z,"To Know More About Linux,friends in India can send an SMS having text:rnrnON LinuxLairrnrnrnto 9870807070rnrnIT\'S FREE!"
,LinuxLair,2010-07-17T17:39Z,"To Know More About Linux,friends in India can send an SMS having text \""ON LinuxLair\"" to 9870807070 IT\'S FREE!"
,LinuxLair,2010-07-17T17:41Z,"To Know More About Linux,friends in India can send an SMS having text ON LinuxLair to 9870807070 ITS FREE"
,anuruddhapremalal,2010-12-28T12:27Z,guys please seed....
,BIGDOG76,2011-04-07T04:51Z,Can someone please seed the WinXP2 and ISA Server.  I have had these at 63% for a month.  I want to get them pleeeease.   I am/will seed.
,enhu,2011-04-16T03:34Z,"no seeders? please seed this i'll be seeding this for a month.. 

need your help.. please seed."
,L4UCH4,2011-08-17T06:05Z,Seeeeeeeeeeeeeeeed please :-(
,sherry177,2012-01-26T23:34Z,can somebody provide me the link for the training videos of windows server 2003 by Mickel Shannon or by Grant A. Moyle
