User Type,Username,Date,Text
,lovesercher,2007-12-04T10:38Z,"Just unrar a girl to a folder, doubleclick the top file and start extracting to install the girl, do the same with all the girls."
,1irish1,2007-12-11T01:31Z,"Once you: Just unrar a girl to a folder, doubleclick the top file and start extracting to install the girl, do the same with all the girls.

Then what...How do you play/control the girls???
All I get is a bunch of .mpgs."
,Lupine666,2007-12-13T09:59Z,"hey Irish,

 Get the main install first from the same poster. you dont need the pictures folder just the main install. 

Remeber to copy the instructions before trying to install. Good luck"
