User Type,Username,Date,Text
,gazcoo,2005-03-24T13:59Z,"bra platta, men den släpptes väl innan 2005?"
,preludin4,2005-03-24T14:08Z,Jag måste ha snappat upp datum för ett återsläpp.
,KenRing,2005-03-24T15:00Z,"sloopy seconds skulle väl i så fall vara deras nyare, sen har du deacon the villain droppat två skivor . o dem två andra medlemmarna har droppat en vadera. "
,g00fy0,2008-02-27T13:22Z,"thanks mate will DL
nice sons"
,FenaC,2008-09-18T17:03Z,men det står ju 2001.. vad är problemet ? 
,theFuzz,2009-01-10T13:47Z,riktigt bra album!Tack 
,psichoate,2010-03-22T21:41Z,"sweet, spreading the linguists to foreign lands;
big ups preludin4, big ups to the A"
