User Type,Username,Date,Text
[V],Dr.Strangenoise,2006-12-26T16:21Z,Thanks!!
,Redstyle,2007-07-20T18:45Z,Cartman is a bitch!!!
,Hampus0hell,2007-11-12T22:42Z,´seed please and thanks!
,Curb71,2007-12-07T04:42Z,"Would love to see an torrent called ""Songs from South Park - UPDATE 3 - 11 Seasons Collection"" which would be all the songs from Season 11. And there was some good ones!"
,minisemi,2008-04-20T21:21Z,"Grymt skön torrent. Längtar tills jag laddat ner den.
Min favvorit är nog ""It's Easy Mmmkay"" :)"
