User Type,Username,Date,Text
,abbe123,2007-08-31T23:08Z,come on. I think we got it now....
,Orion2215,2007-08-31T23:09Z,NOT A FAKE!
,abbe123,2007-08-31T23:15Z,no but its the 100th copy of the crack now
,peeweesweden,2007-08-31T23:32Z,Seen this released twice this evening now. And I'm slow. 
,KaZze~,2007-09-01T11:35Z,"Can anyone give some instructions? I've installed it and then it tryes to patch, if i click OK when says it needs the right CD it will delete all the installed files. Please help!"
,sohei_qi,2007-09-05T19:50Z,"Hi there Kazze to get the game to work or how i got the game to work was. When it told me that i had the fake cd/dvd  i just pressed win key + E to bring up explorer then naved to folder  copied and pasted  and renamed it. Then Went back to the installer and pressed ok. I don't know if u need this to run it but i have it its the daemon tool. then it should work. the down fall is that u don't get any updates, and u have to re enter your key-binds every time u start the game. It also crashes don't know if thats my PC or game foult"
,MJLambert,2007-09-07T13:35Z,"guys. something odd here. this original download was just under 10 meg to download. 


so where has the extra meg come from???.....

hope you got AV :/"
