User Type,Username,Date,Text
,kitewinds,2006-12-30T06:23Z,"thanx, but without seeding it just as slow as dl it from the webpage."
,kitewinds,2006-12-30T07:58Z,"oh, the website one is 3106..."
,silversurfer9999,2007-01-19T13:43Z,"Hey, anybody got SN for Parallels v. 3120"
,mac_davis,2007-01-26T14:16Z,"This one worked for me: 3DO15-DBVLF-MUXQ7-SWFM7-H0Q9S

Here are two more from the SerialBox:
9V07D-KJ94H-PWXE5-RST6I-LDQ40
0TZ34-7XW44-UXHOH-8TXIE-VVYIW"
,Nelly4Vitality,2007-08-22T13:51Z,"needs the iso file for windows xp to run doesn´t work without

Idiots serial isn`t enough"
,4share,2008-10-17T22:21Z,plz seed. does this one works gr8 ?
