User Type,Username,Date,Text
,GetSeeding,2007-08-17T05:15Z,"Come on FFF, give us something non-Asian. I'm afraid one of these videos might have them shoving squid in their asses or something."
,!Fear_of_dark!,2007-08-17T22:45Z,"soooo.... havent seen any Beastiality up on PB for awhile, so i ask once again. PLZ FFF(the real) Bring up some beastiality, plz Petlust cuz i like to see some human male cum dripping from a Female dog or possibly a Mare! ALL HAIL THE MIGHT FAT FUCK FRANK!!!"
,FatFuckFrank,2007-08-24T04:23Z,"OK, be in the mood for asian lately..........."
,metubb,2008-07-08T07:02Z,"How do you play this thing?  Media Player, Quicktime, RealPlayer, FLV, DIVX, etc. don't work.  Any ideas?"
,metubb,2008-07-09T07:30Z,Is there a Codec you need to have installed?
