User Type,Username,Date,Text
,jackman81,2008-01-04T06:42Z,"More mother/son/daughter action you can find via Porn Sites Rated, http://www.pornsitesrated.com/main_mature.htm"
,neghy4u2,2008-07-01T22:05Z,seems nice :)
,ridgetopusa,2008-07-15T21:57Z,"This really is a nice family video.  Sister is cute and bashful, but Mama wants to do sex ed. today, and strips Sis for exploration purposes.  Brother is then forced into the act and the education process proceeds well."
,NotSoPrettyRikki,2008-08-23T06:54Z,"what's Russian for big floppy tits??

I'd pass on this one -YMMV"
,ridgetopusa,2008-10-31T20:06Z,This is actually well done and I enjoyed watching it.
,ridgetopusa,2008-11-10T18:01Z,"I'm not sure what the Russian for big floppy tits is, but the German for Bra is ""Keepsemfromfloppin"" "
,vlad_09,2009-07-20T13:35Z,super
,andszcz,2009-08-30T13:24Z,"it's not russian, suppose slovakian or czech"
