User Type,Username,Date,Text
,shakewell,2006-04-04T01:07Z,"""Theme from 'Shaft'"" won an Oscar..."
,The_Lestat,2006-04-25T08:10Z,I just want the Queen of the damned one is there any way you can just post the Queen of the damend sound track for me any one. i will Seed it i promise
[V],Moitas,2006-08-16T00:27Z,"I would just want the Queen of the damned soundtrack. Could you upload a new torrent, please."
,au_pair,2006-12-14T11:26Z,please please seed i need the shrek soundtrack for the kids i look after please seed! thanks
,FCCKiller,2007-10-14T01:22Z,What is the bit rate of each song?
,Callumlwd-2008,2008-03-02T17:23Z,Seed Plz
