User Type,Username,Date,Text
,yeager,2006-01-07T16:55Z,"Excellent!

Please seed Dungeon Master Nexus if you got it"
,Frezzno,2006-01-07T18:43Z,"Sorry but I don't have DM nexus. What I know is that it was only available on Sega Saturn and Japanese language only. Also that it features real 3D graphics, impressive! If you still want it, this might help you: http://dmweb.free.fr/"
,Articluna,2006-05-24T18:48Z,Could I ask some seeding? I'd love to have this one :)
,xnag,2006-07-21T04:26Z,"Wow, i finally found this rom. Can someone pls seed? Thanks in advance."
,xnag,2006-07-31T04:00Z,"Im been asking for this rom for quite some time, can someone pls seed this. Thanks."
,konche_08,2006-12-21T20:58Z,"ummmm yes...... I know this is kinda stupid, but can anyone tell me how to use the torrent after i download it????"
,sublimemaco,2012-05-20T00:03Z,"I have the neogenisis emu v16 on my xbox, and it is said to play mega cd, but when I tranfer it, it wont start, any clues?"
