User Type,Username,Date,Text
,levelehu,2007-01-10T22:57Z,"Mas is megoszthatna egy kicsit amit letölt, tölem lassan 24 oraja megy, sokan töltik de nem osztjak meg miutan atment"
,sts9kid,2007-02-03T22:51Z,"guys, this is the hungarian version with original audio track.  NO SUBS.

Decent quality

please seed!"
,Skynet-TX,2007-02-15T07:54Z,"Hello!

Aki már letöltötte a fájl, igazán seedelhetné pár órát. (De még inkább pár napot.) Jelenleg egyetlen seeder van és a fájl nekem 1 kb/s-sel jön 3 Mb/s-es hozzáférés mellett. Ha egyszer elkészül, én biztos seedelem pár napot. És el?bb készülne el, ha más is így tenne."
,Anton_norton,2007-12-17T06:22Z,"some1 who has this with subs? english or swedish, that would be great!"
,freiheit01,2008-03-02T16:41Z,I'd also really appreciate subtitles for this (english or french). I couldn't find any anywhere...
,dclau,2008-08-17T15:00Z,"I will seed this for a week. Why? Because i like this and because i can. Excellent music there :D
""... ha akcioba lep ez a gang..."" :))"
,nstokholm,2008-08-24T14:23Z,"I would also appreciate if someone made a subtitle file for this one. I am currently seeding it, but without being able to understand anything of it myself. English, French, German or any Scandinavian language would do."
