User Type,Username,Date,Text
,D3LinQuENT,2007-03-24T03:52Z,dont download this ugly girl its not worth wasting time
,BlockFive,2007-04-01T16:19Z,Very nice looking girl.  Anyone who thinks otherwise has only seen naked women in porn movies.
,MisterKew,2012-04-11T14:52Z,"stuck at 97 % please seed some one, then I will reseed"
,nick_t_g,2012-06-07T00:41Z,"Well, here is a challenge for the ammature sleuths. Who is she?
Power sockets say she is from UK.
Bus Shelter Signs say Manchester.

What is the point of being a porn star if we can't send her fan mail? "
