User Type,Username,Date,Text
,FaderAbraham,2006-12-02T21:44Z,http://imdb.com/title/tt0052365/
[V],flyboy1,2006-12-02T21:49Z,Er det Norsk txt på denne?
,FaderAbraham,2006-12-02T22:05Z,Läs infon... Noruego.
,garibaldi1131,2006-12-04T09:22Z,SEED!!?? All clients stuck at 3.5%
[V],flyboy1,2006-12-04T10:17Z,"Flott, da prøver vi den ;)"
,harryhaffa,2006-12-04T10:57Z,acabort yuo have to seed it dosen get uploded by itself
,carpanetti,2006-12-07T09:00Z,"VILL DU HA NYA DVDR SÖK PÅ Google SwePiracy VI HAR ALLT NYTT!
DET ÄR BARA TILL ATT REGGA SIG!"
,Error Flynn,2006-12-10T03:54Z,"Finns redan en torrent med eng prat.
plus att dom vevar filmen på TCM"
