User Type,Username,Date,Text
,pappe,2006-01-15T11:16Z,Brilliant.
,Totonteac,2006-03-03T23:35Z,"Could someone please seed some? I'm stuck on 84,8!!!

By the way, this is one of the greatest films ever made!!!"
,heyz,2006-04-11T21:54Z,Finally! Someone is actually seeding this! Great!
,chennie,2006-12-11T15:49Z,"PLEASE COULD SOMEONE SEED**
PRETTY PLEASE..."
,Tokgalningen,2007-02-07T12:42Z,"Seed please, stuck at 98.4%..."
,yorif,2007-04-27T23:57Z,seed please!!! have a nice day!
,bealfeirste,2009-03-26T14:48Z,"Thanks for this, I've wanted to see it for ages! I've downloaded and am seeding. Can someone please explain how I use the subtitles? Sorry, I'm computer illiterate. Whan I click on the SRT file, Windows cannot open it and doesn't recognise the file type. Do I need to download something extra for it? Thanks!"
,bealfeirste,2009-03-28T15:07Z,"Never mind, I figured it out. Thanks!"
,mariannal,2010-06-26T02:20Z,thanx so very much. I saw the movie in that time and i am dying to see it again after so many years.Everybody: see this!And of course I seed
