User Type,Username,Date,Text
,Bfire,2005-01-12T16:43Z,"Tackar!

Har du tillgång till kommande avsnitt i serie 8?

tror de har visat 8x03 redan va?

=)"
,lillsela,2005-01-12T17:31Z,Nej just nu ör det slut på filer ett tag - Men jag fortsätter att leta
,Jocke666,2005-01-13T17:47Z,Tackar för alla episoderna!
,mulle27,2005-01-15T22:30Z,"Du lyckas faktiskt få denna vinter att inte bli fullt
så trist som den annars skulle varit. Eloge och stort
tack!"
,Martinf_89,2005-03-12T11:54Z,"dessa avsnitt har itne gått  på svensk tv va??
Tack för en riktigt bra serie=)"
,etxkgh,2007-01-18T17:16Z,seed plse !
