User Type,Username,Date,Text
,alarik_2,2007-05-02T17:02Z,Can someone with a better connection please seed the torrent? It is dead slow as it is... 0.2 kb/s!!!
,nada666,2007-08-13T18:10Z,yes seeding appreciated! thanks!
,nada666,2007-08-14T17:17Z,pls seed. its very slow. thanks alot!
,goal563,2008-03-06T10:40Z,thx a lot  ... have been searching this for a loooong time ... pls keep seeding !
,indra555,2009-02-12T06:20Z,Please seeeeeeeddddddddddddddd
,indra555,2009-02-12T06:21Z,I have been searching this for a loooong time ... pls Seeeeeeedd!!!!!!!!!!
,indra555,2009-02-18T22:11Z,plz plz seed its too slow............
