User Type,Username,Date,Text
,Gisselo,2006-11-23T00:02Z,"why new file type (ZIP) are you going to seed the RAR file,
http://thepiratebay.org/tor/3556933/http___tpb.tracker.thepiratebay.org_announce
are you gone stop seeding this one at 59% to?"
,RelaxU,2006-11-23T19:51Z,"A very GOOD Mix :-) Mr Pekk66
Thank you...Tacka såå Mycket !!!"
,JiMMU_,2007-01-24T17:38Z,"Tack för denna!
Dock lite halvseg att få hem, men nu är den alldeles strax nerladdade´!"
,D34C0N,2008-07-27T09:59Z,You've got to be KIDDING me with this zip file crap.
,Sergios119,2011-04-30T16:15Z,"-_- can you please unzip and reupload? i cant even download the zip, not enough seeds! Besides, all i want is the a1 take on me, JUST ONE! bad download!"
