User Type,Username,Date,Text
,ZeNiTH_NL,2007-04-01T22:16Z,"Stopped seeding this one on the 1st of April 2007. 

If you still cant get it in after a long wait, and really want it, contact me on tpb!"
,ZeNiTH_NL,2007-10-13T21:09Z,seeding again @ 13 okt 2007 
,dnb4life,2008-02-21T06:44Z,can someone please seed?! i'm stuck on 67% and it hasn't moved for weeks!
,ZeNiTH_NL,2008-02-24T21:04Z,"dnb4life, I found them (the seinfeld movies you are looking for), contact me at insearchformore (at) hotmail.com "
,ZeNiTH_NL,2008-02-24T21:06Z,Seeding again! :)
