User Type,Username,Date,Text
,pnobre,2006-12-05T02:23Z,"subtitles ? anyone ? portuguese preferred, but at least in english will do!"
,Flokker,2007-12-10T06:50Z,"Aye, subtitles would be grand. Looked all over and haven't managed to find any."
,Flokker,2008-02-27T06:48Z,"Finally found subs for this. You just need to rename the text files to match the video files. Sub quality is decent, better than learning to speak French.

http://www.divx-titlovi.com/cgi-bin/titlovi/47876-lesmiserables2000.zip"
,vitor123,2008-11-05T07:23Z,"i need the subtitles in spanish, espa単ol amigouuu!!! i need help me"
,Speedgrapher,2009-05-08T18:05Z,"Thanks for the upload!

Subs can be found here: http://subscene.com/Les-Misrables-Miserables/subtitles-73124.aspx

Not that they are too great, but better than nothing ^^"
,puppyup,2010-11-13T15:39Z,"Matching English subtitles:
http://www.opensubtitles.org/en/subtitles/3951833/les-miserables-en

Subs for CD2 have a 2 min gap at the beginning though. Apart from that OK."
