User Type,Username,Date,Text
,nesfreak,2007-12-10T23:04Z,"""Resident Evil: Exstinction""
Please, learn english or atleast TRY to find out how it is spelled before you upload...
It's ""Extinction"". Not ""Exstinction""."
,jeroen68,2007-12-13T19:23Z,ziijn de subs al meegebrand en daarna geupload? 
,Meesterbietser,2008-01-16T19:51Z,"Dude give the guy a break. One Spelling error will that kill a guy?? No i aint bothered. I'm downing right now and i hope it's a good quality.

Top dat deze rip er is hopelijk is het een goede kwaliteit qua geluid en beeld."
,patrol_man,2009-10-17T14:53Z,you just have to download them ik lig er niet wakker van dat de naam veranderd is:P
