User Type,Username,Date,Text
,hurrafor,2007-07-19T16:19Z,"ABSOLUTELY works....you just have to do a little digging:

First, you need HDTVPump:

http://www.dvbportal.de/projects/hdtvpump/

And then (At least for any HD-DVD releases by HDTV_CHINA i have) you need Matroska Splitter

http://haali.cs.msu.ru/mkv/

You will also need to have a MPEG2 decoder previously installed. NVIDIA's works. If you can play a DVD - chances are you have a valid decoder.


Install those and report back!

KMPlayer to play HD from HDTV CHINA
http://kmplayer.kde.org/download.php

If you download those 3 and install them all downloads from HDTV CHINA will work Have downloaded 40 and all works"
