User Type,Username,Date,Text
,biggidude,2007-05-21T00:50Z,"Don't download this, i have never complained on pirate bay, but this was just horrorble :("
,antropos,2007-05-26T00:50Z,"biggidude, what was wrong with it?
I had no problems with it. Not super quality, but not bad either."
,ivar____,2007-05-30T15:37Z,"The Simpsons this is wallpapers and icons and more

http://thepiratebay.org/tor/3661780/the_simpsons_wallpapers"
,jordymarkus,2008-05-19T20:14Z,"theres nothing wrong with the quality, thanks uploader."
