User Type,Username,Date,Text
,cdtext,2009-03-07T08:54Z,Please come back and seed. I want to get the extras.
,cdtext,2009-03-07T08:59Z,"If you weren't aware song numbers 101 to 200 of 2008 is listed at the triple J site:
http://www.abc.net.au/triplej/kingsmill/playlist/s2475563.htm

It has been made into a torrent for us at Pirate Bay to download:
http://www.abc.net.au/triplej/kingsmill/playlist/s2475563.htm

If you want to see the 101 to 200th song list of past years, please post a comment to Richard Kingsmill's (The station manager and an announcer) blog where he lists the 101 to 200 songs:
http://www.abc.net.au/triplej/kingsmill/playlist/s2475563.htm

I have got the ball rolling. I also would like to see him publish the entire list so we know exactly where our favourites ended up."
