User Type,Username,Date,Text
,jimmyyyed,2006-08-23T12:06Z,cool another one for my collection. i hant finished downloading it yet but it looks good thanks man.
,sjreklaw1,2006-09-18T17:36Z,please seed
,XTZGZoReX,2006-11-20T18:00Z,:D
,jamesdyler,2010-05-09T23:35Z,Thank you for this one Adam!
,Nephy,2010-08-11T14:06Z,"Awesome, thank you! i've loved this album since hearing it first during a 2007 Thai air trans pacific...=)"
,Delron40,2011-09-09T09:11Z,"Definitely Keane's best album, and one of the great albums of our time which has sadly gone unnoticed for the most part. Thanks for this one. I already own it, but needed a quick copy to transfer to my phone. Cheers!"
,tpbkeane,2012-05-09T10:20Z,thanks. Keane rocks. Can you please upload Keane's 'The Theft of Octo' too. Please...
,messiahg,2012-08-05T20:37Z,;D
