User Type,Username,Date,Text
,zarvensha,2007-07-15T15:09Z,Very nice quality rip. Not enough of them. Keep up the good work
,thewolfdog123,2007-08-03T07:24Z,it is not 1981 its 1988 get it right
,betafin,2008-02-21T02:59Z,"wolfdog your a petty punk.The year is irrelevant.Just be glad someone is putting it up,if your able to do that w/o complaining.Sammicic thank you"
,Starpass,2008-04-20T03:07Z,"Thanks for the upload sammicic. 
This movie is right on the money with the possibility we are living with reptilian shape shifting aliens. The Bible refers to them as the Nephilim who bred with human women.
This bloodline is supposedly the Illuminati; 

and ""betafin"", you can stop being an ass. The year is revelant, whether you like it or not, so stop being such a baby."
,thematrixexpert,2008-06-25T01:28Z,awesome
[T],Knaster,2008-09-09T22:36Z,Its time we took back our planet.
,redox1,2008-12-12T03:33Z,nice one. good quality 720x304
