User Type,Username,Date,Text
,ksoktogon,2007-01-28T23:21Z,"MORE INFO:
http://www.amazon.com/Walk-Line-Widescreen-Joaquin-Phoenix/dp/B000E8QVWY"
,ksoktogon,2007-01-28T23:23Z,How about compression?
,=michael=,2007-01-29T08:19Z,thanks!!
,ksoktogon,2007-01-29T12:33Z,"Many thanks, but stuck at 2,5%. Any hope for downloading?"
,=michael=,2007-01-29T18:29Z,yes a seed would be very nice!!!
,Darkblader99,2007-01-30T15:29Z,"I'm seeding it guys, don't worry...
But if the torrent's stuck, also don't worry, because my connecting has than be broken down. than you'll have to wait a little while.
but yes, i'm seeding it!"
,ksoktogon,2007-01-30T22:09Z,"Stuck at 6.5% is really better than at 2.5%. But seriously, once again the question, how about compression?"
,MotoCrazy,2007-02-08T02:47Z,Region?  NTSC or PAL?
,TheSpenner,2008-06-04T06:54Z,This is PAL not NTSC.
