User Type,Username,Date,Text
,Tohtori_x,2006-11-15T13:29Z,awesome
,mondeo98,2006-11-16T23:15Z,"It would help, if u seeded ya file.... "
,Skrotnisse4,2006-11-23T01:20Z,Why would you write 'awesome' in a comment on your own torrent? suspicious.
,capcanes,2006-11-24T10:43Z,and why the hell you don't seed?
,bhp540,2006-12-14T18:54Z,what a prick lol
,Mouse_103,2007-01-05T07:54Z,"can someone seed this or give me a download link 

Thank you :D "
,cha0s666,2007-01-28T16:09Z,seed please
,BatistaSL,2008-01-17T07:47Z,Awesome my ass..No seeds..
,alaj1968,2009-01-25T04:53Z,is this a new way of torrents now a days??? no SEEDS! tsk tsk
