User Type,Username,Date,Text
[V],fiske5910,2006-10-11T10:25Z,Seeda detta verk
,Salicia,2007-01-17T23:30Z,"Vore kanon om ngn kunde seeda det här? Fast på 85%...
Kristina Lugn regerar."
,idaeva,2007-03-19T23:36Z,"Snälla, kan någon seeda denna goding?? Jag har fastnat på 79%...."
[T],WoC,2008-12-01T16:15Z,Skaffa hela godispåsen istället: http://thepiratebay.org/torrent/4546220/Esbjorn_Svensson_Trio__Nils_Landgren_and_Kristina_Lugn_-_5_albu
,BungleMe,2009-02-08T21:55Z,"skulle gärna ha hela godispåsen, problemet är bara att det är mp3, med andra ord någon har pissat i den"
