User Type,Username,Date,Text
,Surrifaxx,2006-07-22T03:47Z,haha... mjaha... kollar v채ller p책 denna sedan d책 oxyd :P
,john blaze,2006-07-30T18:10Z,i am having a problem with the program looking up info when i put in a movie name. is this because its cracked and there isnt a registry key? other than that program is great just need it to look up the shit.
,=michael=,2006-11-05T21:07Z,crack??? thanks!!!
,=michael=,2006-11-05T21:09Z,sorry there is a crack!!! didnt saw it...
,helloherbie,2007-03-19T20:27Z,Great! Thank u very much :)
