User Type,Username,Date,Text
,dnasty,2005-07-28T05:43Z,"Thanks for the upload, good stuff."
,nylo,2005-07-29T09:13Z,How do i burn this??
,KingPepper,2005-07-31T00:03Z,"Right Click on dfbhd.001 to Extract ISO Image, then use either Alcohol 120% or DVD De-Crypter,
But Sadly the game can NOT be Converted to Pal, as all i got was a Black Screen!!!!!"
,rpsjr23,2005-07-31T10:41Z,Im using a MAC computer and when i dl'ed this file there was no rar file. How do i extract it to an iso? What program do i use?
