User Type,Username,Date,Text
,Highlife,2006-11-28T23:01Z,seeda järnet
,jian zar,2006-12-20T15:39Z,"how can i get this piece of shit to work? i have downloaded it but there is no install shit coming along with it.

kordan får eg dette drittet til å funke? eg har lastet det ned men det ekkje nokke installerings dritt som følger me den."
,WildRover,2007-01-07T05:28Z,mounte bin fila i daemon tools eller brenn den ut da
,Alluboy,2007-03-21T06:04Z,seed please
,Alluboy,2007-03-21T16:24Z,"seed please stopped at 90,2%!!"
