User Type,Username,Date,Text
,safir590,2006-01-08T07:57Z,"Tja baaaa!! någon som kan vara vänlig och seeda, är i syort behov av översättnings hjälp, tackar."
,Delaval,2006-01-21T22:33Z,seed please
,Abraxas77,2006-01-30T07:49Z,Will someone please seed this for me?
,jamming interference,2006-02-06T09:39Z,Please please please :-D - could someone seed again?
,jamming interference,2006-02-06T11:20Z,Thanks a lot to you who start seed after my request!
,seekn_destroy,2006-02-16T10:02Z,"ohh, excause my stupidity, I just run it with alcohol and it works perfect... but do you guys know any program that can handle many words at a time???"
,riverbum,2006-02-18T23:28Z,"I have downloaded the torrent and got 30 identical RAR files called aoword8p. Each RAR contains an image file aoword8p.cue and a file called aoword8p.bin.

I have mounted the file and run it but when I get to the point where I have to enter the registration codes and run the keygen I get the message 'This keymaker needs to be run from the directory of the file WFC.DAT'.

I am using Alcohol 120%

Could anyone please help?"
,piiiiiiiiiiiiiiiiiiiiiiip,2006-08-31T16:51Z,can somebody seed please?!?!?! I need this shit!
,BlackPrincess,2006-12-18T15:04Z,"Thank for the upload :-), guys :-) you're the greatest"
,tagemus,2006-12-30T20:35Z,"Tack
Kanske någon seedar"
,Monkeyduff,2007-01-06T05:15Z,"Kunnskapsforlaget

Engelsk Blå Ordbok

ENGELSK STOR ORDBOK
Engelsk-norsk / norsk-engelsk

Engelsk-norsk/norsk-engelsk
Lingua
"
,Nachtworst,2007-01-24T09:27Z,Thanx a bunch!
,kcarson,2007-02-21T19:29Z,I can't install it because I don't find the crack-file.
,kcarson,2007-02-21T19:38Z,"Now I know how: After mounting, right-click and choose 'explore'. You'll find the crack there."
,kapa2183,2007-02-25T22:45Z,"Hello! Does anyone know if this WordFinder version should work with Windows Vista? 
Does not work for me. Does anyone know if one should use the product codes from the keygen? Because I only used the dictionary codes, the installation only asked for that."
,kapa2183,2007-02-26T00:32Z,"Ok, I found out that it works with Vista, thanks anyway. "
,DranZoch,2007-03-21T17:20Z,Jag bara undrar om någon vet om Wordfinder 9.0 har släppts eller om någon kan lägga upp den??
,Renaldo,2007-03-31T23:02Z,Men kan ingen lägga upp 9:an för i HELVETE?
,Cirya,2007-04-24T19:29Z,"You can download the software for free, 30 day trial, but a keygen or crack for Wordfinder 9 whould  be great..."
,rollson,2007-05-03T18:27Z,"Please, anyone seed?"
,Tony73,2007-05-12T22:25Z,"Good program Keygen was hard to understand.
need spec. key to each program.

Seeding when needed."
,Buster_Tintin,2007-07-04T16:37Z,"Fortfarande ingen som har 9:an?
Det räcker ju iofs med själva programmet, men hela CD/DVD med alla de nya lexikonpaketen hade ju varit ännu bättre... ;-)"
,partyboat,2007-07-21T15:07Z,"efter ni laddat hem så stanna kvar och seeda e ni snälla.

After Eftedownloading please stay and seed"
,boy_100,2007-08-10T03:09Z,tack i förväg letat efter ett sådant här program ska seeda länge
,Doors_Jim,2007-08-16T22:35Z,"Förstår att många blir irriterade på oss nybörjare, men jag fixar inte att få igång programmet. Har packat upp i winrar. Fick två filer, b.la. en cue fil. Vet sen inte hur jag ska göra med den. Vad är ""mounta? Hur gör jag?"
,tubelubs,2007-09-06T15:45Z,"Please seed folks and I'll be forever grateful. Need this badly, but transfer is very slow..."
,ithaki,2007-10-05T09:15Z,"Ursäkta mig.Men jag vet ej,hur jag får fram keygen i crack-katalogen.Någon som kan förklara för mig.Tack på förhand. "
,jakoppen,2007-10-26T14:56Z,"Does anyone know what to do in order to get Wordfinder to work in Vista? It is installed correctly but when I start the program there is only a message saying ""Aktivera Wordfinder med shift+Ctrl"". But nothing happens when pushing shift+Ctrl and the program itself doesnt start what so ever. Please can anyone help!?"
,fjorren,2007-12-25T16:52Z,HUr faen funkar keygenen jag kan inte få i gång dem
,JaneAustenLover,2008-01-21T08:33Z,"Hej, jag måste fylla i ""Företag/Distribution"" för att kunna fortsätta. Vad ska jag fylla i? Hittar inte heller lösenordet/key... Tack på förhand!! :)"
,JaneAustenLover,2008-01-21T18:39Z,"Någon som kan ange kodnycklarna direktt här, alt. säga vilken fil de finns i? Hittar verkligen inget annat än massor av olika aoword8p.rar filer e.d. och när jag klickar på dem så får jag upp annat än kodnycklar :| Tack på förhand!!"
,JaneAustenLover,2008-01-22T07:05Z,"Jag får bara upp:

FILE ""AOWORD8P.BIN"" BINARY
  TRACK 01 MODE1/2352
    INDEX 01 00:00:00

när jag högerklickar på aoword8p.cue-filen. Vilken av alla aoword8p är det jag ska klicka på, det finns ju många? Hur får man upp crackmappen??"
,trygge-tore,2008-01-25T15:27Z,"Doors_Jim,

Att mounta betyder att man fejkar en cd-skiva. Alltså att din cue-. eller iso-fil ser ut som en cd-skiva för datorn utan att du har en fysisk skiva. Ladda ner DAEMON Tools från exempelvis Internet och öppna filen därifrån. Ett annat bra verktyg man ofta har användning för i piratbukten är MagicISO, ett annat är BlindWrite, ett tredje är WinUHA, ett fjärde är WinRAR. Allt beror på hur mycket krångel packaren eller crackaren vill att du ska ha... ;-)"
,trygge-tore,2008-01-30T00:06Z,"HeyHo Pirates!

Installerade fint i Vista64. Det här är mycket bra grejer från ABSOKT. Cred!

Instruktioner.

När du tankat ner filerna ser du en .nfo fil samt en massa .RAR filer. NFO-filen kan du öppna i Word, obs med MS-dos tecken samt landscape layout. 

Programmet ligger i de 28 RAR-filerna och det är den sista, (utan siffra) du ska öppna med WinRAR. Du måste installera WinRAR separat.

När du packat upp detta får du fram två filer: en .cue-fil och nån till. Dessa utgör en kopia (image) av en specifik CD-skiva. Det är nu du ska ""mounta"" denna image. Det gör du med Daemon Tools. Installeras också separat, se föregående post.

När du mountat denna stänger du dina fönster och öppnar My Computer. Där hittar du nu en ny virtuell cd-spelare bredvid din ordinarie fysiska. Denna ska du nu INTE öppna eftersom att vi är pirater;) 

Istället ska du högerklicka och välja Explore. Där hittar du en massa mappar varav en heter Crack. I denna ligger ett program som visar nycklarna till det du vill installera. Nu när du hittat hit kan du gå tillbaka ett steg till skivans root och klicka på Install.exe. 

Obs: Suite betyder Norstedts stora en-sv. Skribent betyder olika svenska ordböcker. Men alla dessa kan senare väljas i det högra huvudalternativet. Resten går att lista ut från programmets egen dokumentation. Har själv installerat ett 80-tal ordböcker..."
,trygge-tore,2008-01-30T00:26Z,"Man måste först ange en nyckel där själva programmet wordfinder ingår, hittas i crack-mappen. Sedan måste man ange nycklarna för varenda lexikon man vill ha med (oxå i crack-mappen), max 15 lexicon per installationsomgång. Man måste alltså börja om från början flera gånger... Inte slipstreamat för fem öre alltså- men det funkar!"
,mrnomore,2008-02-29T14:31Z,"AHhhh YES!

min WF skiva e borta så jag tackar såååååååå mycket för denna!! :D :D :D"
,Great_Chaos,2008-03-01T19:50Z,"Bra torrent inge skumt eller så.
Och dålig dl speed ska vi inte tala om, jag låg på ett jämt och fint 800kB/s :P"
,olle bull,2008-03-16T22:10Z,Jag kan inte begripa var lexikonen finns någonstans. Man skall väl bara behöva använda en enda av kodnycklarna vid installationerna? Kan någon förklara hur man får lexikonen. Nu är programmet bara tomt.
,duckland,2008-05-05T19:19Z,"Ett sätt att snabbt installera kodnycklar:
http://thepiratebay.org/tor/3701841/(Almost)_Unatended_installation_av_lexikon_till_Wordfinder...Smi
eller
http://thepiratebay.org/tor/3701551/Installation_av_lexikon_till_WORDFINDER.rar
Jag tröttnade på att skriva in nycklarna för hand så jag knåpade ihop ett sött litet makro. 
Dessutom fungerar wordfinder fint i linux (Ubuntu åtminstone) med hjälp av programet Wine. Ha en bra dag!"
,Pellen,2008-05-18T14:47Z,"Bra program. tack till uploader!

Jag skulle dock vilja ha Svensk-Norsk ordbok och en Norsk Synonymordbok. Men det fanns inte. typisk min otur!  :O)"
,nordhedning,2008-05-19T07:14Z,"När man angivit nycklarna för de 15 ordlistorna så beöver man INTE BÖRJA OM installationen - det räcker att klicka på Next och sedan Back och tömma fälten och börja mata in nycklar igen. På så sätt kan man mata in alla ordlistor i en installation. Gankska ""slipstreamat för fem öre"" :)"
,GUload,2008-09-20T20:13Z,"
Om ni ej vill ha förstörda ordlistor så...
... http://thepiratebay.org/torrent/4405706/WordFinder_9.2_pro_-_SWE"
,jankop,2008-12-30T12:18Z,"sök efter Magic ISO och installera eller andvänd
ett annat program DAEMON Tools  Lycka till"
,ivokaaa,2009-02-09T16:12Z,"can any one plz tell me if there is anyway to make it work with vista ?
























"
,ivokaaa,2009-02-09T16:12Z,can any one plz tell me if there is anyway to make it work with vista ?
,Ulfelfwing,2009-02-12T15:31Z,"Till er som inte vet hur ni skall hantera Bin/Cue-filer.
Dessa funkar precis som alla andra Image-filer typ .img och .iso.
Ni ""Mountar"" dem med hjälp av ett program som heter (ex.) Deamontools som är freeware och nedladdningsbart från en massa siter. Googla."
,Vice.,2009-05-17T16:46Z,Någon som föklara det där emd cracket? Finns bara en fil i mappen crack och den ger mig bara 9 koder? CMDNJHOJ tex 9 sådana finns det? Men jag får ändå inte fram ordlistorna trotts guiden här. Tack på förhand//Vice
,Vice.,2009-05-17T17:31Z,"Vill tack för detta det funkade perfekt! Felet jag gjorde, och antagligen många fler var att jag missade att det fanns en lista på cracken. Jag tog bara de nio som fanns där och det var inte rätt. När ni tar fram cracken klicka då längst upp så får ni fram rätt koder till rätt platts!

works whit vista! =)"
[T],muzik62,2010-02-04T03:26Z,Tackar så mycket. Den fungerar korrekt.
,lunanegra,2010-08-03T19:50Z,"It doesn work for me, Instalation was ok. I get a list with all the langs at the end. But when I start Wfr it just shows att the task bar. Can never maximixe the program width crtl+shift. or any way."
,lunanegra,2010-08-03T19:54Z,by the way: XP
,lunanegra,2010-08-03T20:35Z,"Found a solution to my problem when WF not appear.
Trial and error. I right click Wfwin32.exe in the installation folder and chose Properties. Then the tab Compatibility I selected
""run this program in compability mode for"" Windows NT4... Miracle! it works!."
,Lasaruz,2011-03-24T21:49Z,Thank you!
