User Type,Username,Date,Text
,trond2069,2007-12-01T20:43Z,Tackar så mycket JULLEVIK
,thesoftparade,2007-12-15T14:38Z,"Du har alltid bra uppladdningar Jullevik! 

Upskattar otroligt mycket att du har hög bitrate samt inkluderar både covers och CD label.

Tack så väldigt mycket!"
,jennyake,2008-02-05T18:17Z,Kanon! Tusen tack!
[T],nordpol,2008-03-11T01:04Z,"Hej,Jullevik du har möjligt vis inte hits love 2 cd 2008. Tackar På Förhand."
,hunterblank,2008-06-07T21:25Z,har någon hits for kids 19 
,hunterblank,2008-06-07T21:27Z,"tack fär världens bäta cd tack ty 
tack jullevik"
,raptorrex666,2008-08-27T13:50Z,Kanon...
