User Type,Username,Date,Text
,idiotsdayout,2006-12-11T20:28Z,can any1 tell me how many episodes there is in s1 there is only 13 up ? if more can any1 help please thanx ....
,Consider-Phlebas,2006-12-12T20:02Z,"13 eps in season 1, if you don't count the pilot.

A tip, use a web search engine. But - since I already did it for you:

http://www.tv.com/battlestar-galactica-2003/show/23557/episode_listings.html?om_act=convert&om_clk=tabssh&tag=tabs;episodes"
,kajl,2007-01-19T21:07Z,"all you pyt up here or at other sites has passwords or spyware shit.
Fuck off the WWW you  asshole motherfucker!!!!!"
,goot245,2008-03-05T22:20Z,kajl little pissed you must b an iraqi  lol
,Elesker,2009-05-04T15:59Z,"@ goot245
you fucking asshole you fucking racist fucking burn in hell "
