User Type,Username,Date,Text
,thatsmine,2005-08-08T00:43Z,"Sure ! and tommorow never comes ...as it it ALWAYS today ...

don't let him fool You !!!
he's not seeding"
,dr seg,2005-08-08T01:49Z,"ur wrong buddy, he is seeding!!"
,julie2,2007-11-21T00:43Z,thnks mate can yous tell me wher i can get uther kaitracid tunes :)
,lukesaber,2010-09-07T12:59Z,"Great upload, speed was acceptable for the amount of seeders, quality is great.

my only problem is that none of the id3 tags were made out correctly, the track numbering is different from that of the album, and the Contemplate album is missing track 7.

otherwise great."
