User Type,Username,Date,Text
,teckla3,2006-09-26T18:33Z,"THX  Jag vann denna före förra julen...men på PSP, så jag gjorde inte så mkt med den..när det är ett PS2 jag har.Tack för uppen"
[V],Middleman,2006-09-29T15:44Z,"jag får inte en riktigt r17-fil
finns det någon som fått?"
,oblachubs,2006-09-30T03:05Z,Please re-upload file 17.  It's corrupt. I downloaded it twice to make sure it wasn't me.
,Botre,2006-09-30T11:38Z,have problems with r17 to.   is it uploaded again?
,oblachubs,2006-09-30T18:07Z,He can't upload it here. 17 has to be another torrent.  kevinfer please do again.
,jeesjees,2006-10-31T19:30Z,no god
,djPRO_tach,2006-12-09T10:39Z,bara jag som har problem med att packa upp denna filen??? säger att en av filerna e skadade... please help!
