User Type,Username,Date,Text
,beware,2005-02-11T11:39Z,N책gon som har en text som passar till den h채r?
,IceBone,2005-02-11T18:23Z,I already got rid of the DVD image. Try www.subscene.com.
,Duci,2006-03-27T20:48Z,Hi...please someone seed...i'm at 99.7%...Thanx
,vhg,2006-07-31T17:05Z,Needed seeds for such a good moviee
,vhg,2006-08-01T09:02Z,Please seed people !!!
,vhg,2006-08-04T06:20Z,ANYBODY PLEASE SEED !!!
,vhg,2006-08-05T07:29Z,Please please please seed !!!
,vhg,2006-09-03T13:42Z,please seed anyone !!!
