User Type,Username,Date,Text
,atamemet,2007-01-05T09:35Z,"what is this piece of crap???

r u selling these? then why u give em away for free here???

Gee some idiots...!"
,striker_udec,2007-06-14T02:07Z,"por favor sigan sedeando, estoy muy interesado en bajar estos dvds, espero que suban la serie completa en espa単ol

pease continuos seeding, i am very interested in download these dvds. I hope you upload the complete series in spanish"
,kirtarpk3,2008-04-16T16:04Z,"esk yo no se pork se kitan de seeders, pork no entiendo entonces como kieren k funcione esto al final se acabara iendo a la mierda

deberian seguir de seeders o esto se acabara"
