User Type,Username,Date,Text
,necator,2005-04-08T02:24Z,wohoo...jag e ju med där..tror jag...får tanka hem den o kolla nogrannt
,neitekz,2005-07-01T23:05Z,Hur i helvete tankar man ner den?
,havoka,2006-05-13T16:09Z,"Fan va bra det skulle vara om spelfirman som gjord detta kunde göra en riktig film av detta :)
animerad ska det vara också då"
,pata_89,2006-06-21T17:15Z,how do u down load this shit??
,fulper,2006-12-14T19:43Z,"if you cant be arsed to find out how to download this you dont deserve it, and if you play wow you are probably better off without it, you dont wanna waste time watching this when you can be GRINDING!!!!11one"
,Itachi42,2007-09-05T15:49Z,Can some1 help me plz! when I downloading things I don`t get the full thing downloaded just like some kb when it shoud be 1gb or something can some1 tell me what I shoud do and what I do wrong plz? 1 more thing when I downloaded them they are just empty I need to open them up whit something but can only choose to open whit words and paint and sucht stuff :S
,BattlefieldGotland,2008-09-24T18:57Z,you must have WinRar
