User Type,Username,Date,Text
,ILYA2606,2008-01-31T19:28Z,How to you game?
,Firal,2008-03-11T06:01Z,"???????, ?????. ???????, ?????????? ??? ??????."
,Firal,2008-03-11T18:29Z,"Ya hotel skazat', 4to ka4aet medlenno i pe4al'no =)
No vsyo ravno spasibo... hotya pros4e poyti kupit', 4em nedelyu zhdat' zaka4ki"
,ILYA2606,2008-04-22T12:08Z,"Firal , ia razdayu so skorostiu 50 kb/s + esche 3 sidera, tak chto skorost' normalnaya!"
,neoliver,2008-07-05T10:51Z,"pls, don't leave this treker("
,neoliver,2008-07-06T08:23Z,??? ?????? ?????????? ? ?? ????????? 5 ??/c?? ???????? ???? ???? ???? ??????????
,neoliver,2008-07-06T08:28Z,tak slogno datj dokachatj? ja so skorostju 5 kB/sec budu vechnostj dockachivatj. Eto teperj tak modno - svalivatj s razdachi posle 90 %? 
