User Type,Username,Date,Text
,LWan,2007-05-14T07:09Z,"Hoppaas det ska funka nu, sorry för andra missen, vet inte varför den inte ville gå igång. SÅ håll tillgodo nu

//LWan"
,zsazsasallad,2007-05-14T07:45Z,Tack! Nu så är det igång.
,rosasune,2007-05-14T21:14Z,Tusen tack
,rogga1250,2007-06-04T15:20Z,"Tack, den här boken var helt ok!"
,oxygene1,2008-02-27T08:39Z,tusen tack för boken
,oxygene1,2008-02-27T08:54Z,tusen tack
,grimeton,2008-05-08T19:08Z,"Snälla! Seeda den här boken. Har försökt flera gånger men det blir aldrig färdigt, just nu 10,6 %.  Återkommer hela tiden till den här boken. Vill så gärna lyssna på den! TAck för uploaden!"
,Bratwustle,2008-12-08T10:44Z,"Sitter fast på 98,7 %. Någon som orkar hjälpa till???"
,bohjo,2009-02-17T12:41Z,någon vänlig själ som kan tänka sig att seeda lite ??
,bohjo,2009-02-25T08:54Z,tackar laddar ner sakta men säkert !!!
,bohjo,2009-02-26T16:45Z,så där ja nu har jag oxså kunnat ge tillbaka det jag lånat i detta bibliotek
,stevebull09,2011-06-29T00:22Z,"Den här lånar vi. Tack LWan
Vore taxsam för seed"
