User Type,Username,Date,Text
,gayniggersfromchina,2006-10-01T10:15Z,Synd att du klippt bort en del av bilden och har fel ratio...
,viva la roos,2006-10-01T10:39Z,asså jag har inte sett filmen elle nått ja laddade bara ner den och brände texten för att jag vill att vi svenskar ska få mer filmer med svensk text att ladda ner
,viva la roos,2006-10-01T10:39Z,vad menar du med fel ratio??
,gayniggersfromchina,2006-10-01T14:21Z,"""Raw"" ska vara 1.85:1
608x400 blir 1.52:1.

Så rätt ratio blir 608x328, eller ännu hellre 720x390 eftersom det är närmast DVD-upplösning."
,viva la roos,2006-10-01T17:00Z,hur fixar man de då??
,gayniggersfromchina,2006-10-01T19:44Z,Rippa om. Rippa rätt.
,viva la roos,2006-10-01T19:59Z,men åhh har ju inte rippat den ladda bara ner den
