User Type,Username,Date,Text
,JHT7000DK,2004-12-18T16:25Z,Tak for de dansk tekstede film og fordi du lægger dem ud i mpg det er bare dejligt.
,want_you,2005-01-20T21:18Z,"Takker for de danske tekster :)
keep up the good work.."
,Gpower,2005-02-24T14:59Z,takker også for dansk sub. men er strandet ved 82%
,blueskye,2005-03-10T23:03Z,"Tusen takk for dansk dekst, og for at du lastet opp denne filmen :-) tror jeg trenger lit hjelp. Har ståt på 96,9% i 24 timer nå. kan noen seeda please. "
,Mrcrazy,2005-03-29T18:03Z,Sender du ikke? Har 96% :(
