User Type,Username,Date,Text
,biggidude,2007-05-22T15:14Z,"this torrent is not the best, the sound was broken or somthing, and the quality was pretty lame :("
,JLJ27,2007-05-22T16:37Z,Damn you must have a fast connection if you've seen this version just 6 minutes after it was uploaded. Which company delivers your connection? I want it!
,laddare,2007-05-22T17:34Z,Language?
,mixdcrysy,2007-05-22T22:56Z,"I have DIVX codec, KLITE Mega 2.0 codec, CCPSP, CCPSP2, and Xvid codecs so if you dont have them, that might be why the video and audio are not in sync for you. The divx and klite codecs are free. I hope this helps."
,ursule,2007-05-23T16:36Z,"""I have DIVX codec, KLITE Mega 2.0 codec, CCPSP, CCPSP2, and Xvid codecs so if you dont have them, that might be why the video and audio are not in sync for you. The divx and klite codecs are free. I hope this helps.""
This is a dvd, it doesn't have anything to do with the codecs you mentioned.
It just takes a software or hardware dvd player to watch.
One might wonder why the author of the conversion doesn't know such an obvious thing."
,Mr. Versa,2007-05-24T03:19Z,Yes but is this a good quality version or what? I need a little more insight please..Who's downloaded this?
,gullz,2007-05-29T03:54Z,seed plz!!!!!!
,LookenHard,2007-06-02T03:10Z,WARNING!  Does not show well on bigscreen. All bunched up in the middle. Why dont you let us do our on converting and just post it as an .avi. To bad cuz the pic quality wasnt to bad if you can watch short fat people.
,maxkill,2007-06-25T21:01Z,why download a cam release in dvd format? why watch this movie in bad quality..!? it has awesome SPECIAL EFFECTS ffs !! =) me will wait..
