User Type,Username,Date,Text
,Angel Of Darkness,2007-02-21T22:15Z,is it only me or is the speed a bit too low ??? and is this any good the last i downloaded wasent working and after i deleted it the fix came out and NO WAY im not gonna dl it again...
,Angel Of Darkness,2007-02-21T22:19Z,sorry about that the speed suddenly went from bs to kbs nice :D:D
,lozory,2007-02-23T02:30Z,"man this is comin slow, so many seeders and people but hardly any bein generous! u shudnt even b here!"
,nohead,2007-03-03T19:10Z,Great reencode. Speed is pretty fast for me...
,lozory,2007-03-05T10:12Z,"yep went fast for me too once i got a better client! uTorrent rocks:) quality is pretty good too, definately watchable"
,El_Guapo69,2007-03-30T20:17Z,OH but WHY is it RARed?
