User Type,Username,Date,Text
,ValkyrieAE,2007-08-06T09:19Z,"Why are they all in WMA??
Not cool!"
,windy_city_rebel,2007-08-23T19:58Z,i cant even play this...whats up with that?
,coat-hanger-abortion,2007-09-26T04:04Z,"wtf, just convert the freakin files.  Do a simple google search.  A. its Minor Threat, and B.  its free, don't bitch"
,superlucky,2008-04-16T08:03Z,Thanks BrettvN!  I converted  the files to .mp3 and am seeding a torrent with them.
,b0a,2009-01-17T14:05Z,May i ask how i convert the files :P?
,nz_flyboy,2009-04-08T03:26Z,"Convert wma to mp3 using an earlier 'registered' version of winamp (Microsoft threatened nullsoft with legal shit 'cos of winamps ability to write decoded wma files to disc- so this was removed in later versions). Set output to write to disc, and set output format to what you want- like mp3, wav.  (EAC can do high quality wav to mp3 compressions if lame codec is used)"
