User Type,Username,Date,Text
,majidi,2008-11-13T19:32Z,stoped in 95%!!!!!!!!!
,markogr,2009-07-19T00:54Z,"the movie stopped in 95%
does someone know where i can download this movie to the end
please help i need this movie because i m an kung fu fanatic
james kees if you are reading this please know that the 2 movies that are my favourites that you have uploaded here on pirate bay(king of kung fu , six epreuves de la mort aka enter the game of death) arent working and they can t be downloaded
the king of kung fu movie stopped at 95%,
and the six epreuves de la mort aka enter the game of death stopped at 77%
please helpc i need this movies 
you are my last hope
greetings"
