User Type,Username,Date,Text
,ray4389,2008-07-16T05:24Z,"Amazing Download--Free of viruses, etc and has keygen
"
,nordhedning,2008-09-07T20:10Z,"Great Upload! 

At last someone that fights the mainstream and uploads a hard-to-find-and-desired-application instead of uploading an 89th release of M$ Office and scream like a pig that ""the UL contains VIRUS!!!!!!!"" o.m.g. yes - can you believe it? It has a keygen in it! Oh my! You don't mean that? oh yes I do. But isn't that a virus? well the AV apps says many are. But don't we need keygens and cracks to use the application that we are at TPB to download? yes! Then what to do???
DUUUUUUUUUUHHH!!!!!!!!!!

Sorry, just felt to express some energy om those virus-shouters.

Anyway - gr8 UL! :)"
,duhprane,2008-10-23T06:29Z,Yeah like he said...
,zeinabqureshi,2009-01-02T09:38Z,"OMG, this torrent is coming like an electric train... and like @norhedning said...or rather, couldn't have said it better. Great many thanks."
,antonysch,2009-11-24T20:08Z,"thank you my friend looked all over for ages for this:-)
i'll add some to the download speed (10mbit)"
