User Type,Username,Date,Text
,harpie17,2007-06-09T16:20Z,"Thanks for putting this up.

Please seed! I'm stuck at 76%.  Please seed!!!"
,VincentVonDarkness,2008-04-08T23:38Z,"Thanks for the upload, I have been looking for this for sometime now. Not many of the classic movies have been uploaded by anyone until lately. I have been trying to find backups of all my old VHS's and now I can get them. Thanks once again.

Video   =  10
Sound  =  10"
,supermegaman,2008-06-20T22:55Z,Thank you kind sir! =)
,SilwythTheDamned,2011-07-16T01:03Z,OMG THANK YOU THANK YOU THANK YOU!!! :D :D
